Year,Rnd,DT,OvPck,RdPck,Signed,Bonus,Name,Pos,WAR,G,AB,HR,BA,OPS,G.1,W,L,ERA,WHIP,SV,Type,Drafted Out of,Round
2007,7,,223,9,Y,"$120,000",Bryan Augenstein (minors),RHP,-0.9,12.0,4.0,0.0,0.25,0.65,12.0,0.0,2.0,8.34,1.9,0.0,4Yr,"University of Florida (Gainesville, FL)",7
2006,7,,207,11,Y,"$115,000",Daniel Stange (minors),RHP,-0.4,4.0,0.0,0.0,,,7.0,0.0,1.0,14.29,2.47,0.0,4Yr,"University of California, Riverside (Riverside, CA)",7
2005,7,,201,1,Y,"$110,000",Anthony Cupps (minors),RHP,,,,,,,,,,,,,4Yr,"University of Mississippi (Oxford, MS)",7
2004,7,,206,15,Y,"$90,000",Koley Kolberg (minors),RHP,,,,,,,,,,,,,4Yr,"University of Arizona (Tucson, AZ)",7
2003,7,,216,29,Y,"$88,000",Dustin Glant (minors),RHP,,,,,,,,,,,,,4Yr,"Purdue University (West Lafayette, IN)",7
2002,7,,219,27,Y,,Matt Henrie (minors),RHP,,,,,,,,,,,,,4Yr,"Clemson University (Clemson, SC)",7
2001,7,,218,22,Y,,Chad Tracy (minors),3B,5.4,938.0,2706.0,86.0,0.274,0.772,,,,,,,4Yr,"East Carolina University (Greenville, NC)",7
2000,7,,219,29,Y,,Tim Olson (minors),OF,-0.4,51.0,99.0,2.0,0.182,0.615,,,,,,,4Yr,"University of Florida (Gainesville, FL)",7
1999,7,,208,4,Y,,Ryan Owens (minors),SS,,,,,,,,,,,,,4Yr,"California State University, Fullerton (Fullerton, CA)",7
1998,7,,223,30,Y,,Jeff Pass (minors),LHP,,,,,,,,,,,,,HS,"New Castle HS (New Castle, IN)",7
1997,7,,233,29,Y,,Brian Gordon (minors),OF,0.2,1.0,1.0,0.0,0.0,0.5,5.0,0.0,1.0,4.4,1.33,0.0,HS,"Round Rock HS (Round Rock, TX)",7
1996,7,,215,30,N,,Casey Fossum (minors),LHP,-1.0,46.0,46.0,0.0,0.087,0.193,237.0,40.0,53.0,5.45,1.52,2.0,HS,"Midway HS (Waco, TX)",7
2023,8,,235,11,Y,"$175,000",Jackson Feltner (minors),1B,,,,,,,,,,,,,4Yr,"Morehead State University (Morehead, KY)",8
2022,8,,228,2,Y,"$196,000",Adrian Rodriguez (minors),SS,,,,,,,,,,,,,HS,"International Baseball Academy (Ceiba, Puerto Rico)",8
2021,8,,228,6,Y,"$500,000",Gavin Conticello (minors),3B,,,,,,,,,,,,,HS,"Marjory Stoneman Douglas HS (Parkland, FL)",8
2019,8,,242,15,Y,"$170,300",Dominic Canzone (minors),RF,-0.1,59.0,173.0,6.0,0.22,0.657,,,,,,,4Yr,"The Ohio State University (Columbus, OH)",8
2018,8,,249,25,Y,"$350,000",Levi Kelly (minors),RHP,,,,,,,,,,,,,HS,"IMG Academy (Bradenton, FL)",8
2017,8,,232,7,Y,"$150,000",Tim Susnara (minors),C,,,,,,,,,,,,,4Yr,"University of Oregon (Eugene, OR)",8
2016,8,,239,13,Y,"$350,000",Ryan January (minors),C,,,,,,,,,,,,,JC,"San Jacinto College, North Campus (Houston, TX)",8
2015,8,,226,1,Y,"$177,100",Kal Simmons (minors),SS,,,,,,,,,,,,,4Yr,"Kennesaw State University (Kennesaw, GA)",8
2014,8,,240,15,Y,"$157,500",Grant Heyman (minors),LF,,,,,,,,,,,,,JC,"College of Southern Nevada (Henderson, NV)",8
2013,8,,240,14,Y,"$125,000",Brad Keller (minors),RHP,9.1,9.0,16.0,0.0,0.125,0.302,150.0,38.0,53.0,4.27,1.45,1.0,HS,"Flowery Branch HS (Flowery Branch, GA)",8
2012,8,,273,25,Y,"$132,900",Evan Marzilli (minors),CF,,,,,,,,,,,,,4Yr,"University of South Carolina (Columbia, SC)",8
2011,8,,244,3,Y,"$105,000",Jesse Darrah (minors),RHP,,,,,,,,,,,,,4Yr,"Fresno Pacific University (Fresno, CA)",8
2010,8,,241,6,Y,"$750,000",Tyler Green (minors),RHP,,,,,,,,,,,,,HS,"Brazoswood HS (Clute, TX)",8
2009,8,,246,15,Y,"$95,000",Paul Goldschmidt (minors),1B,61.7,1774.0,6520.0,340.0,0.293,0.908,,,,,,,4Yr,"Texas State University (San Marcos, TX)",8
2008,8,,258,26,Y,"$30,000",Pat McAnaney (minors),LHP,,,,,,,,,,,,,4Yr,"University of Virginia (Charlottesville, VA)",8
2007,8,,253,9,Y,"$97,500",Taylor Harbin (minors),2B,,,,,,,,,,,,,4Yr,"Clemson University (Clemson, SC)",8
2006,8,,237,11,Y,"$82,500",Chase Christianson (minors),RHP,,,,,,,,,,,,,4Yr,"University of South Alabama (Mobile, AL)",8
2005,8,,231,1,Y,"$80,000",Ryan Schreppel (minors),LHP,,,,,,,,,,,,,4Yr,"California State University, Fullerton (Fullerton, CA)",8
2004,8,,236,15,N,,James Shull (minors),RHP,,,,,,,,,,,,,4Yr,"California Polytechnic State University, San Luis Obispo (San Luis Obispo, CA)",8
2003,8,,246,29,Y,"$80,000",Robbie Van (minors),LHP,,,,,,,,,,,,,4Yr,"University of Nevada, Las Vegas (Paradise, NV)",8
2002,8,,249,27,N,,Ryan Mahoney (minors),C,,,,,,,,,,,,,HS,"Carmel HS (Carmel, NY)",8
2001,8,,248,22,Y,,Brandon Medders (minors),RHP,2.5,205.0,5.0,0.0,0.0,0.0,210.0,16.0,7.0,3.61,1.44,1.0,4Yr,"Mississippi State University (Mississippi State, MS)",8
2000,8,,249,29,Y,,Brandon Webb (minors),RHP,31.1,187.0,391.0,0.0,0.113,0.27,199.0,87.0,62.0,3.27,1.24,0.0,4Yr,"University of Kentucky (Lexington, KY)",8
1999,8,,238,4,Y,,Chris Capuano (minors),LHP,8.9,252.0,371.0,1.0,0.124,0.307,316.0,77.0,92.0,4.38,1.36,0.0,4Yr,"Duke University (Durham, NC)",8
1998,8,,253,30,Y,,Andrew Good (minors),RHP,0.4,31.0,21.0,0.0,0.095,0.186,35.0,5.0,4.0,5.3,1.35,0.0,HS,"Rochester HS (Rochester Hills, MI)",8
1997,8,,263,29,Y,,Ron Calloway (minors),OF,-1.3,172.0,424.0,10.0,0.224,0.612,,,,,,,JC,"Ca�ada College (Redwood City, CA)",8
1996,8,,245,30,Y,,Joe Verplancke (minors),RHP,,,,,,,,,,,,,4Yr,"California State University, Los Angeles (Los Angeles, CA)",8
2023,9,,265,11,Y,"$135,000",Kyle Amendt (minors),P,,,,,,,,,,,,,4Yr,"Dallas Baptist University (Dallas, TX)",9
2022,9,,258,2,Y,"$75,000",Gavin Logan (minors),C,,,,,,,,,,,,,4Yr,"Oregon State University (Corvallis, OR)",9
2021,9,,258,6,Y,"$30,000",Jake Rice (minors),P,,,,,,,,,,,,,4Yr,"Kennesaw State University (Kennesaw, GA)",9
2019,9,,272,15,Y,"$100,000",Bobby Ay (minors),P,,,,,,,,,,,,,4Yr,"California Polytechnic State University, San Luis Obispo (San Luis Obispo, CA)",9
2018,9,,279,25,Y,"$144,800",Tyler Holton (minors),LHP,3.1,0.0,0.0,0.0,,,69.0,3.0,2.0,2.19,0.89,1.0,4Yr,"Florida State University (Tallahassee, FL)",9
2017,9,,262,7,Y,"$10,000",Cam Duzenack (minors),SS,,,,,,,,,,,,,4Yr,"Dallas Baptist University (Dallas, TX)",9
2016,9,,269,13,Y,"$125,000",Tommy Eveld (minors),RHP,,,,,,,,,,,,,4Yr,"University of South Florida (Tampa, FL)",9
2015,9,,256,1,Y,"$295,000",Pierce Romero (minors),RHP,,,,,,,,,,,,,JC,"Santa Barbara City College (Santa Barbara, CA)",9
2014,9,,270,15,Y,"$25,000",Justin Gonzalez (minors),SS,,,,,,,,,,,,,4Yr,"Florida State University (Tallahassee, FL)",9
2013,9,,270,14,Y,"$10,000",Grant Nelson (minors),C,,,,,,,,,,,,,4Yr,"St. Louis University (St. Louis, MO)",9
2012,9,,303,25,Y,"$90,000",Jeff Gibbs (minors),RHP,,,,,,,,,,,,,4Yr,"University of Maine (Orono, ME)",9
2011,9,,274,3,Y,"$80,000",John Leonard (minors),SS,,,,,,,,,,,,,HS,"Connellsville Area HS (Connellsville, PA)",9
2010,9,,271,6,Y,"$97,500",Zach Walters (minors),SS,-0.2,85.0,170.0,10.0,0.177,0.609,,,,,,,4Yr,"University of San Diego (San Diego, CA)",9
2009,9,,276,15,Y,"$85,000",Chase Anderson (minors),RHP,8.1,173.0,275.0,0.0,0.091,0.209,218.0,59.0,56.0,4.35,1.3,1.0,4Yr,"University of Oklahoma (Norman, OK)",9
2008,9,,288,26,Y,"$120,000",Brett Moorhouse (minors),RHP,,,,,,,,,,,,,JC,"Indian River State College (Fort Pierce, FL)",9
2007,9,,283,9,Y,"$95,000",Mark Hallberg (minors),SS,,,,,,,,,,,,,4Yr,"Florida State University (Tallahassee, FL)",9
2006,9,,267,11,Y,"$75,000",Eddie Romero (minors),LHP,,,,,,,,,,,,,4Yr,"California State University, Fresno (Fresno, CA)",9
2005,9,,261,1,Y,"$23,000",Josh Ford (minors),C,,,,,,,,,,,,,4Yr,"Baylor University (Waco, TX)",9
2004,9,,266,15,Y,"$65,000",A.J. Shappi (minors),RHP,,,,,,,,,,,,,4Yr,"University of California, Riverside (Riverside, CA)",9
2003,9,,276,29,Y,"$50,000",Steve Garrabrants (minors),2B,,,,,,,,,,,,,4Yr,"Arizona State University (Tempe, AZ)",9
2002,9,,279,27,Y,,Klent Corley (minors),RHP,,,,,,,,,,,,,4Yr,"Grand Canyon University (Phoenix, AZ)",9
2001,9,,278,22,Y,,Jarred Ball (minors),OF,,,,,,,,,,,,,HS,"Tomball HS (Tomball, TX)",9
2000,9,,279,29,Y,,Tanner Eriksen (minors),RHP,,,,,,,,,,,,,4Yr,"University of Southern California (Los Angeles, CA)",9
1999,9,,268,4,Y,,Matt Kata (minors),SS,-0.7,278.0,695.0,12.0,0.239,0.66,,,,,,,4Yr,"Vanderbilt University (Nashville, TN)",9
1998,9,,283,30,N,,Brendan Fuller (minors),RHP,,,,,,,,,,,,,HS,"Clearwater HS (Clearwater, FL)",9
1997,9,,293,29,Y,,Justin Singleton (minors),SS,,,,,,,,,,,,,HS,"St. Paul's HS (Lutherville, MD)",9
1996,9,,275,30,Y,,Marc Van Wormer (minors),RHP,,,,,,,,,,,,,HS,"Prescott HS (Prescott, AZ)",9
2023,10,,295,11,Y,"$155,000",Zane Russell (minors),P,,,,,,,,,,,,,4Yr,"Dallas Baptist University (Dallas, TX)",10
2022,10,,288,2,Y,"$55,000",Brett Johnson (minors),OF,,,,,,,,,,,,,4Yr,"Southern Illinois University Edwardsville (Edwardsville, IL)",10
2021,10,,288,6,Y,"$100,000",Hugh Fisher (minors),P,,,,,,,,,,,,,4Yr,"Vanderbilt University (Nashville, TN)",10
2019,10,,302,15,Y,"$125,000",Oscar Santos (minors),C,,,,,,,,,,,,,HS,"PJ Education School (Carolina, Puerto Rico)",10
2018,10,,309,25,Y,"$137,300",Nick Dalesandro (minors),C,,,,,,,,,,,,,4Yr,"Purdue University (West Lafayette, IN)",10
2017,10,,292,7,Y,"$10,000",Ryan Grotjohn (minors),SS,,,,,,,,,,,,,4Yr,"California State University, Bakersfield (Bakersfield, CA)",10
2016,10,,299,13,Y,"$156,000",Stephen Smith (minors),RF,,,,,,,,,,,,,4Yr,"Texas Tech University (Lubbock, TX)",10
2015,10,,286,1,Y,"$154,600",Joey Armstrong (minors),CF,,,,,,,,,,,,,4Yr,"University of Nevada, Las Vegas (Paradise, NV)",10
2014,10,,300,15,Y,"$25,000",Scott Schultz (minors),RHP,,,,,,,,,,,,,4Yr,"Oregon State University (Corvallis, OR)",10
2013,10,,300,14,Y,"$100,000",James Sherfy (minors),RHP,0.9,54.0,3.0,0.0,0.0,0.0,57.0,5.0,1.0,3.28,1.14,2.0,4Yr,"University of Oregon (Eugene, OR)",10
2012,10,,333,25,Y,"$7,500",Daniel Poma (minors),OF,,,,,,,,,,,,,4Yr,"Hofstra University (Hempstead, NY)",10
2011,10,,304,3,Y,"$240,000",Kyle Winkler (minors),RHP,,,,,,,,,,,,,4Yr,"Texas Christian University (Fort Worth, TX)",10
2010,10,,301,6,Y,"$70,000",Kawika Emsley-Pai (minors),C,,,,,,,,,,,,,4Yr,"Lewis-Clark State College (Lewiston, ID)",10
2009,10,,306,15,Y,"$70,000",Tyson Van Winkle (minors),C,,,,,,,,,,,,,4Yr,"Gonzaga University (Spokane, WA)",10
2008,10,,318,26,N,,Danny Hultzen (minors),LHP,0.2,6.0,0.0,0.0,,,6.0,0.0,0.0,0.0,1.8,0.0,HS,"St. Albans School (Washington, DC)",10
2007,10,,313,9,Y,"$65,000",Evan Frey (minors),OF,,,,,,,,,,,,,4Yr,"University of Missouri (Columbia, MO)",10
2006,10,,297,11,Y,"$10,000",Tony Barnette (minors),RHP,2.5,8.0,0.0,0.0,,,127.0,11.0,4.0,3.53,1.25,2.0,4Yr,"Arizona State University (Tempe, AZ)",10
2005,10,,291,1,Y,"$60,000",Cody Evans (minors),RHP,,,,,,,,,,,,,4Yr,"California State University, Long Beach (Long Beach, CA)",10
2004,10,,296,15,Y,"$15,000",Steven Jackson (minors),RHP,-0.1,49.0,1.0,0.0,0.0,0.0,51.0,2.0,4.0,4.31,1.53,0.0,4Yr,"Clemson University (Clemson, SC)",10
2003,10,,306,29,Y,"$32,000",Adam Bass (minors),RHP,,,,,,,,,,,,,4Yr,"University of Alabama in Huntsville (Huntsville, AL)",10
2002,10,,309,27,N,,Mike Pierce (minors),C,,,,,,,,,,,,,HS,"Clovis HS (Clovis, CA)",10
2001,10,,308,22,N,,Matt Durkin (minors),RHP,,,,,,,,,,,,,HS,"Willow Glen HS (San Jose, CA)",10
2000,10,,309,29,Y,,Cedrick Harris (minors),OF,,,,,,,,,,,,,4Yr,"Louisiana State University (Baton Rouge, LA)",10
1999,10,,298,4,N,,Matt Abram (minors),3B,,,,,,,,,,,,,HS,"Chaparral HS (Scottsdale, AZ)",10
1998,10,,313,30,Y,,Tom Kail (minors),OF,,,,,,,,,,,,,HS,"Baldwin HS (Pittsburgh, PA)",10
1997,10,,323,29,Y,,Casey Cuntz (minors),SS,,,,,,,,,,,,,4Yr,"Louisiana State University (Baton Rouge, LA)",10
1996,10,,305,30,Y,,George Oleksik (minors),RHP,,,,,,,,,,,,,4Yr,"Middle Tennessee State University (Murfreesboro, TN)",10
