Year,Rnd,DT,OvPck,RdPck,Signed,Bonus,Name,Pos,WAR,G,AB,HR,BA,OPS,G.1,W,L,ERA,WHIP,SV,Type,Drafted Out of,Round
2005,4,,129,19.0,Y,"$250,000",Shane Funk (minors),RHP,,,,,,,,,,,,,HS,"Arnold HS (Arnold, FL)",4
2004,4,,111,10.0,Y,"$300,000",Brandon Boggs (minors),OF,0.2,130.0,326.0,10.0,0.209,0.695,,,,,,,4Yr,"Georgia Institute of Technology (Atlanta, GA)",4
2003,4,,106,9.0,Y,"$315,000",Wes Littleton (minors),RHP,1.9,2.0,1.0,0.0,0.0,0.0,80.0,5.0,3.0,3.69,1.23,3.0,4Yr,"California State University, Fullerton (Fullerton, CA)",4
2001,4,,111,5.0,N,,Josh Baker (minors),RHP,,,,,,,,,,,,,HS,"Memorial HS (Houston, TX)",4
2000,4,,124,24.0,Y,,Laynce Nix (minors),OF,3.8,758.0,1915.0,69.0,0.24,0.703,,,,,,,HS,"Midland HS (Midland, TX)",4
1999,4,,118,4.0,Y,,*Kevin Mench (minors),OF,5.5,729.0,2362.0,89.0,0.268,0.781,,,,,,,4Yr,"University of Delaware (Newark, DE)",4
1999,4,,135,21.0,Y,,Chris Jaile (minors),C,,,,,,,,,,,,,HS,"Christopher Columbus HS (Miami, FL)",4
1998,4,,113,10.0,Y,,Antwon Rollins (minors),OF,,,,,,,,,,,,,HS,"Encinal HS (Alameda, CA)",4
1997,4,,137,23.0,Y,,Dave Elder (minors),RHP,0.1,0.0,0.0,0.0,,,19.0,1.0,3.0,4.62,1.62,0.0,4Yr,"Georgia Institute of Technology (Atlanta, GA)",4
1996,4,,113,18.0,Y,,Kelly Dransfeldt (minors),SS,-0.6,51.0,112.0,1.0,0.205,0.492,,,,,,,4Yr,"University of Michigan (Ann Arbor, MI)",4
1995,4,,94,7.0,Y,,Ryan Glynn (minors),RHP,-0.7,4.0,4.0,0.0,0.0,0.0,52.0,9.0,20.0,6.24,1.75,0.0,4Yr,"Virginia Military Institute (Lexington, VA)",4
1994,4,,113,22.0,Y,,Dan Hower (minors),LHP,,,,,,,,,,,,,4Yr,"Creighton University (Omaha, NE)",4
1993,4,,115,15.0,Y,,Toure Knighton (minors),RHP,,,,,,,,,,,,,HS,"Tucson HS (Tucson, AZ)",4
1992,4,,118,22.0,Y,,Ramiro Martinez (minors),LHP,,,,,,,,,,,,,4Yr,"Los Angeles City College (Los Angeles, CA)",4
1991,4,,118,19.0,Y,,Chris Curtis (minors),RHP,,,,,,,,,,,,,JC,"Blinn College (Brenham, TX)",4
1990,4,,117,18.0,Y,,Mickey Henson (minors),RHP,,,,,,,,,,,,,HS,"South Point HS (Belmont, NC)",4
1989,4,,92,6.0,Y,,Joey Eischen (minors),LHP,3.5,296.0,28.0,0.0,0.179,0.421,324.0,11.0,9.0,3.67,1.47,3.0,JC,"Pasadena City College (Pasadena, CA)",4
1988,4,,89,6.0,Y,,Everett Cunningham (minors),RHP,,,,,,,,,,,,,4Yr,"Northwestern University (Evanston, IL)",4
1987,4,,103,19.0,Y,,Jonathan Hurst (minors),RHP,-0.8,10.0,4.0,0.0,0.0,0.0,10.0,1.0,2.0,8.2,1.71,0.0,JC,"Spartanburg Methodist College (Spartanburg, SC)",4
1986,4,,85,4.0,N,,Rob Richie (minors),OF,0.0,19.0,49.0,1.0,0.265,0.823,,,,,,,4Yr,"University of Nevada, Reno (Reno, NV)",4
1985,4,,83,3.0,Y,,Steve Wilson (minors),LHP,2.2,203.0,60.0,0.0,0.133,0.338,205.0,13.0,18.0,4.4,1.38,6.0,4Yr,"University of Portland (Portland, OR)",4
1984,4,,92,12.0,N,,Scott Ruskin (minors),OF,0.1,192.0,13.0,0.0,0.154,0.599,192.0,11.0,9.0,3.95,1.45,8.0,4Yr,"University of Florida (Gainesville, FL)",4
1983,4,,83,3.0,Unk,,Todd Jackson (minors),SS,,,,,,,,,,,,,HS,"Indio HS (Indio, CA)",4
1982,4,,96,16.0,Y,,Terry Johnson (minors),LHP,,,,,,,,,,,,,4Yr,"Michigan State University (East Lansing, MI)",4
1981,4,,86,9.0,Y,,Doug Davis (minors),C,,,,,,,,,,,,,4Yr,"Eastern Michigan University (Ypsilanti, MI)",4
1980,4,,91,14.0,Y,,Curt Wilkerson (minors),SS,0.9,972.0,2452.0,8.0,0.245,0.592,,,,,,,HS,"Dinwiddie County HS (Dinwiddie, VA)",4
1979,4,,95,17.0,Y,,Larry Reynolds (minors),SS,,,,,,,,,,,,,4Yr,"Stanford University (Palo Alto, CA)",4
1978,4,,98,20.0,N,,Mitch Zwolensky (minors),RHP,,,,,,,,,,,,,HS,"Owosso HS (Owosso, MI)",4
1977,4,,87,9.0,Y,,George Wright (minors),OF,-1.9,627.0,2160.0,42.0,0.245,0.648,,,,,,,HS,"Capitol Hill HS (Oklahoma City, OK)",4
1976,4,,84,12.0,Y,,Brian Allard (minors),RHP,0.9,0.0,0.0,0.0,,,19.0,4.0,6.0,4.23,1.34,0.0,HS,"Henry-Senachwine HS (Henry, IL)",4
1975,4,,89,17.0,Y,,Victor Mabee (minors),SS,,,,,,,,,,,,,HS,"Sunnyvale HS (Sunnyvale, CA)",4
1974,4,,74,2.0,Y,,Jim Clancy (minors),RHP,20.5,120.0,61.0,0.0,0.148,0.325,472.0,140.0,167.0,4.23,1.37,10.0,HS,"St. Rita of Cascia HS (Chicago, IL)",4
1973,4,,73,1.0,N,,Lynn Garrett (minors),SS,,,,,,,,,,,,,HS,"Berkeley HS (Berkeley, CA)",4
1972,4,,76,4.0,Y,,Brian Doyle (minors),SS,-1.2,110.0,199.0,1.0,0.161,0.392,,,,,,,HS,"Caverna HS (Horse Cave, KY)",4
1971,4,,80,8.0,Y,,David Harper (minors),RHP,,,,,,,,,,,,,HS,"William R. Boone HS (Orlando, FL)",4
1970,4,,87,15.0,Y,,Gary Jackson (minors),LHP,,,,,,,,,,,,,HS,"Hicksville HS (Hicksville, NY)",4
1969,4,,73,1.0,Y,,Pete Mackanin (minors),3B,-2.2,548.0,1570.0,30.0,0.226,0.602,,,,,,,HS,"Brother Rice HS (Chicago, IL)",4
1968,4,,68,8.0,N,,Alan Schwartz (minors),RHP,,,,,,,,,,,,,HS,"General Douglas MacArthur HS (Levittown, NY)",4
1967,4,,65,5.0,N,,Ken Caldwell (minors),3B,,,,,,,,,,,,,HS,"North Mecklenburg HS (Huntersville, NC)",4
1966,4,,66,6.0,Y,,Wallace Smallwood (minors),RHP,,,,,,,,,,,,,HS,"Martinsburg HS (Martinsburg, WV)",4
1965,4,,63,3.0,N,,Richard Zank (minors),LHP,,,,,,,,,,,,,HS,"Neillsville HS (Neillsville, WI)",4
2023,5,,144,7.0,Y,"$437,900",Alejandro Rosario (minors),P,,,,,,,,,,,,,4Yr,"University of Miami (Coral Gables, FL)",5
2022,5,,139,3.0,Y,"$418,500",Chandler Pollard (minors),OF,,,,,,,,,,,,,HS,"Woodward Academy (College Park, GA)",5
2021,5,,134,2.0,Y,"$850,000",Mitch Bratt (minors),P,,,,,,,,,,,,,HS,"Georgia Premier Academy (Statesboro, GA)",5
2020,5,,145,14.0,Y,"$800,000",Thomas Saggese (minors),SS,,,,,,,,,,,,,HS,"Carlsbad HS (Carlsbad, CA)",5
2019,5,,145,8.0,Y,"$205,000",Kellen Strahm (minors),CF,,,,,,,,,,,,,4Yr,"San Jose State University (San Jose, CA)",5
2018,5,,149,15.0,Y,"$500,000",Jayce Easley (minors),SS,,,,,,,,,,,,,HS,"Sandra Day O'Connor HS (Phoenix, AZ)",5
2017,5,,164,29.0,Y,"$386,100",Jake Latz (minors),LHP,0.2,0.0,0.0,0.0,,,4.0,0.0,1.0,2.45,0.82,0.0,4Yr,"Kent State University (Kent, OH)",5
2016,5,,159,23.0,Y,"$400,000",Kyle Roberts (minors),LHP,,,,,,,,,,,,,JC,"Henry Ford Community College (Dearborn, MI)",5
2015,5,,138,3.0,Y,"$395,000",Chad Smith (minors),OF,,,,,,,,,,,,,HS,"South Gwinnett HS (Snellville, GA)",5
2014,5,,156,21.0,Y,"$125,000",Wes Benjamin (minors),LHP,-0.7,1.0,0.0,0.0,,,21.0,2.0,3.0,6.8,1.71,0.0,4Yr,"University of Kansas (Lawrence, KS)",5
2013,5,,160,24.0,Y,"$175,000",Joe Jackson (minors),C,,,,,,,,,,,,,4Yr,"The Citadel (Charleston, SC)",5
2012,5,,186,28.0,Y,"$207,900",Preston Beck (minors),OF,,,,,,,,,,,,,4Yr,"University of Texas at Arlington (Arlington, TX)",5
2011,5,,174,23.0,N,,Brandon Woodruff (minors),RHP,17.2,79.0,115.0,1.0,0.191,0.484,130.0,46.0,26.0,3.1,1.05,1.0,HS,"Wheeler HS (Wheeler, MS)",5
2010,5,,166,21.0,Y,"$825,000",Justin Grimm (minors),RHP,-2.6,250.0,7.0,0.0,0.0,0.0,325.0,20.0,23.0,5.1,1.43,4.0,4Yr,"University of Georgia (Athens, GA)",5
2009,5,,154,13.0,Y,"$325,000",Nick McBride (minors),RHP,,,,,,,,,,,,,HS,"Ragsdale HS (Jamestown, NC)",5
2008,5,,153,11.0,Y,"$200,000",Clark Murphy (minors),1B,,,,,,,,,,,,,HS,"Fallbrook Union HS (Fallbrook, CA)",5
2007,5,,170,16.0,N,,John Gast (minors),LHP,0.0,3.0,5.0,0.0,0.0,0.167,3.0,2.0,0.0,5.11,1.3,0.0,HS,"Lake Brantley HS (Altamonte Springs, FL)",5
2006,5,,148,12.0,Y,"$172,500",Chris Davis (minors),1B,11.8,1417.0,4978.0,295.0,0.233,0.774,2.0,1.0,0.0,3.0,1.67,0.0,JC,"Navarro College (Corsicana, TX)",5
2005,5,,159,19.0,Y,"$163,000",Michael Kirkman (minors),LHP,-0.4,6.0,0.0,0.0,,,96.0,2.0,6.0,5.28,1.5,1.0,HS,"Columbia HS (Lake City, FL)",5
2004,5,,141,10.0,Y,"$200,000",Mike Nickeas (minors),C,-0.9,74.0,172.0,2.0,0.18,0.479,,,,,,,4Yr,"Georgia Institute of Technology (Atlanta, GA)",5
2003,5,,136,9.0,Y,"$210,000",Matt Lorenzo (minors),RHP,,,,,,,,,,,,,4Yr,"Kent State University (Kent, OH)",5
2001,5,,141,5.0,Y,,C.J. Wilson (minors),LHP,17.5,30.0,29.0,0.0,0.138,0.426,444.0,94.0,70.0,3.74,1.32,52.0,4Yr,"Loyola Marymount University (Los Angeles, CA)",5
2000,5,,154,24.0,Y,,Greg Runser (minors),RHP,,,,,,,,,,,,,4Yr,"University of Houston (Houston, TX)",5
1999,5,,157,13.0,Y,,*Andy Cavazos (minors),RHP,-0.9,15.0,0.0,0.0,,,17.0,0.0,0.0,10.35,2.15,0.0,HS,"Brazoswood HS (Clute, TX)",5
1999,5,,165,21.0,Y,,Victor Hillaert (minors),RHP,,,,,,,,,,,,,4Yr,"Shippensburg University of Pennsylvania (Shippensburg, PA)",5
1998,5,,143,10.0,Y,,Ryan Dittfurth (minors),RHP,,,,,,,,,,,,,HS,"Union HS (Union, TX)",5
1997,5,,167,23.0,Y,,Trey Poland (minors),LHP,,,,,,,,,,,,,4Yr,"University of Louisiana at Lafayette (Lafayette, LA)",5
1996,5,,143,18.0,Y,,Warren Morris (minors),2B,2.9,440.0,1495.0,26.0,0.267,0.709,,,,,,,4Yr,"Louisiana State University (Baton Rouge, LA)",5
1995,5,,122,7.0,Y,,Shawn Gallagher (minors),1B,,,,,,,,,,,,,HS,"New Hanover HS (Wilmington, NC)",5
1994,5,,141,22.0,Y,,J.J. Johnson (minors),OF,,,,,,,,,,,,,HS,"Hogan HS (Vallejo, CA)",5
1993,5,,143,15.0,Y,,Rod Walker (minors),SS,,,,,,,,,,,,,HS,"Hyde Park HS (Chicago, IL)",5
1992,5,,146,22.0,Y,,Alex Smith (minors),SS,,,,,,,,,,,,,4Yr,"Indiana University Bloomington (Bloomington, IN)",5
1991,5,,144,19.0,Y,,Mark O'Brien (minors),LHP,,,,,,,,,,,,,HS,"Deering HS (Portland, ME)",5
1990,5,,144,17.0,Y,,Jon Shave (minors),SS,0.2,79.0,160.0,1.0,0.288,0.688,,,,,,,4Yr,"Mississippi State University (Mississippi State, MS)",5
1989,5,,119,6.0,Y,,Jason Ayala (minors),RHP,,,,,,,,,,,,,HS,"Brighton HS (Cottonwood Heights, UT)",5
1988,5,,115,6.0,Y,,Clifford Williams (minors),C,,,,,,,,,,,,,HS,"East St. Louis HS (East St. Louis, IL)",5
1987,5,,129,19.0,Y,,Terry Mathews (minors),RHP,3.3,148.0,24.0,0.0,0.375,0.875,324.0,22.0,21.0,4.25,1.44,10.0,4Yr,"University of Louisiana at Monroe (Monroe, LA)",5
1986,5,,111,4.0,Y,,Scott Morse (minors),RHP,,,,,,,,,,,,,4Yr,"University of Maine (Orono, ME)",5
1985,5,,109,3.0,Y,,Chad Kreuter (minors),C,7.7,944.0,2505.0,54.0,0.237,0.692,,,,,,,4Yr,"Pepperdine University (Malibu, CA)",5
1984,5,,118,12.0,Y,,Dave Darretta (minors),SS,,,,,,,,,,,,,HS,"Dunedin HS (Dunedin, FL)",5
1983,5,,109,3.0,Y,,Bob Sebra (minors),RHP,1.0,78.0,96.0,0.0,0.146,0.355,94.0,15.0,29.0,4.71,1.48,1.0,4Yr,"University of Nebraska-Lincoln (Lincoln, NE)",5
1982,5,,122,16.0,Y,,Steve Buechele (minors),2B,16.5,1334.0,4266.0,137.0,0.245,0.71,,,,,,,4Yr,"Stanford University (Palo Alto, CA)",5
1981,5,,112,9.0,Y,,Frank Brosious (minors),RHP,,,,,,,,,,,,,4Yr,"Mansfield University of Pennsylvania (Mansfield, PA)",5
1980,5,,117,14.0,Y,,Brad Mengwasser (minors),RHP,,,,,,,,,,,,,4Yr,"Southern Methodist University (Dallas, TX)",5
1979,5,,121,17.0,N,,Mark Gammage (minors),RHP,,,,,,,,,,,,,HS,"Osborn HS (Detroit, MI)",5
1978,5,,124,20.0,N,,Eric Shellenbeck (minors),OF,,,,,,,,,,,,,HS,"Barrington Community HS (Barrington, IL)",5
1977,5,,113,9.0,Y,,Mike Jirschele (minors),SS,,,,,,,,,,,,,HS,"Clintonville HS (Clintonville, WI)",5
1976,5,,108,12.0,N,,Paul Rudiman (minors),RHP,,,,,,,,,,,,,HS,"Duval HS (Lanham, MD)",5
1975,5,,113,17.0,Y,,Blair Stouffer (minors),3B,,,,,,,,,,,,,4Yr,"University of Texas at Austin (Austin, TX)",5
1974,5,,98,2.0,Y,,Ron Norman (minors),LHP,,,,,,,,,,,,,4Yr,"University of North Carolina at Pembroke (Pembroke, NC)",5
1973,5,,97,1.0,Y,,Ken Pape (minors),SS,0.3,21.0,23.0,1.0,0.217,0.748,,,,,,,4Yr,"University of Texas at Austin (Austin, TX)",5
1972,5,,100,4.0,N,,Rich Wortham (minors),LHP,-0.6,0.0,0.0,0.0,,,84.0,21.0,23.0,4.89,1.52,1.0,HS,"Odessa HS (Odessa, TX)",5
1971,5,,105,8.0,N,,Joe Burgess (minors),LHP,,,,,,,,,,,,,HS,"Davenport HS (Davenport, OK)",5
1970,5,,112,15.0,Y,,Rick Waits (minors),LHP,14.2,13.0,1.0,0.0,0.0,0.0,317.0,79.0,92.0,4.25,1.46,8.0,HS,"Therrell HS (Atlanta, GA)",5
1969,5,,97,1.0,Y,,Dave Criscione (minors),C,0.1,7.0,9.0,1.0,0.333,1.0,,,,,,,HS,"Dunkirk HS (Dunkirk, NY)",5
1968,5,,92,8.0,Y,,Jeff Terpko (minors),RHP,1.3,13.0,1.0,0.0,0.0,0.0,48.0,3.0,4.0,3.14,1.54,0.0,HS,"Sayre HS (Sayre, PA)",5
1967,5,,85,5.0,Y,,Ike Brookens (minors),RHP,0.0,0.0,0.0,0.0,,,3.0,0.0,0.0,5.23,1.55,0.0,HS,"Chambersburg HS (Chambersburg, PA)",5
1966,5,,86,6.0,Y,,Gerald Merlet (minors),SS,,,,,,,,,,,,,HS,"Beloit Memorial HS (Beloit, WI)",5
1965,5,,83,3.0,N,,Arthur Pauls (minors),RHP,,,,,,,,,,,,,HS,"St. Rita of Cascia HS (Chicago, IL)",5
2023,6,,171,7.0,Y,"$515,000",Caden Scarborough (minors),P,,,,,,,,,,,,,HS,"Harmony HS (Harmony, FL)",6
2022,6,,169,3.0,Y,"$450,000",Tommy Specht (minors),OF,,,,,,,,,,,,,HS,"Wahlert Catholic HS (Dubuque, IA)",6
2021,6,,164,2.0,Y,"$75,000",Chase Lee (minors),P,,,,,,,,,,,,,4Yr,"University of Alabama (Tuscaloosa, AL)",6
2019,6,,175,8.0,Y,"$700,000",Cody Bradford (minors),P,0.1,0.0,0.0,,,,20.0,4.0,3.0,5.3,1.21,0.0,4Yr,"Baylor University (Waco, TX)",6
2018,6,,179,15.0,Y,"$200,000",Sean Chandler (minors),RHP,,,,,,,,,,,,,JC,"Iowa Western Community College (Council Bluffs, IA)",6
2017,6,,194,29.0,Y,"$150,000",Noah Bremer (minors),RHP,,,,,,,,,,,,,4Yr,"University of Washington (Seattle, WA)",6
2016,6,,189,23.0,Y,"$150,000",Kyle Cody (minors),RHP,0.5,0.0,0.0,0.0,,,15.0,1.0,3.0,3.71,1.35,0.0,4Yr,"University of Kentucky (Lexington, KY)",6
2015,6,,168,3.0,Y,"$200,000",Tyler Ferguson (minors),RHP,,,,,,,,,,,,,4Yr,"Vanderbilt University (Nashville, TN)",6
2014,6,,186,21.0,Y,"$200,000",Jose Trevino (minors),3B,3.2,326.0,981.0,24.0,0.241,0.636,,,,,,,4Yr,"Oral Roberts University (Tulsa, OK)",6
2013,6,,190,24.0,Y,"$65,000",Sam Wolff (minors),RHP,,,,,,,,,,,,,4Yr,"University of New Mexico (Albuquerque, NM)",6
2012,6,,216,28.0,Y,"$50,000",Royce Bolinger (minors),CF,,,,,,,,,,,,,4Yr,"Gonzaga University (Spokane, WA)",6
2011,6,,204,23.0,N,,Derek Fisher (minors),CF,0.2,172.0,410.0,17.0,0.195,0.663,,,,,,,HS,"Cedar Crest HS (Lebanon, PA)",6
2010,6,,196,21.0,Y,"$125,000",Brett Nicholas (minors),C,-0.2,36.0,103.0,4.0,0.252,0.756,1.0,0.0,0.0,36.0,5.0,0.0,4Yr,"University of Missouri (Columbia, MO)",6
2009,6,,184,13.0,Y,"$125,000",Ruben Sierra (minors),CF,,,,,,,,,,,,,HS,"San Juan Educational School (San Juan, Puerto Rico)",6
2008,6,,183,11.0,Y,"$120,000",Richard Bleier (minors),LHP,5.7,80.0,0.0,0.0,,,335.0,15.0,6.0,3.27,1.22,5.0,4Yr,"Florida Gulf Coast University (Fort Myers, FL)",6
2007,6,,200,16.0,Y,"$105,000",Bobby Wilkins (minors),RHP,,,,,,,,,,,,,HS,"Valhalla HS (El Cajon, CA)",6
2006,6,,178,12.0,Y,"$200,000",Jake Brigham (minors),RHP,-0.5,12.0,1.0,0.0,0.0,0.0,12.0,0.0,1.0,8.64,2.16,0.0,HS,"Central Florida Christian Academy (Orlando, FL)",6
2005,6,,189,19.0,Y,"$90,000",German Duran (minors),2B,-0.4,60.0,143.0,3.0,0.231,0.624,,,,,,,JC,"Weatherford College (Weatherford, TX)",6
2004,6,,171,10.0,Y,"$145,000",Billy Susdorf (minors),OF,,,,,,,,,,,,,4Yr,"University of California, Los Angeles (Los Angeles, CA)",6
2003,6,,166,9.0,Y,"$35,000",Adam Bourassa (minors),OF,,,,,,,,,,,,,4Yr,"Wake Forest University (Winston-Salem, NC)",6
2002,6,,172,10.0,Y,,John Barnett (minors),RHP,,,,,,,,,,,,,4Yr,"Florida Southern College (Lakeland, FL)",6
2001,6,,171,5.0,Y,,Ben Keiter (minors),RHP,,,,,,,,,,,,,4Yr,"Wichita State University (Wichita, KS)",6
2000,6,,184,24.0,Y,,Matt Meisenheimer (minors),RHP,,,,,,,,,,,,,HS,"Greenville HS (Greenville, TX)",6
1999,6,,195,21.0,Y,,Aaron Harang (minors),RHP,20.0,335.0,670.0,1.0,0.097,0.22,387.0,128.0,143.0,4.26,1.36,0.0,4Yr,"San Diego State University (San Diego, CA)",6
1998,6,,173,10.0,Y,,Frank McGill (minors),RHP,,,,,,,,,,,,,HS,"Gonzalez Tate HS (Pensacola, FL)",6
1997,6,,197,23.0,Y,,Dan DeYoung (minors),RHP,,,,,,,,,,,,,4Yr,"University of Mississippi (Oxford, MS)",6
1996,6,,173,18.0,Y,,Tony Fisher (minors),OF,,,,,,,,,,,,,4Yr,"University of St. Thomas (St. Paul, MN)",6
1995,6,,150,7.0,Y,,Danny Kolb (minors),RHP,2.7,216.0,1.0,0.0,0.0,0.0,290.0,11.0,23.0,4.36,1.52,73.0,4Yr,"Illinois State University (Normal, IL)",6
1994,6,,169,22.0,Y,,Jim Brower (minors),RHP,3.0,305.0,59.0,0.0,0.203,0.45,354.0,33.0,32.0,4.67,1.48,5.0,4Yr,"University of Minnesota (Minneapolis, MN)",6
1993,6,,171,15.0,Y,,Mark Ocasio (minors),RHP,,,,,,,,,,,,,HS,"Gilberto Concepcion de Gracia HS (Carolina, Puerto Rico)",6
1992,6,,174,22.0,Y,,Cory Pearson (minors),OF,,,,,,,,,,,,,HS,"Logan HS (Logan, WV)",6
1991,6,,170,19.0,Y,,Steve Sadecki (minors),RHP,,,,,,,,,,,,,4Yr,"Vanderbilt University (Nashville, TN)",6
1990,6,,171,17.0,Y,,Kevin Woodall (minors),SS,,,,,,,,,,,,,HS,"Georgetown HS (Georgetown, SC)",6
1989,6,,145,5.0,Y,,Ken Powell (minors),OF,,,,,,,,,,,,,HS,"Long Beach Polytechnic HS (Long Beach, CA)",6
1988,6,,141,6.0,Y,,Rob Maurer (minors),1B,-0.2,21.0,25.0,0.0,0.12,0.401,,,,,,,4Yr,"University of Evansville (Evansville, IN)",6
1987,6,,155,19.0,Y,,Kevin Belcher (minors),OF,0.2,16.0,15.0,0.0,0.133,0.435,,,,,,,JC,"Navarro College (Corsicana, TX)",6
1986,6,,137,4.0,Y,,Rick Raether (minors),RHP,,,,,,,,,,,,,4Yr,"University of Miami (Coral Gables, FL)",6
1985,6,,135,3.0,Y,,Mark Seay (minors),OF,,,,,,,,,,,,,HS,"San Bernardino HS (San Bernardino, CA)",6
1984,6,,144,12.0,Y,,Larry Pardo (minors),RHP,,,,,,,,,,,,,HS,"Christopher Columbus HS (Miami, FL)",6
1983,6,,135,3.0,Y,,Bill Hance (minors),C,,,,,,,,,,,,,4Yr,"University of Missouri (Columbia, MO)",6
1982,6,,148,16.0,N,,Rob Walton (minors),RHP,,,,,,,,,,,,,HS,"Rutherford HS (Rutherford, NJ)",6
1981,6,,138,9.0,N,,Barry Jones (minors),RHP,1.6,238.0,16.0,0.0,0.063,0.18,348.0,33.0,33.0,3.66,1.41,23.0,HS,"Centerville HS (Centerville, IN)",6
1980,6,,143,14.0,Y,,Al Hartman (minors),RHP,,,,,,,,,,,,,HS,"Joliet Township HS West (Joliet, IL)",6
1979,6,,147,17.0,Y,,Shelton McMath (minors),OF,,,,,,,,,,,,,4Yr,"Texas A&M University (College Station, TX)",6
1978,6,,150,20.0,Y,,Terry Bogener (minors),OF,-0.3,24.0,60.0,1.0,0.217,0.621,,,,,,,4Yr,"University of Oklahoma (Norman, OK)",6
1977,6,,139,9.0,Y,,Patrick Nelson (minors),RHP,,,,,,,,,,,,,HS,"Carol City HS (Miami Gardens, FL)",6
1976,6,,132,12.0,Y,,David Peterson (minors),C,,,,,,,,,,,,,HS,"Woodrow Wilson HS (Portland, OR)",6
1975,6,,137,17.0,Y,,John Poloni (minors),LHP,-0.1,0.0,0.0,0.0,,,2.0,1.0,0.0,6.43,1.29,0.0,4Yr,"Arizona State University (Tempe, AZ)",6
1974,6,,122,2.0,Y,,David McCarthy (minors),LHP,,,,,,,,,,,,,HS,"Bourgade HS (Phoenix, AZ)",6
1973,6,,121,1.0,N,,Andrew Mason (minors),3B,,,,,,,,,,,,,HS,"Charter Oak HS (Covina, CA)",6
1972,6,,124,4.0,Y,,Mel Barrow (minors),INF,,,,,,,,,,,,,HS,"Harlan Community Academy HS (Chicago, IL)",6
1971,6,,130,8.0,Y,,Greg Pryor (minors),2B,4.6,789.0,1883.0,14.0,0.25,0.618,,,,,,,4Yr,"Florida Southern College (Lakeland, FL)",6
1970,6,,137,15.0,N,,Richard Baker (minors),RHP,,,,,,,,,,,,,HS,"Holy Cross HS (Lynchburg, VA)",6
1969,6,,121,1.0,N,,Geoff Brandt (minors),OF,,,,,,,,,,,,,HS,"El Camino Fundamental HS (Sacramento, CA)",6
1968,6,,116,8.0,N,,Mike Cubbage (minors),SS,6.4,703.0,1951.0,34.0,0.258,0.699,,,,,,,HS,"Lane HS (Charlottesville, VA)",6
1967,6,,105,5.0,Y,,Michael Schooff (minors),LHP,,,,,,,,,,,,,HS,"Woodbridge HS (Woodbridge, VA)",6
1966,6,,106,6.0,N,,Kim Hillstrom (minors),RHP,,,,,,,,,,,,,4Yr,"Central Michigan University (Mount Pleasant, MI)",6
1965,6,,103,3.0,Y,,John Taylor (minors),SS,,,,,,,,,,,,,HS,"Alleghany HS (Covington, VA)",6
2023,7,,201,7.0,Y,"$180,000",Izack Tiger (minors),P,,,,,,,,,,,,,JC,"Butler Community College (El Dorado, KS)",7
2022,7,,199,3.0,Y,"$250,000",Luis Ramirez (minors),P,,,,,,,,,,,,,4Yr,"California State University, Long Beach (Long Beach, CA)",7
2021,7,,194,2.0,Y,"$10,000",Bradford Webb (minors),RHP,,,,,,,,,,,,,4Yr,"Virginia Commonwealth University (Richmond, VA)",7
2019,7,,205,8.0,N,,Brandon Sproat (minors),P,,,,,,,,,,,,,HS,"Pace HS (Pace, FL)",7
2018,7,,209,15.0,Y,"$206,800",Tim Brennan (minors),RHP,,,,,,,,,,,,,4Yr,"St. Joseph's University (Philadelphia, PA)",7
2017,7,,224,29.0,Y,"$150,000",Joel Urena (minors),LHP,,,,,,,,,,,,,JC,"Monroe Community College (Rochester, NY)",7
2016,7,,219,23.0,Y,"$225,000",Sam Huff (minors),C,1.1,75.0,195.0,10.0,0.262,0.776,,,,,,,HS,"Arcadia HS (Phoenix, AZ)",7
2015,7,,198,3.0,Y,"$10,000",Dylan Moore (minors),SS,4.7,448.0,1066.0,42.0,0.208,0.705,1.0,0.0,0.0,36.0,7.0,0.0,4Yr,"University of Central Florida (Orlando, FL)",7
2014,7,,216,21.0,Y,"$5,000",Nick Green (minors),RHP,,,,,,,,,,,,,JC,"Indian Hills Community College (Centerville, IA)",7
2013,7,,220,24.0,Y,"$162,300",Nick Gardewine (minors),RHP,-0.1,2.0,0.0,0.0,,,15.0,0.0,0.0,4.85,1.85,0.0,JC,"Kaskaskia College (Arcola, IL)",7
2012,7,,246,28.0,Y,"$10,000",Cam Schiller (minors),2B,,,,,,,,,,,,,4Yr,"Oral Roberts University (Tulsa, OK)",7
2011,7,,234,23.0,N,,Max Pentecost (minors),C,,,,,,,,,,,,,HS,"Winder-Barrow HS (Winder, GA)",7
2010,7,,226,21.0,Y,"$125,000",Jimmy Reyes (minors),LHP,,,,,,,,,,,,,4Yr,"Elon University (Elon, NC)",7
2009,7,,214,13.0,Y,"$125,000",Braxton Lane (minors),CF,,,,,,,,,,,,,HS,"Sandy Creek HS (Tyrone, GA)",7
2008,7,,213,11.0,Y,"$600,000",Matt Thompson (minors),RHP,,,,,,,,,,,,,HS,"Grace Prep Academy (Arlington, TX)",7
2007,7,,230,16.0,Y,"$98,000",Tim Smith (minors),OF,,,,,,,,,,,,,4Yr,"Arizona State University (Tempe, AZ)",7
2006,7,,208,12.0,Y,"$27,500",Grant Gerrard (minors),OF,,,,,,,,,,,,,4Yr,"Southern Illinois University Carbondale (Carbondale, IL)",7
2005,7,,219,19.0,Y,"$250,000",Jake Rasner (minors),RHP,,,,,,,,,,,,,HS,"Earl Wooster HS (Reno, NV)",7
2004,7,,201,10.0,Y,,Ben Harrison (minors),OF,,,,,,,,,,,,,4Yr,"University of Florida (Gainesville, FL)",7
2003,7,,196,9.0,Y,"$138,000",Matt Farnum (minors),RHP,,,,,,,,,,,,,4Yr,"Texas A&M University (College Station, TX)",7
2002,7,,202,10.0,Y,,Andrew Tisdale (minors),RHP,,,,,,,,,,,,,4Yr,"Chapman University (Orange, CA)",7
2001,7,,201,5.0,Y,,Patrick Boyd (minors),OF,,,,,,,,,,,,,4Yr,"Clemson University (Clemson, SC)",7
2000,7,,214,24.0,N,,Virgil Vasquez (minors),RHP,-1.1,14.0,10.0,0.0,0.0,0.0,19.0,2.0,6.0,6.6,1.76,0.0,HS,"Santa Barbara HS (Santa Barbara, CA)",7
1999,7,,225,21.0,N,,Luz Portobanco (minors),RHP,,,,,,,,,,,,,HS,"Miami Senior HS (Miami, FL)",7
1998,7,,203,10.0,Y,,John Stewart (minors),LHP,,,,,,,,,,,,,4Yr,"Western Michigan University (Kalamazoo, MI)",7
1997,7,,227,23.0,Y,,Mike Lamb (minors),C,4.0,975.0,2706.0,69.0,0.276,0.747,,,,,,,4Yr,"California State University, Fullerton (Fullerton, CA)",7
1996,7,,203,18.0,Unk,,Juan Piniella (minors),OF,,,,,,,,,,,,,HS,"North Stafford HS (Stafford, VA)",7
1995,7,,178,7.0,Y,"$700,000",Jorge Carrion (minors),RHP,,,,,,,,,,,,,HS,"DeWitt Clinton HS (Bronx, NY)",7
1994,7,,197,22.0,Y,,Bucky Buckles (minors),RHP,,,,,,,,,,,,,4Yr,"University of Oklahoma (Norman, OK)",7
1993,7,,199,15.0,Y,,Dan Smith (minors),RHP,0.0,83.0,29.0,0.0,0.069,0.225,87.0,7.0,12.0,5.23,1.48,2.0,HS,"Girard HS (Girard, KS)",7
1992,7,,202,22.0,Y,,Jeff Runion (minors),RHP,,,,,,,,,,,,,HS,"Riverdale HS (Riverdale, GA)",7
1991,7,,196,19.0,Y,,Bert Gerhart (minors),RHP,,,,,,,,,,,,,HS,"New Hope HS (Columbus, MS)",7
1990,7,,198,17.0,Y,,Terry Burrows (minors),LHP,-1.1,13.0,0.0,0.0,,,50.0,4.0,4.0,6.42,1.79,1.0,4Yr,"McNeese State University (Lake Charles, LA)",7
1989,7,,171,5.0,Y,,Dave Giberti (minors),LHP,,,,,,,,,,,,,HS,"Alhambra HS (Martinez, CA)",7
1988,7,,167,6.0,Y,,Dominic Pierce (minors),3B,,,,,,,,,,,,,JC,"Skyline College (San Bruno, CA)",7
1987,7,,181,19.0,Y,,Tony Scruggs (minors),OF,-0.2,5.0,6.0,0.0,0.0,0.0,,,,,,,4Yr,"University of California, Los Angeles (Los Angeles, CA)",7
1986,7,,163,4.0,Y,,Mike Loynd (minors),RHP,-0.9,0.0,0.0,0.0,,,35.0,3.0,7.0,5.82,1.69,2.0,4Yr,"Florida State University (Tallahassee, FL)",7
1985,7,,161,3.0,Y,,Dan Olsson (minors),RHP,,,,,,,,,,,,,4Yr,"Montclair State University (Montclair, NJ)",7
1984,7,,170,12.0,Y,,Scott Anderson (minors),RHP,-0.1,4.0,4.0,0.0,0.0,0.0,18.0,1.0,2.0,5.43,1.45,0.0,4Yr,"Oregon State University (Corvallis, OR)",7
1983,7,,161,3.0,Y,,Kirk Killingsworth (minors),RHP,,,,,,,,,,,,,4Yr,"University of Texas at Austin (Austin, TX)",7
1982,7,,174,16.0,Y,,Kevin Stock (minors),3B,,,,,,,,,,,,,HS,"Stadium HS (Tacoma, WA)",7
1981,7,,164,9.0,Y,,Marty Leach (minors),RHP,,,,,,,,,,,,,4Yr,"Saint Leo University (St. Leo, FL)",7
1980,7,,169,14.0,N,,Tony Hudson (minors),LHP,,,,,,,,,,,,,4Yr,"California State University, Fullerton (Fullerton, CA)",7
1979,7,,173,17.0,Y,,Larry D'Onofrio (minors),C,,,,,,,,,,,,,4Yr,"University of St. Francis (Joliet, IL)",7
1978,7,,176,20.0,Y,,Jerry Neufang (minors),C,,,,,,,,,,,,,HS,"Hayfield HS (Alexandria, VA)",7
1977,7,,165,9.0,Y,,Odie Davis (minors),SS,-0.1,17.0,8.0,0.0,0.125,0.25,,,,,,,4Yr,"Prairie View A&M University (Prairie View, TX)",7
1976,7,,156,12.0,Y,,Ted Davis (minors),RHP,,,,,,,,,,,,,HS,"Fairmont Heights HS (Cheverly, ME)",7
1975,7,,161,17.0,Y,,Dave Rivera (minors),OF,,,,,,,,,,,,,HS,"King City HS (King City, CA)",7
1974,7,,146,2.0,Y,,Bill Patten (minors),LHP,,,,,,,,,,,,,HS,"Northrop HS (Fort Wayne, IN)",7
1973,7,,145,1.0,Y,,Drew Nickerson (minors),RHP,,,,,,,,,,,,,HS,"Reseda HS (Reseda, CA)",7
1972,7,,148,4.0,N,,Mark Ackerman (minors),RHP,,,,,,,,,,,,,HS,"Sunny Hills HS (Fullerton, CA)",7
1971,7,,155,8.0,N,,Leslie Clark (minors),SS,,,,,,,,,,,,,HS,"Prince Edward County HS (Farmville, VA)",7
1970,7,,162,15.0,Y,,Rick Kemp (minors),LHP,,,,,,,,,,,,,4Yr,"Kankakee Community College (Kankakee, IL)",7
1969,7,,145,1.0,Y,,Johnny Williams (minors),OF,,,,,,,,,,,,,4Yr,"University of North Carolina at Pembroke (Pembroke, NC)",7
1968,7,,140,8.0,N,,Harold Richmond (minors),RHP,,,,,,,,,,,,,HS,"William B. Travis HS (Austin, TX)",7
1967,7,,125,5.0,Y,,Melvin Lowe (minors),OF,,,,,,,,,,,,,HS,"Lakewood HS (Lakewood, NJ)",7
1966,7,,126,6.0,N,,John Fryer (minors),RHP,,,,,,,,,,,,,JC,"Eastern Florida State College (Cocoa, FL)",7
1965,7,,123,3.0,Y,,Fred Jacobs (minors),2B,,,,,,,,,,,,,4Yr,"Carleton College (Northfield, MN)",7
2023,8,,231,7.0,Y,"$255,000",Julian Brock (minors),C,,,,,,,,,,,,,4Yr,"University of Louisiana at Lafayette (Lafayette, LA)",8
2022,8,,229,3.0,Y,"$5,000",Matt Brosky (minors),P,,,,,,,,,,,,,4Yr,"Youngstown State University (Youngstown, OH)",8
2021,8,,224,2.0,Y,"$150,000",Larson Kindreich (minors),P,,,,,,,,,,,,,4Yr,"Biola University (La Mirada, CA)",8
2019,8,,235,8.0,Y,"$177,400",John Matthews (minors),P,,,,,,,,,,,,,4Yr,"Kent State University (Kent, OH)",8
2018,8,,239,15.0,Y,"$166,400",Jax Biggers (minors),SS,,,,,,,,,,,,,4Yr,"University of Arkansas (Fayetteville, AR)",8
2017,8,,254,29.0,Y,"$135,000",Tyreque Reed (minors),1B,,,,,,,,,,,,,JC,"Itawamba Community College (Fulton, MS)",8
2016,8,,249,23.0,Y,"$175,800",Tai Tiedemann (minors),RHP,,,,,,,,,,,,,JC,"Long Beach City College (Long Beach, CA)",8
