Year,Rnd,DT,OvPck,RdPck,Signed,Bonus,Name,Pos,WAR,G,AB,HR,BA,OPS,G.1,W,L,ERA,WHIP,SV,Type,Drafted Out of,Round
2015,8,,228,3.0,Y,"$10,000",Blake Bass (minors),RHP,,,,,,,,,,,,,4Yr,"Angelo State University (San Angelo, TX)",8
2014,8,,246,21.0,Y,"$155,600",Erik Swanson (minors),RHP,2.3,7.0,2.0,0.0,0.0,0.0,195.0,8.0,14.0,3.78,1.09,10.0,JC,"Iowa Western Community College (Council Bluffs, IA)",8
2013,8,,250,24.0,Y,"$151,600",Evan Van Hoosier (minors),2B,,,,,,,,,,,,,JC,"College of Southern Nevada (Henderson, NV)",8
2012,8,,276,28.0,Y,"$5,000",Cody Kendall (minors),RHP,,,,,,,,,,,,,4Yr,"California State University, Fresno (Fresno, CA)",8
2011,8,,264,23.0,Y,"$125,000",Kyle Hendricks (minors),RHP,23.0,188.0,358.0,0.0,0.103,0.252,247.0,93.0,69.0,3.48,1.16,0.0,4Yr,"Dartmouth College (Hanover, NH)",8
2010,8,,256,21.0,Y,"$125,000",Jonathan Roof (minors),SS,,,,,,,,,,,,,4Yr,"Michigan State University (East Lansing, MI)",8
2009,8,,244,13.0,Y,"$90,000",Braden Tullis (minors),RHP,,,,,,,,,,,,,JC,"Skagit Valley College (Mount Vernon, WA)",8
2008,8,,243,11.0,Y,"$175,000",Mike Bianucci (minors),OF,,,,,,,,,,,,,4Yr,"Auburn University (Auburn, AL)",8
2007,8,,260,16.0,Y,"$80,000",Jonathan Greene (minors),C,,,,,,,,,,,,,4Yr,"Western Carolina University (Cullowhee, NC)",8
2006,8,,238,12.0,Y,"$85,000",Josh Bradbury (minors),OF,,,,,,,,,,,,,JC,"Orange Coast College (Costa Mesa, CA)",8
2005,8,,249,19.0,N,,Bradley Barragar (minors),RHP,,,,,,,,,,,,,JC,"Golden West College (Huntington Beach, CA)",8
2004,8,,231,10.0,Y,"$20,000",Mark Roberts (minors),RHP,,,,,,,,,,,,,4Yr,"University of Oklahoma (Norman, OK)",8
2003,8,,226,9.0,Y,"$85,000",Jeremy Cleveland (minors),OF,,,,,,,,,,,,,4Yr,"University of North Carolina at Asheville (Asheville, NC)",8
2002,8,,232,10.0,Y,,Chris O'Riordan (minors),2B,,,,,,,,,,,,,4Yr,"Stanford University (Palo Alto, CA)",8
2001,8,,231,5.0,Y,,Masjid Khairy (minors),OF,,,,,,,,,,,,,4Yr,"Los Angeles City College (Los Angeles, CA)",8
2000,8,,244,24.0,Y,"$225,000",Nick Masset (minors),RHP,2.4,311.0,5.0,0.0,0.0,0.0,387.0,20.0,16.0,4.06,1.46,4.0,HS,"Pinellas Park HS (Largo, FL)",8
1999,8,,255,21.0,Y,,Josh Rahrer (minors),RHP,,,,,,,,,,,,,HS,"Emmett HS (Emmett, ID)",8
1998,8,,233,10.0,N,,Brad Ticehurst (minors),OF,,,,,,,,,,,,,4Yr,"University of Southern California (Los Angeles, CA)",8
1997,8,,257,23.0,Y,,Billy Diaz (minors),RHP,,,,,,,,,,,,,HS,"Academia Adventista HS (Caguas, Puerto Rico)",8
1996,8,,233,18.0,Y,,Luis Acevedo (minors),SS,,,,,,,,,,,,,HS,"Francisco Mendoza HS (Isabella, Puerto Rico)",8
1995,8,,206,7.0,Y,,Craig Monroe (minors),SS,3.6,814.0,2691.0,115.0,0.252,0.742,,,,,,,HS,"Texas HS (Texarkana, TX)",8
1994,8,,225,22.0,Y,,Mark Little (minors),OF,0.5,148.0,247.0,3.0,0.247,0.684,,,,,,,4Yr,"University of Memphis (Memphis, TN)",8
1993,8,,227,15.0,Y,,Jack Stanczak (minors),3B,,,,,,,,,,,,,4Yr,"Villanova University (Villanova, PA)",8
1992,8,,230,22.0,Y,,Kevin Dunivan (minors),RHP,,,,,,,,,,,,,HS,"Captain Shreve HS (Shreveport, LA)",8
1991,8,,222,19.0,Y,,Roger Luce (minors),C,,,,,,,,,,,,,4Yr,"University of Texas at Austin (Austin, TX)",8
1990,8,,225,17.0,Y,,Steve Dreyer (minors),RHP,-0.3,0.0,0.0,0.0,,,15.0,4.0,4.0,5.71,1.63,0.0,4Yr,"University of Northern Iowa (Cedar Falls, IA)",8
1989,8,,197,5.0,Y,,Jay Franklin (minors),RHP,,,,,,,,,,,,,4Yr,"Oral Roberts University (Tulsa, OK)",8
1988,8,,193,6.0,Y,,Travis Law (minors),OF,,,,,,,,,,,,,4Yr,"Oklahoma State University (Stillwater, OK)",8
1987,8,,207,19.0,Y,,Gary Alexander (minors),OF,,,,,,,,,,,,,4Yr,"University of Arizona (Tucson, AZ)",8
1986,8,,189,4.0,Y,,Brad Fontes (minors),C,,,,,,,,,,,,,HS,"McLane HS (Fresno, CA)",8
1985,8,,187,3.0,Y,,Mitch Thomas (minors),RHP,,,,,,,,,,,,,4Yr,"University of Louisiana at Monroe (Monroe, LA)",8
1984,8,,196,12.0,Y,,Huck Hibberd (minors),RHP,,,,,,,,,,,,,4Yr,"San Jose State University (San Jose, CA)",8
1983,8,,187,3.0,Y,,John Harrington (minors),RHP,,,,,,,,,,,,,4Yr,"Alcorn State University (Lorman, MS)",8
1982,8,,200,16.0,N,,Eric Lane (minors),C,,,,,,,,,,,,,4Yr,"Tulane University (New Orleans, LA)",8
1981,8,,190,9.0,Y,,Mike Schmid (minors),LHP,,,,,,,,,,,,,4Yr,"University of Massachusetts Lowell (Lowell, MA)",8
1980,8,,195,14.0,Y,,Craig Goodin (minors),SS,,,,,,,,,,,,,HS,"Tulare Union HS (Tulare, CA)",8
1979,8,,199,17.0,Y,,Michael Roberts (minors),RHP,,,,,,,,,,,,,4Yr,"Baylor University (Waco, TX)",8
1978,8,,202,20.0,Y,,Wayne Tolleson (minors),SS,2.3,863.0,2322.0,9.0,0.241,0.6,,,,,,,4Yr,"Western Carolina University (Cullowhee, NC)",8
1977,8,,191,9.0,N,,Joseph Knight (minors),RHP,,,,,,,,,,,,,HS,"Texas HS (Texarkana, TX)",8
1976,8,,180,12.0,Y,,Kevin Keenan (minors),RHP,,,,,,,,,,,,,4Yr,"Slippery Rock University of Pennsylvania (Slippery Rock, PA)",8
1975,8,,185,17.0,N,,John Shouse (minors),1B,,,,,,,,,,,,,HS,"Chamberlain HS (Tampa, FL)",8
1974,8,,170,2.0,Y,,Ward Smith (minors),LHP,,,,,,,,,,,,,HS,"Mira Loma HS (Sacramento, CA)",8
1973,8,,169,1.0,N,,Wayne Steele (minors),LHP,,,,,,,,,,,,,HS,"Herbert Hoover HS (San Diego, CA)",8
1972,8,,172,4.0,N,,Jim Sundberg (minors),C,40.5,1962.0,6021.0,95.0,0.248,0.674,,,,,,,4Yr,"University of Iowa (Iowa City, IA)",8
1971,8,,180,8.0,N,,Michael Agosto (minors),OF,,,,,,,,,,,,,HS,"Clairemont HS (San Diego, CA)",8
1970,8,,187,15.0,N,,Paul Stombaugh (minors),OF,,,,,,,,,,,,,HS,"High Point HS (Beltsville, MD)",8
1969,8,,169,1.0,N,,Eric Florence (minors),C,,,,,,,,,,,,,HS,"Waynesville HS (Waynesville, OH)",8
1968,8,,164,8.0,Y,,Gene Wiley (minors),RHP,,,,,,,,,,,,,HS,"Threadgill HS (Greenwood, MS)",8
1967,8,,145,5.0,N,,Thomas Elgin (minors),LHP,,,,,,,,,,,,,HS,"North Hagerstown HS (Hagerstown, MD)",8
1966,8,,146,6.0,N,,John Bowman (minors),LHP,,,,,,,,,,,,,4Yr,"Trinity University (San Antonio, TX)",8
1965,8,,174,,Y,,Eddie Lupton (minors),LHP,,,,,,,,,,,,,4Yr,"University of Notre Dame (South Bend, IN)",8
2023,9,,261,7.0,Y,"$200,000",Quincy Scott (minors),OF,,,,,,,,,,,,,JC,"Palomar College (San Marcos, CA)",9
2022,9,,259,3.0,Y,"$1,000",Griffin Cheney (minors),SS,,,,,,,,,,,,,4Yr,"Georgia State University (Atlanta, GA)",9
2021,9,,254,2.0,Y,"$30,000",Liam Hicks (minors),C,,,,,,,,,,,,,4Yr,"Arkansas State University (Jonesboro, AR)",9
2019,9,,265,8.0,Y,"$140,000",Zak Kent (minors),P,,,,,,,,,,,,,4Yr,"Virginia Military Institute (Lexington, VA)",9
2018,9,,269,15.0,Y,"$15,000",Chandler Sanburn (minors),RHP,,,,,,,,,,,,,4Yr,"Wichita State University (Wichita, KS)",9
2017,9,,284,29.0,Y,"$130,000",Tanner Gardner (minors),OF,,,,,,,,,,,,,4Yr,"Texas Tech University (Lubbock, TX)",9
2016,9,,279,23.0,Y,"$164,300",Hever Bueno (minors),RHP,,,,,,,,,,,,,4Yr,"Arizona State University (Tempe, AZ)",9
2015,9,,258,3.0,Y,"$100,000",Pete Fairbanks (minors),RHP,2.7,8.0,0.0,0.0,,,168.0,13.0,16.0,3.21,1.22,40.0,4Yr,"University of Missouri (Columbia, MO)",9
2014,9,,276,21.0,Y,"$10,000",Doug Votolato (minors),CF,,,,,,,,,,,,,4Yr,"University of Central Arkansas (Conway, AR)",9
2013,9,,280,24.0,Y,"$10,000",Jose Samayoa (minors),RHP,,,,,,,,,,,,,4Yr,"Lee University (Cleveland, TN)",9
2012,9,,306,28.0,Y,"$10,000",John Niggli (minors),RHP,,,,,,,,,,,,,4Yr,"Liberty University (Lynchburg, VA)",9
2011,9,,294,23.0,Y,"$100,000",Rashad Harlin (minors),CF,,,,,,,,,,,,,HS,"Helix HS (La Mesa, CA)",9
2010,9,,286,21.0,Y,"$20,000",Zach Osborne (minors),RHP,,,,,,,,,,,,,4Yr,"University of Louisiana at Lafayette (Lafayette, LA)",9
2009,9,,274,13.0,N,,Jabari Blash (minors),RF,-1.0,123.0,274.0,8.0,0.186,0.612,,,,,,,4Yr,"Miami Dade College, Kendall Campus (Miami, FL)",9
2008,9,,273,11.0,Y,"$123,300",Jared Bolden (minors),OF,,,,,,,,,,,,,4Yr,"Virginia Commonwealth University (Richmond, VA)",9
2007,9,,290,16.0,Y,"$10,000",Davis Stoneburner (minors),inf,,,,,,,,,,,,,4Yr,"James Madison University (Harrisonburg, VA)",9
2006,9,,268,12.0,Y,"$65,000",Brennan Garr (minors),RHP,,,,,,,,,,,,,4Yr,"University of Northern Colorado (Greeley, CO)",9
2005,9,,279,19.0,Y,"$235,000",R.J. Anderson (minors),OF,,,,,,,,,,,,,HS,"Armwood HS (Seffner, FL)",9
2004,9,,261,10.0,Y,"$70,000",Jim Fasano (minors),1B,,,,,,,,,,,,,4Yr,"University of Richmond (Richmond, VA)",9
2003,9,,256,9.0,Y,"$20,000",Tim Cunningham (minors),LHP,,,,,,,,,,,,,4Yr,"Stanford University (Palo Alto, CA)",9
2002,9,,262,10.0,N,,Steven Herce (minors),RHP,,,,,,,,,,,,,4Yr,"Rice University (Houston, TX)",9
2001,9,,261,5.0,Y,,Gerald Smiley (minors),RHP,,,,,,,,,,,,,HS,"Rainier Beach HS (Seattle, WA)",9
2000,9,,274,24.0,Y,,Edwin Encarnaci�n (minors),3B,35.5,1960.0,7040.0,424.0,0.26,0.846,,,,,,,HS,"Manuela Toro HS (Caguas, Puerto Rico)",9
1999,9,,285,21.0,Y,,Brett Cadiente (minors),OF,,,,,,,,,,,,,4Yr,"Arizona State University (Tempe, AZ)",9
1998,9,,263,10.0,Y,,Andy Pratt (minors),LHP,-0.3,5.0,0.0,0.0,,,5.0,0.0,1.0,15.0,4.0,0.0,HS,"Chino Valley HS (Chino Valley, AZ)",9
1997,9,,287,23.0,Y,,Carlos Figueroa (minors),LHP,,,,,,,,,,,,,HS,"Dr Jose M Lazaro HS (Carolina, Puerto Rico)",9
1996,9,,263,18.0,N,,Randy Rodriguez (minors),LHP,,,,,,,,,,,,,HS,"Florida Air Academy HS (Melbourne, FL)",9
1995,9,,234,7.0,Y,,Juan Rivera (minors),C,,,,,,,,,,,,,HS,"Dr Jose M Lazaro HS (Carolina, Puerto Rico)",9
1994,9,,253,22.0,Y,,John Powell (minors),RHP,,,,,,,,,,,,,4Yr,"Auburn University (Auburn, AL)",9
1993,9,,255,15.0,Y,,Pete Hartmann (minors),LHP,,,,,,,,,,,,,4Yr,"Oklahoma City University (Oklahoma City, OK)",9
1992,9,,258,22.0,Y,,Scott Malone (minors),OF,,,,,,,,,,,,,4Yr,"Texas Christian University (Fort Worth, TX)",9
1991,9,,248,19.0,Y,,Scott Eyre (minors),LHP,7.3,458.0,13.0,0.0,0.154,0.368,617.0,28.0,30.0,4.23,1.52,4.0,JC,"College of Southern Idaho (Twin Falls, ID)",9
1990,9,,252,17.0,Y,,Tim Wells (minors),RHP,,,,,,,,,,,,,4Yr,"Missouri State University (Springfield, MO)",9
1989,9,,223,5.0,Y,,Randy Marshall (minors),OF,,,,,,,,,,,,,4Yr,"Le Moyne College (Syracuse, NY)",9
1988,9,,219,6.0,Y,,Trey McCoy (minors),OF,,,,,,,,,,,,,4Yr,"Virginia Polytechnic Institute and State University (Blacksburg, VA)",9
1987,9,,233,19.0,N,,Bert Heffernan (minors),C,-0.3,8.0,11.0,0.0,0.091,0.273,,,,,,,4Yr,"Clemson University (Clemson, SC)",9
1986,9,,215,4.0,N,,David Howell (minors),LHP,,,,,,,,,,,,,HS,"Swampscott HS (Swampscott, MA)",9
1985,9,,213,3.0,Y,,Michael Jackson (minors),OF,,,,,,,,,,,,,HS,"Appomattox County HS (Appomattox, VA)",9
1984,9,,222,12.0,Y,,Scott Russell (minors),OF,,,,,,,,,,,,,HS,"Mount Whitney HS (Visalia, CA)",9
1983,9,,213,3.0,Y,,Steve Kordish (minors),RHP,,,,,,,,,,,,,4Yr,"Princeton University (Princeton, NJ)",9
1982,9,,226,16.0,Y,,Eric Dersin (minors),RHP,,,,,,,,,,,,,HS,"Frankfort HS (Ridgeley, WV)",9
1981,9,,216,9.0,Y,,Larry McLane (minors),LHP,,,,,,,,,,,,,4Yr,"Chapman University (Orange, CA)",9
1980,9,,221,14.0,N,,Doug Shields (minors),SS,,,,,,,,,,,,,HS,"H. B. Plant HS (Tampa, FL)",9
1979,9,,225,17.0,N,,Jeffrey Johnson (minors),RHP,,,,,,,,,,,,,HS,"John Muir HS (Pasadena, CA)",9
1978,9,,228,20.0,Y,,Tracy Cowger (minors),OF,,,,,,,,,,,,,4Yr,"Loyola Marymount University (Los Angeles, CA)",9
1977,9,,217,9.0,Y,,Bob Johnson (minors),C,0.2,98.0,249.0,9.0,0.197,0.606,,,,,,,HS,"Justin F. Kimball HS (Dallas, TX)",9
1976,9,,204,12.0,Y,,Alphonso Lewis (minors),OF,,,,,,,,,,,,,HS,"Pensacola HS (Pensacola, FL)",9
1975,9,,209,17.0,Y,,Randall Reynolds (minors),C,,,,,,,,,,,,,4Yr,"York College of Pennsylvania (York, PA)",9
1974,9,,194,2.0,Y,,Eddie Holman (minors),LHP,,,,,,,,,,,,,4Yr,"Louisiana Tech University (Ruston, LA)",9
1973,9,,193,1.0,Y,,Donald Thomas (minors),3B,,,,,,,,,,,,,4Yr,"University of California, Berkeley (Berkeley, CA)",9
1972,9,,196,4.0,N,,Steve Correll (minors),RHP,,,,,,,,,,,,,HS,"Blue Island HS (New Ringgold, PA)",9
1971,9,,205,8.0,Y,,James Penner (minors),RHP,,,,,,,,,,,,,HS,"McLane HS (Fresno, CA)",9
1970,9,,212,15.0,Y,,David Daniels (minors),SS,,,,,,,,,,,,,HS,"Union HS (Union, NJ)",9
1969,9,,193,1.0,Y,,Ricky Rowe (minors),SS,,,,,,,,,,,,,HS,"Georgetown HS (Georgetown, SC)",9
1968,9,,188,8.0,N,,Bruce Clarke (minors),RHP,,,,,,,,,,,,,HS,"Pawtucket West HS (Pawtucket, RI)",9
1967,9,,165,5.0,N,,Chris Cammack (minors),3B,,,,,,,,,,,,,HS,"Fayetteville HS (Fayetteville, NC)",9
1966,9,,166,6.0,Y,,Robert Miller (minors),3B,,,,,,,,,,,,,4Yr,"Lewis University (Romeoville, IL)",9
1965,9,,178,,N,,Garry Hill (minors),RHP,-0.2,1.0,0.0,0.0,,,1.0,0.0,1.0,15.43,3.0,0.0,HS,"Garinger HS (Charlotte, NC)",9
2023,10,,291,7.0,Y,"$155,000",Case Matter (minors),P,,,,,,,,,,,,,4Yr,"University of Washington (Seattle, WA)",10
2022,10,,289,3.0,Y,"$1,000",Josh Hatcher (minors),OF,,,,,,,,,,,,,4Yr,"Kennesaw State University (Kennesaw, GA)",10
2021,10,,284,2.0,Y,"$20,000",C.J. Widger (minors),LHP,,,,,,,,,,,,,JC,"Rowan College of South Jersey-Gloucester (Sewell, NJ)",10
2019,10,,295,8.0,Y,"$10,000",Joe Corbett (minors),P,,,,,,,,,,,,,4Yr,"West Texas A&M University (Canyon, TX)",10
2018,10,,299,15.0,Y,"$125,000",Leury Tejada (minors),RHP,,,,,,,,,,,,,HS,"Walton HS (Bronx, NY)",10
2017,10,,314,29.0,Y,"$10,000",John King (minors),LHP,0.6,4.0,1.0,0.0,0.0,0.0,107.0,11.0,10.0,3.91,1.38,0.0,4Yr,"University of Houston (Houston, TX)",10
2016,10,,309,23.0,Y,"$5,000",Josh Merrigan (minors),OF,,,,,,,,,,,,,4Yr,"Georgia Gwinnett College (Lawrenceville, GA)",10
2015,10,,288,3.0,Y,"$30,000",Leon Byrd (minors),SS,,,,,,,,,,,,,4Yr,"Rice University (Houston, TX)",10
2014,10,,306,21.0,Y,"$10,000",Seth Spivey (minors),C,,,,,,,,,,,,,4Yr,"Abilene Christian University (Abilene, TX)",10
2013,10,,310,24.0,Y,"$700,000",Cole Wiper (minors),RHP,,,,,,,,,,,,,4Yr,"University of Oregon (Eugene, OR)",10
2012,10,,336,28.0,Y,"$15,000",Casey Shiver (minors),RHP,,,,,,,,,,,,,JC,"Southern Polytechnic State University (Marietta, GA)",10
2011,10,,324,23.0,Y,"$90,000",Joe Maloney (minors),C,,,,,,,,,,,,,4Yr,"Limestone College (Gaffney, SC)",10
2010,10,,316,20.0,Y,"$85,000",Jared Hoying (minors),SS,-0.9,76.0,121.0,1.0,0.215,0.537,1.0,0.0,0.0,9.0,1.0,0.0,4Yr,"University of Toledo (Toledo, OH)",10
2009,10,,304,13.0,N,,Tom Lemke (minors),RHP,,,,,,,,,,,,,HS,"Northwest Christian School (Phoenix, AZ)",10
2008,10,,303,11.0,N,,Kevin Castner (minors),RHP,,,,,,,,,,,,,4Yr,"California Polytechnic State University, San Luis Obispo (San Luis Obispo, CA)",10
2007,10,,320,16.0,Y,"$10,000",Andrew Laughter (minors),RHP,,,,,,,,,,,,,4Yr,"University of Louisiana at Lafayette (Lafayette, LA)",10
2006,10,,298,12.0,Y,"$10,000",Craig Gentry (minors),OF,9.7,601.0,1242.0,7.0,0.262,0.672,1.0,0.0,0.0,18.0,4.0,0.0,4Yr,"University of Arkansas (Fayetteville, AR)",10
2005,10,,309,19.0,Y,"$58,000",Matt Nevarez (minors),RHP,,,,,,,,,,,,,HS,"San Fernando HS (San Fernando, CA)",10
2004,10,,291,10.0,N,,Justin Maxwell (minors),OF,2.7,441.0,1057.0,41.0,0.22,0.702,,,,,,,4Yr,"University of Maryland (College Park, MD)",10
2003,10,,286,9.0,Y,"$58,000",Adam Fox (minors),3B,,,,,,,,,,,,,4Yr,"Ohio University (Athens, OH)",10
2002,10,,292,10.0,Y,,Nate Gold (minors),1B,,,,,,,,,,,,,4Yr,"Gonzaga University (Spokane, WA)",10
2001,10,,291,5.0,Y,,Rob Moravek (minors),RHP,,,,,,,,,,,,,4Yr,"University of Georgia (Athens, GA)",10
2000,10,,304,24.0,Y,,Billy Montgomery (minors),OF,,,,,,,,,,,,,4Yr,"San Diego State University (San Diego, CA)",10
1999,10,,315,21.0,Y,,Jason Bryan (minors),OF,,,,,,,,,,,,,HS,"New Utrecht HS (Brooklyn, NY)",10
1998,10,,293,10.0,Y,,Justin Backsmeyer (minors),RHP,,,,,,,,,,,,,HS,"De Smet Jesuit HS (Creve Coeur, MO)",10
1997,10,,317,23.0,Y,,Kevin Harris (minors),OF,,,,,,,,,,,,,HS,"Tampa Bay Technical HS (Tampa, FL)",10
1996,10,,293,18.0,Y,,Doug Davis (minors),LHP,18.4,218.0,412.0,0.0,0.083,0.195,306.0,92.0,108.0,4.44,1.51,0.0,JC,"City College of San Francisco (San Francisco, CA)",10
1995,10,,262,7.0,Y,,Julio Mercado (minors),OF,,,,,,,,,,,,,HS,"Brooke Point HS (Stafford, VA)",10
1994,10,,281,22.0,Y,,Stephen Larkin (minors),1B,0.0,1.0,3.0,0.0,0.333,0.667,,,,,,,4Yr,"University of Texas at Austin (Austin, TX)",10
1993,10,,283,15.0,Y,,Brian Thomas (minors),OF,,,,,,,,,,,,,4Yr,"Texas A&M University (College Station, TX)",10
1992,10,,286,22.0,Y,,Scot Sealy (minors),C,,,,,,,,,,,,,4Yr,"University of South Alabama (Mobile, AL)",10
1991,10,,274,19.0,Y,,Dave Geeve (minors),RHP,,,,,,,,,,,,,4Yr,"Bradley University (Peoria, IL)",10
1990,10,,279,17.0,Y,,Rusty Greer (minors),OF,22.4,1027.0,3829.0,119.0,0.305,0.865,,,,,,,4Yr,"University of Montevallo (Montevallo, AL)",10
1989,10,,249,5.0,Y,,Steve Rowley (minors),RHP,,,,,,,,,,,,,4Yr,"Tulane University (New Orleans, LA)",10
1988,10,,245,6.0,Y,,Eric McCray (minors),LHP,,,,,,,,,,,,,HS,"Farmerville HS (Farmerville, LA)",10
1987,10,,259,19.0,Y,,Brian Steiner (minors),LHP,,,,,,,,,,,,,JC,"Seminole State College of Florida (Sanford, FL)",10
1986,10,,241,4.0,N,,Mike Belanger (minors),LHP,,,,,,,,,,,,,4Yr,"California State University, Fullerton (Fullerton, CA)",10
1985,10,,239,3.0,Y,,Frank Bryan (minors),RHP,,,,,,,,,,,,,HS,"Clovis HS (Clovis, CA)",10
1984,10,,248,12.0,Y,,Riley Epps (minors),C,,,,,,,,,,,,,4Yr,"University of Houston (Houston, TX)",10
1983,10,,239,3.0,Y,,Bruce Kipper (minors),LHP,,,,,,,,,,,,,4Yr,"Grand Canyon University (Phoenix, AZ)",10
1982,10,,252,16.0,Y,,Bob Gergen (minors),SS,,,,,,,,,,,,,4Yr,"Oklahoma City University (Oklahoma City, OK)",10
1981,10,,242,9.0,Y,,Joe Benes (minors),LHP,,,,,,,,,,,,,4Yr,"University of Nebraska Omaha (Omaha, NE)",10
1980,10,,247,14.0,Y,,Joe Roberts (minors),C,,,,,,,,,,,,,4Yr,"University of Louisville (Louisville, KY)",10
1979,10,,251,17.0,Y,,William Goodman (minors),2B,,,,,,,,,,,,,4Yr,"George Washington University (Washington, DC)",10
1978,10,,254,20.0,N,,Allan Ramirez (minors),RHP,1.2,0.0,0.0,0.0,,,11.0,4.0,4.0,3.47,1.33,0.0,4Yr,"Rice University (Houston, TX)",10
1977,10,,243,9.0,Y,,Charles Lamson (minors),LHP,,,,,,,,,,,,,JC,"Rowan College of South Jersey-Gloucester (Sewell, NJ)",10
1976,10,,228,12.0,Y,,Billy Sample (minors),3B,10.5,826.0,2516.0,46.0,0.272,0.713,,,,,,,4Yr,"James Madison University (Harrisonburg, VA)",10
1975,10,,233,17.0,N,,Richard Comeau (minors),RHP,,,,,,,,,,,,,HS,"Berkeley HS (Berkeley, CA)",10
1974,10,,218,2.0,N,,Ronald Smith (minors),SS,,,,,,,,,,,,,HS,"Elkhart Memorial HS (Elkhart, IN)",10
1973,10,,217,1.0,Y,,Steven Strickland (minors),LHP,,,,,,,,,,,,,HS,"Fort Myers HS (Fort Myers, FL)",10
1972,10,,220,4.0,Y,,Wayne Popiolek (minors),RHP,,,,,,,,,,,,,HS,"Reavis HS (Burbank, IL)",10
1971,10,,230,8.0,Y,,Alberto Zamora (minors),RHP,,,,,,,,,,,,,HS,"Miami Senior HS (Miami, FL)",10
1970,10,,237,15.0,N,,Harvey Willis (minors),SS,,,,,,,,,,,,,HS,"George Washington HS (Danville, VA)",10
1969,10,,217,1.0,N,,Claude Renfro (minors),RHP,,,,,,,,,,,,,HS,"Red Bank HS (Hixson, TN)",10
1968,10,,212,8.0,Y,,Larry Biittner (minors),LHP,-1.2,1217.0,3151.0,29.0,0.273,0.683,1.0,0.0,0.0,40.5,4.5,0.0,4Yr,"Buena Vista University (Storm Lake, IA)",10
1967,10,,185,5.0,Y,,Robert Koehler (minors),RHP,,,,,,,,,,,,,4Yr,"Rider University (Lawrenceville, NJ)",10
1966,10,,186,6.0,N,,Larry Herring (minors),LHP,,,,,,,,,,,,,HS,"Dillon HS (Dillon, SC)",10
1965,10,,234,,N,,Dennis McKernan (minors),OF,,,,,,,,,,,,,4Yr,"Kutztown University of Pennsylvania (Kutztown, PA)",10
