Year,Rnd,DT,OvPck,RdPck,Signed,Bonus,Name,Pos,WAR,G,AB,HR,BA,OPS,G.1,W,L,ERA,WHIP,SV,Type,Drafted Out of,Round
2022,4,,129,23.0,Y,"$272,500",Chase Meidroth (minors),SS,,,,,,,,,,,,,4Yr,"University of San Diego (San Diego, CA)",4
2021,4,,105,4.0,Y,"$497,500",Elmer Rodriguez-Cruz (minors),P,,,,,,,,,,,,,HS,"Leadership Christian Academy (Guaynabo, Puerto Rico)",4
2020,4,,118,17.0,Y,"$200,000",Jeremy Wu-Yelland (minors),P,,,,,,,,,,,,,4Yr,"University of Hawaii at Manoa (Honolulu, HI)",4
2019,4,,137,30.0,Y,"$100,000",Noah Song (minors),P,,,,,,,,,,,,,4Yr,"United States Naval Academy (Annapolis, MD)",4
2018,4,,130,26.0,Y,"$375,000",Kole Cottam (minors),C,,,,,,,,,,,,,4Yr,"University of Kentucky (Lexington, KY)",4
2017,4,,131,26.0,Y,"$350,000",Jake Thompson (minors),RHP,,,,,,,,,,,,,4Yr,"Oregon State University (Corvallis, OR)",4
2016,4,,118,12.0,Y,"$650,000",Bobby Dalbec (minors),3B,0.0,294.0,863.0,46.0,0.231,0.744,,,,,,,4Yr,"University of Arizona (Tucson, AZ)",4
2015,4,,111,6.0,Y,"$512,700",Tate Matheny (minors),CF,,,,,,,,,,,,,4Yr,"Missouri State University (Springfield, MO)",4
2014,4,,134,29.0,Y,"$300,000",Kevin McAvoy (minors),RHP,,,,,,,,,,,,,4Yr,"Bryant University (Smithfield, RI)",4
2013,4,,113,7.0,Y,"$400,000",Myles Smith (minors),RHP,,,,,,,,,,,,,4Yr,"Lee University (Cleveland, TN)",4
2012,4,,151,23.0,Y,"$1,300,000",Ty Buttrey (minors),RHP,1.3,5.0,0.0,0.0,,,115.0,8.0,11.0,4.3,1.3,11.0,HS,"Providence HS (Charlotte, NC)",4
2011,4,,142,21.0,Y,"$625,000",No� Ramirez (minors),RHP,1.6,39.0,0.0,0.0,,,277.0,18.0,16.0,4.21,1.24,2.0,4Yr,"California State University, Fullerton (Fullerton, CA)",4
2010,4,,143,28.0,Y,"$1,310,000",Garin Cecchini (minors),SS,0.2,13.0,35.0,1.0,0.229,0.725,,,,,,,HS,"Alfred M. Barbe HS (Lake Charles, LA)",4
2009,4,,138,27.0,Y,"$191,700",Jeremy Hazelbaker (minors),CF,1.1,155.0,252.0,14.0,0.258,0.827,,,,,,,4Yr,"Ball State University (Muncie, IN)",4
2008,4,,142,30.0,Y,"$1,000,000",Peter Hissey (minors),OF,,,,,,,,,,,,,HS,"Unionville HS (Kennett Square, PA)",4
2007,4,,144,20.0,Y,"$120,000",Chris Province (minors),RHP,,,,,,,,,,,,,4Yr,"Southeastern Louisiana University (Hammond, LA)",4
2006,4,,133,27.0,Y,"$225,000",Jon Still (minors),C,,,,,,,,,,,,,4Yr,"North Carolina State University (Raleigh, NC)",4
2005,4,,138,28.0,Y,"$75,000",Scott Blue (minors),RHP,,,,,,,,,,,,,HS,"Morro Bay HS (Morro Bay, CA)",4
2004,4,,125,24.0,Y,"$110,000",Tommy Hottovy (minors),LHP,0.1,1.0,0.0,0.0,,,17.0,0.0,0.0,4.05,1.73,0.0,4Yr,"Wichita State University (Wichita, KS)",4
2003,4,,114,17.0,Y,"$264,500",Jonathan Papelbon (minors),RHP,23.3,306.0,0.0,0.0,,,689.0,41.0,36.0,2.44,1.04,368.0,4Yr,"Mississippi State University (Mississippi State, MS)",4
2002,4,,118,16.0,Y,,Chris Smith (minors),RHP,-0.5,38.0,3.0,0.0,0.0,0.25,77.0,1.0,4.0,5.41,1.34,0.0,4Yr,"University of California, Riverside (Riverside, CA)",4
2001,4,,123,17.0,Y,,Stefan Bailie (minors),1B,,,,,,,,,,,,,4Yr,"Washington State University (Pullman, WA)",4
2000,4,,122,22.0,Y,,Brandon Mims (minors),LHP,,,,,,,,,,,,,HS,"Prattville HS (Prattville, AL)",4
1999,4,,139,25.0,N,,Rory Shortell (minors),RHP,,,,,,,,,,,,,HS,"Madison HS (Portland, OR)",4
1998,4,,115,12.0,Y,,Jerome Gamble (minors),RHP,,,,,,,,,,,,,HS,"Benjamin Russell HS (Alexander City, AL)",4
1997,4,,131,17.0,Y,,Angel Santos (minors),SS,-0.2,41.0,92.0,3.0,0.207,0.615,,,,,,,HS,"Miguel Melendez HS (Cayey, Puerto Rico)",4
1996,4,,121,26.0,Y,,John Barnes (minors),OF,-0.1,20.0,58.0,0.0,0.241,0.623,,,,,,,JC,"Grossmont College (El Cajon, CA)",4
1995,4,,102,15.0,Y,,Mike Spinelli (minors),LHP,,,,,,,,,,,,,HS,"Revere HS (Revere, MA)",4
1994,4,,103,12.0,Y,,Robb Welch (minors),RHP,,,,,,,,,,,,,HS,"Twin Falls HS (Twin Falls, ID)",4
1993,4,,107,7.0,Y,,Shawn Senior (minors),LHP,,,,,,,,,,,,,4Yr,"North Carolina State University (Raleigh, NC)",4
1992,4,,114,18.0,Y,,Joe Hamilton (minors),3B,,,,,,,,,,,,,HS,"Dighton-Rehoboth HS (North Dighton, MA)",4
1991,4,,122,23.0,Y,,Joe Ciccarella (minors),1B,,,,,,,,,,,,,4Yr,"Loyola Marymount University (Los Angeles, CA)",4
1990,4,,119,20.0,N,,Greg Thomas (minors),OF,,,,,,,,,,,,,HS,"Lake Brantley HS (Altamonte Springs, FL)",4
1989,4,,110,24.0,Y,,Jeff Bagwell (minors),3B,79.9,2150.0,7797.0,449.0,0.297,0.948,,,,,,,4Yr,"University of Hartford (West Hartford, CT)",4
1988,4,,95,12.0,Y,,Dan Kite (minors),RHP,,,,,,,,,,,,,4Yr,"Louisiana State University (Baton Rouge, LA)",4
1987,4,,110,26.0,Y,,Scott Powers (minors),SS,,,,,,,,,,,,,4Yr,"Brandeis University (Waltham, MA)",4
1986,4,,95,14.0,Y,,Chuck Wacha (minors),RHP,,,,,,,,,,,,,4Yr,"Columbus State University (Columbus, GA)",4
1985,4,,101,21.0,Y,,Donnie McGowan (minors),RHP,,,,,,,,,,,,,4Yr,"University of Central Missouri (Warrensburg, MO)",4
1984,4,,94,14.0,N,,Sean Berry (minors),SS,4.8,860.0,2413.0,81.0,0.272,0.779,,,,,,,HS,"West HS (Torrance, CA)",4
1983,4,,99,19.0,Y,,Tony Latham (minors),OF,,,,,,,,,,,,,4Yr,"University of Virginia (Charlottesville, VA)",4
1982,4,,98,18.0,Y,,Tim Gordon (minors),3B,,,,,,,,,,,,,4Yr,"University of Maryland (College Park, MD)",4
1981,4,,96,19.0,Y,,Todd Benzinger (minors),1B,-2.7,924.0,2856.0,66.0,0.257,0.687,,,,,,,HS,"New Richmond HS (New Richmond, OH)",4
1980,4,,101,24.0,Y,,Jeff Hall (minors),C,,,,,,,,,,,,,4Yr,"Rochester Institute of Technology (Henrietta, NY)",4
1979,4,,104,26.0,N,,Gib Seibert (minors),OF,,,,,,,,,,,,,HS,"Sahuaro HS (Tucson, AZ)",4
1978,4,,102,24.0,Y,,Edward Connors (minors),3B,,,,,,,,,,,,,HS,"North Bergen HS (North Bergen, NJ)",4
1977,4,,91,13.0,Y,,Erwin Bryant (minors),SS,,,,,,,,,,,,,JC,"Columbia State Community College (Columbia, TN)",4
1976,4,,94,22.0,N,,Larry Jones (minors),RHP,,,,,,,,,,,,,4Yr,"Florida State University (Tallahassee, FL)",4
1975,4,,87,15.0,Y,,Mike Moore (minors),RHP,,,,,,,,,,,,,HS,"Oak Park HS (Kansas City, MO)",4
1974,4,,92,20.0,Y,,Charles Reilly (minors),2B,,,,,,,,,,,,,4Yr,"Adelphi University (Garden City, NY)",4
1973,4,,89,17.0,Y,,Curran Percival (minors),RHP,,,,,,,,,,,,,4Yr,"Chapman University (Orange, CA)",4
1972,4,,88,16.0,Y,,Ronnie Sims (minors),RHP,,,,,,,,,,,,,HS,"Paul M. Dorman HS (Roebuck, SC)",4
1971,4,,88,16.0,Y,,Tom Pokarski (minors),LHP,,,,,,,,,,,,,HS,"Northview HS (Covina, CA)",4
1970,4,,89,17.0,Y,,Chuck Ross (minors),LHP,,,,,,,,,,,,,HS,"Woodrow Wilson HS (Long Beach, CA)",4
1969,4,,85,13.0,Y,,Jim Wright (minors),RHP,2.6,0.0,0.0,0.0,,,35.0,9.0,4.0,3.82,1.24,0.0,HS,"Coopersville HS (Coopersville, MI)",4
1968,4,,80,20.0,Y,,Allen Collins (minors),C,,,,,,,,,,,,,HS,"Glendora HS (Glendora, CA)",4
1967,4,,63,3.0,N,,Dudley Mitchell (minors),OF,,,,,,,,,,,,,HS,"Thomas Jefferson HS (Denver, CO)",4
1966,4,,64,4.0,N,,Skip Jutze (minors),C,-3.7,254.0,656.0,3.0,0.215,0.512,,,,,,,4Yr,"Central Connecticut State University (New Britain, CT)",4
1965,4,,75,15.0,Y,,Frederick Marden (minors),LHP,,,,,,,,,,,,,4Yr,"Brandeis University (Waltham, MA)",4
2023,5,,151,14.0,Y,"$408,500",Connelly Early (minors),P,,,,,,,,,,,,,4Yr,"University of Virginia (Charlottesville, VA)",5
2022,5,,159,23.0,Y,"$322,500",Noah Dean (minors),P,,,,,,,,,,,,,4Yr,"Old Dominion University (Norfolk, VA)",5
2021,5,,136,4.0,Y,"$1,000,000",Nathan Hickey (minors),C,,,,,,,,,,,,,4Yr,"University of Florida (Gainesville, FL)",5
2020,5,,148,17.0,Y,"$600,000",Shane Drohan (minors),P,,,,,,,,,,,,,4Yr,"Florida State University (Tallahassee, FL)",5
2019,5,,167,30.0,Y,"$304,200",Jaxx Groshans (minors),C,,,,,,,,,,,,,4Yr,"University of Kansas (Lawrence, KS)",5
2018,5,,160,26.0,Y,"$275,000",Thaddeus Ward (minors),RHP,-0.3,0.0,0.0,,,,26.0,0.0,0.0,6.37,1.61,0.0,4Yr,"University of Central Florida (Orlando, FL)",5
2017,5,,161,26.0,Y,"$700,000",Alex Scherff (minors),RHP,,,,,,,,,,,,,HS,"Colleyville Heritage HS (Colleyville, TX)",5
2016,5,,148,12.0,Y,"$637,500",Mike Shawaryn (minors),RHP,-0.6,0.0,0.0,0.0,,,14.0,0.0,0.0,9.74,1.92,0.0,4Yr,"University of Maryland (College Park, MD)",5
2015,5,,141,6.0,Y,"$384,000",Jagger Rusconi (minors),CF,,,,,,,,,,,,,HS,"West Ranch HS (Santa Clarita, CA)",5
2014,5,,164,29.0,Y,"$450,000",Josh Ockimey (minors),1B,,,,,,,,,,,,,HS,"Sts. Neumann and Goretti HS (Philadelphia, PA)",5
2013,5,,143,7.0,Y,"$300,000",Corey Littrell (minors),LHP,,,,,,,,,,,,,4Yr,"University of Kentucky (Lexington, KY)",5
2012,5,,181,23.0,Y,"$25,000",Mike Augliera (minors),RHP,,,,,,,,,,,,,4Yr,"State University of New York at Binghamton (Binghamton, NY)",5
2011,5,,172,21.0,Y,"$750,000",Mookie Betts (minors),SS,64.5,1265.0,5044.0,252.0,0.294,0.9,,,,,,,HS,"Overton HS (Nashville, TN)",5
2010,5,,173,28.0,Y,"$138,200",Henry Ramos (minors),RF,-0.4,41.0,124.0,1.0,0.226,0.619,,,,,,,HS,"Alfonso Casta Martinez HS (Maunabo, Puerto Rico)",5
2009,5,,168,27.0,Y,"$140,000",Seth Schwindenhammer (minors),LF,,,,,,,,,,,,,HS,"Limestone Community HS (Bartonville, IL)",5
2008,5,,172,30.0,Y,"$2,000,000",Ryan Westmoreland (minors),OF,,,,,,,,,,,,,HS,"Portsmouth HS (Portsmouth, RI)",5
2007,5,,174,20.0,Y,"$925,000",Will Middlebrooks (minors),3B,-0.8,347.0,1150.0,43.0,0.228,0.663,,,,,,,HS,"Liberty Eylau HS (Texarkana, TX)",5
2006,5,,163,27.0,Y,"$107,000",Dustin Richardson (minors),LHP,0.4,1.0,0.0,0.0,,,29.0,0.0,0.0,3.31,2.02,0.0,4Yr,"Texas Tech University (Lubbock, TX)",5
2005,5,,168,28.0,Y,"$154,000",Reid Engel (minors),OF,,,,,,,,,,,,,HS,"Lewis-Palmer HS (Monument, CO)",5
2004,5,,155,24.0,Y,"$90,000",Ryan Schroyer (minors),RHP,,,,,,,,,,,,,4Yr,"San Diego State University (San Diego, CA)",5
2003,5,,144,17.0,Y,"$185,000",Brian Marshall (minors),LHP,,,,,,,,,,,,,4Yr,"Virginia Commonwealth University (Richmond, VA)",5
2002,5,,148,16.0,Y,,Chad Spann (minors),SS,,,,,,,,,,,,,HS,"Southland Academy HS (Americus, GA)",5
2001,5,,153,17.0,Y,,Eric West (minors),SS,,,,,,,,,,,,,HS,"Southside HS (Southside, AL)",5
2000,5,,152,22.0,Y,,Brian Esposito (minors),C,-0.1,3.0,3.0,0.0,0.0,0.0,,,,,,,4Yr,"University of Connecticut (Storrs, CT)",5
1999,5,,169,25.0,Y,,Greg Montalbano (minors),LHP,,,,,,,,,,,,,4Yr,"Northeastern University (Boston, MA)",5
1998,5,,145,12.0,Y,,Josh Hancock (minors),RHP,0.7,97.0,24.0,0.0,0.083,0.298,102.0,9.0,7.0,4.2,1.32,1.0,4Yr,"Auburn University (Auburn, AL)",5
1997,5,,161,17.0,Y,,Greg Miller (minors),LHP,,,,,,,,,,,,,HS,"West Aurora HS (Aurora, IL)",5
1996,5,,151,26.0,Y,,Bobby Brito (minors),C,,,,,,,,,,,,,HS,"Cypress HS (Cypress, CA)",5
1995,5,,130,15.0,Y,,Steve Lomasney (minors),C,0.1,1.0,2.0,0.0,0.0,0.0,,,,,,,HS,"Peabody Veterans Memorial HS (Peabody, MA)",5
1994,5,,131,12.0,Y,,Brian Barkley (minors),LHP,-0.5,0.0,0.0,0.0,,,6.0,0.0,0.0,9.82,2.27,0.0,HS,"Midway HS (Waco, TX)",5
1993,5,,135,7.0,Y,,Kevin Clark (minors),3B,,,,,,,,,,,,,JC,"Cypress College (Cypress, CA)",5
1992,5,,142,18.0,Y,,Steve Rodriguez (minors),2B,-0.3,18.0,39.0,0.0,0.18,0.494,,,,,,,4Yr,"Pepperdine University (Malibu, CA)",5
1991,5,,148,23.0,N,,Mark Carroll (minors),OF,,,,,,,,,,,,,HS,"Holliston HS (Holliston, MA)",5
1990,5,,146,19.0,Y,,Tim Tackett (minors),C,,,,,,,,,,,,,HS,"Waverly HS (Waverly, OH)",5
1989,5,,137,24.0,Y,,Tim Mitchell (minors),1B,,,,,,,,,,,,,HS,"Culver City HS (Culver City, CA)",5
1988,5,,121,12.0,Y,,John Valentin (minors),SS,32.5,1105.0,3917.0,124.0,0.279,0.814,,,,,,,4Yr,"Seton Hall University (South Orange, NJ)",5
1987,5,,136,26.0,Y,,Harry Michael (minors),OF,,,,,,,,,,,,,4Yr,"Emporia State University (Emporia, KS)",5
1986,5,,121,14.0,Y,,Steve Bast (minors),LHP,,,,,,,,,,,,,4Yr,"University of Southern California (Los Angeles, CA)",5
1985,5,,127,21.0,Y,,Mike Clarkin (minors),RHP,,,,,,,,,,,,,4Yr,"University of Minnesota (Minneapolis, MN)",5
1984,5,,120,14.0,N,,Steven Boyd (minors),C,,,,,,,,,,,,,4Yr,"Southern Illinois University Carbondale (Carbondale, IL)",5
1983,5,,125,19.0,Y,,Tim Corder (minors),RHP,,,,,,,,,,,,,4Yr,"University of Memphis (Memphis, TN)",5
1982,5,,124,18.0,Y,,Gary Miller-Jones (minors),2B,,,,,,,,,,,,,4Yr,"University of South Alabama (Mobile, AL)",5
1981,5,,122,19.0,Y,,Pete Gonzales (minors),OF,,,,,,,,,,,,,HS,"San Leandro HS (San Leandro, CA)",5
1980,5,,127,24.0,Y,,Ronnie Hill (minors),LHP,,,,,,,,,,,,,HS,"Dixie HS (St. George, UT)",5
1979,5,,130,26.0,Y,,Jim Watkins (minors),OF,,,,,,,,,,,,,4Yr,"University of Florida (Gainesville, FL)",5
1978,5,,128,24.0,Y,,Del Bender (minors),OF,,,,,,,,,,,,,4Yr,"Mississippi State University (Mississippi State, MS)",5
1977,5,,117,13.0,Y,,Mark Baum (minors),RHP,,,,,,,,,,,,,HS,"Northland HS (Columbus, OH)",5
1976,5,,118,22.0,Y,,Mike Smithson (minors),RHP,6.2,0.0,0.0,0.0,,,240.0,76.0,86.0,4.58,1.37,2.0,4Yr,"University of Tennessee (Knoxville, TN)",5
1975,5,,111,15.0,Y,,Larry Hyman (minors),3B,,,,,,,,,,,,,HS,"Irwin County HS (Ocilla, GA)",5
1974,5,,116,20.0,N,,Craig Brooks (minors),OF,,,,,,,,,,,,,HS,"Richmond HS (Richmond, CA)",5
1973,5,,113,17.0,Y,,Rick Jones (minors),LHP,1.2,0.0,0.0,0.0,,,37.0,6.0,9.0,4.02,1.68,0.0,HS,"Nathan B. Forrest HS (Jacksonville, FL)",5
1972,5,,112,16.0,Y,,William Fewox (minors),RHP,,,,,,,,,,,,,HS,"Truman HS (Independence, MO)",5
1971,5,,113,16.0,Y,,Tom Cassell (minors),SS,,,,,,,,,,,,,4Yr,"Mansfield University of Pennsylvania (Mansfield, PA)",5
1970,5,,114,17.0,Y,,Donald Dudley (minors),RHP,,,,,,,,,,,,,HS,"Central HS (St. Joseph, MO)",5
1969,5,,109,13.0,Y,,Dwight Evans (minors),3B,67.2,2606.0,8996.0,385.0,0.272,0.84,,,,,,,HS,"Chatsworth Charter HS (Chatsworth, CA)",5
1968,5,,104,20.0,N,,Manuel Crespo (minors),SS,,,,,,,,,,,,,HS,"Miami Senior HS (Miami, FL)",5
1967,5,,83,3.0,N,,Mike Witt (minors),OF,,,,,,,,,,,,,HS,"McLane HS (Fresno, CA)",5
1966,5,,84,4.0,Y,,Wayne McGhee (minors),C,,,,,,,,,,,,,4Yr,"California State University, Fresno (Fresno, CA)",5
1965,5,,95,15.0,Y,,Amos Otis (minors),SS,42.8,1998.0,7299.0,193.0,0.277,0.768,,,,,,,HS,"Williamson HS (Mobile, AL)",5
2023,6,,178,14.0,Y,"$50,000",CJ Weins (minors),P,,,,,,,,,,,,,4Yr,"Western Kentucky University (Bowling Green, KY)",6
2022,6,,189,23.0,Y,"$32,250",Alex Hoppe (minors),P,,,,,,,,,,,,,4Yr,"University of North Carolina at Greensboro (Greensboro, NC)",6
2021,6,,166,4.0,Y,"$197,500",Daniel McElveny (minors),SS,,,,,,,,,,,,,HS,"Bonita Vista HS (Chula Vista, CA)",6
2019,6,,197,30.0,Y,"$200,000",Chris Murphy (minors),P,0.1,0.0,0.0,,,,20.0,1.0,2.0,4.91,1.41,1.0,4Yr,"University of San Diego (San Diego, CA)",6
2018,6,,190,26.0,Y,"$40,000",Devlin Granberg (minors),OF,,,,,,,,,,,,,4Yr,"Dallas Baptist University (Dallas, TX)",6
2017,6,,191,26.0,Y,"$175,000",Zach Schellenger (minors),RHP,,,,,,,,,,,,,4Yr,"Seton Hall University (South Orange, NJ)",6
2016,6,,178,12.0,Y,"$250,000",Stephen Nogosek (minors),RHP,-0.3,8.0,1.0,0.0,0.0,0.0,33.0,1.0,4.0,5.02,1.5,0.0,4Yr,"University of Oregon (Eugene, OR)",6
2015,6,,171,6.0,Y,"$320,000",Travis Lakins Sr. (minors),RHP,0.6,2.0,0.0,0.0,,,68.0,4.0,8.0,4.84,1.5,1.0,4Yr,"The Ohio State University (Columbus, OH)",6
2014,6,,194,29.0,Y,"$211,800",Danny Mars (minors),CF,,,,,,,,,,,,,JC,"Chipola College (Marianna, FL)",6
2013,6,,173,7.0,Y,"$254,900",Jordon Austin (minors),CF,,,,,,,,,,,,,HS,"Forest HS (Ocala, FL)",6
2012,6,,211,23.0,Y,"$125,000",Justin Haley (minors),RHP,-0.1,1.0,0.0,0.0,,,14.0,0.0,0.0,5.61,1.6,1.0,4Yr,"California State University, Fresno (Fresno, CA)",6
2011,6,,202,21.0,Y,"$85,000",Miguel Pena (minors),LHP,,,,,,,,,,,,,JC,"San Jacinto College, North Campus (Houston, TX)",6
2010,6,,203,28.0,Y,"$628,000",Kendrick Perkins (minors),CF,,,,,,,,,,,,,HS,"La Porte HS (La Porte, TX)",6
2009,6,,198,27.0,N,,Branden Kline (minors),RHP,0.1,3.0,0.0,0.0,,,37.0,1.0,4.0,5.48,1.48,0.0,HS,"Governor Thomas Johnson HS (Frederick, MD)",6
2008,6,,202,30.0,Y,"$325,000",Ryan Lavarnway (minors),3B,-1.2,165.0,447.0,9.0,0.217,0.617,,,,,,,4Yr,"Yale University (New Haven, CT)",6
2007,6,,204,20.0,Y,"$325,000",Anthony Rizzo (minors),1B,39.7,1635.0,5951.0,295.0,0.263,0.838,2.0,0.0,0.0,0.0,1.0,0.0,HS,"Marjory Stoneman Douglas HS (Parkland, FL)",6
2006,6,,193,27.0,Y,"$30,000",Zach Daeges (minors),3B,,,,,,,,,,,,,4Yr,"Creighton University (Omaha, NE)",6
2005,6,,198,28.0,Y,"$50,000",Jeff Corsaletti (minors),OF,,,,,,,,,,,,,4Yr,"University of Florida (Gainesville, FL)",6
2004,6,,185,24.0,Y,"$135,000",Cla Meredith (minors),RHP,2.9,225.0,2.0,0.0,0.0,0.0,286.0,14.0,14.0,3.62,1.34,1.0,4Yr,"Virginia Commonwealth University (Richmond, VA)",6
2003,6,,174,17.0,Y,"$120,000",Jessie Corn (minors),RHP,,,,,,,,,,,,,4Yr,"Jacksonville State University (Jacksonville, AL)",6
2002,6,,178,16.0,N,,Barret Browning (minors),LHP,-0.2,22.0,1.0,0.0,0.0,0.0,22.0,1.0,3.0,5.12,1.29,0.0,HS,"Wayne County HS (Jesup, GA)",6
2001,6,,183,17.0,N,,Justin James (minors),RHP,0.0,0.0,0.0,0.0,,,5.0,0.0,0.0,4.5,2.75,0.0,HS,"Yukon HS (Yukon, OK)",6
2000,6,,182,22.0,Y,,Kenny Perez (minors),SS,,,,,,,,,,,,,HS,"South Miami HS (Miami, FL)",6
1999,6,,199,25.0,N,,Jon Kail (minors),OF,,,,,,,,,,,,,HS,"Baldwin HS (Pittsburgh, PA)",6
1998,6,,175,12.0,Y,,Ric Riccobono (minors),RHP,,,,,,,,,,,,,HS,"Commack HS (Commack, NY)",6
1997,6,,191,17.0,N,,Kris Wilken (minors),C,,,,,,,,,,,,,HS,"Eldorado HS (Albuquerque, NM)",6
1996,6,,181,26.0,Y,,Mike Perini (minors),OF,,,,,,,,,,,,,HS,"Carlsbad HS (Carlsbad, NM)",6
1995,6,,158,15.0,Y,,Matt Kinney (minors),RHP,0.3,69.0,69.0,0.0,0.073,0.186,103.0,19.0,27.0,5.29,1.58,0.0,HS,"Bangor HS (Bangor, ME)",6
1994,6,,159,12.0,Y,,Joe Mamott (minors),RHP,,,,,,,,,,,,,4Yr,"Canisius College (Buffalo, NY)",6
1993,6,,163,7.0,N,,Peter Munro (minors),RHP,0.6,78.0,53.0,0.0,0.094,0.25,120.0,13.0,19.0,4.88,1.57,0.0,HS,"Benjamin N. Cardozo HS (Bayside, NY)",6
1992,6,,170,18.0,Y,,Derek Vinyard (minors),OF,,,,,,,,,,,,,4Yr,"San Diego State University (San Diego, CA)",6
1991,6,,174,23.0,Y,,Donny Jones (minors),OF,,,,,,,,,,,,,HS,"Poway HS (Poway, CA)",6
1990,6,,173,19.0,Y,,Gar Finnvold (minors),RHP,0.0,0.0,0.0,0.0,,,8.0,0.0,4.0,5.94,1.65,0.0,4Yr,"Florida State University (Tallahassee, FL)",6
1989,6,,163,23.0,Y,,Paul Quantrill (minors),RHP,17.8,274.0,67.0,0.0,0.105,0.259,841.0,68.0,78.0,3.83,1.42,21.0,4Yr,"University of Wisconsin at Madison (Madison, WI)",6
1988,6,,147,12.0,Y,,Ed Riley (minors),LHP,,,,,,,,,,,,,HS,"St. Peter's HS (Worcester, MA)",6
1987,6,,162,26.0,Y,,Ronnie Richardson (minors),RHP,,,,,,,,,,,,,HS,"Lee HS (Columbus, MS)",6
1986,6,,147,14.0,Y,,Bart Haley (minors),LHP,,,,,,,,,,,,,4Yr,"Grand Canyon University (Phoenix, AZ)",6
1985,6,,153,21.0,Y,,Todd Pratt (minors),C,4.3,662.0,1612.0,49.0,0.251,0.741,,,,,,,HS,"Hilltop HS (Chula Vista, CA)",6
1984,6,,146,14.0,N,,Larry Schwartz (minors),LHP,,,,,,,,,,,,,4Yr,"Seton Hall University (South Orange, NJ)",6
1983,6,,151,19.0,Y,,Gary Tremblay (minors),C,,,,,,,,,,,,,4Yr,"Coastal Carolina University (Conway, SC)",6
1982,6,,150,18.0,Y,,Sam Nattile (minors),3B,,,,,,,,,,,,,4Yr,"University of Central Florida (Orlando, FL)",6
1981,6,,148,19.0,Y,,Kevin Clinton (minors),RHP,,,,,,,,,,,,,4Yr,"University of Kansas (Lawrence, KS)",6
1980,6,,153,24.0,Y,,Pat Dodson (minors),1B,-0.5,52.0,99.0,4.0,0.202,0.738,,,,,,,4Yr,"University of California, Los Angeles (Los Angeles, CA)",6
1979,6,,156,26.0,N,,Richard Thompson (minors),SS,,,,,,,,,,,,,HS,"Glen Oak HS (Canton, OH)",6
1978,6,,154,24.0,Y,,Steven Schaefer (minors),RHP,,,,,,,,,,,,,HS,"Alhambra HS (Alhambra, CA)",6
1977,6,,143,13.0,Y,,Scott Burk (minors),3B,,,,,,,,,,,,,4Yr,"Oklahoma State University (Stillwater, OK)",6
1976,6,,142,22.0,N,,Ron Kovach (minors),LHP,,,,,,,,,,,,,HS,"Grand Junction HS (Grand Junction, CO)",6
1975,6,,135,15.0,Y,,Mike Howard (minors),RHP,,,,,,,,,,,,,HS,"South Portland HS (South Portland, ME)",6
1974,6,,140,20.0,Y,,Robert Klass (minors),RHP,,,,,,,,,,,,,4Yr,"Southern Illinois University Carbondale (Carbondale, IL)",6
1973,6,,137,17.0,Y,,Glenn Bannister (minors),C,,,,,,,,,,,,,4Yr,"University of Oklahoma (Norman, OK)",6
1972,6,,136,16.0,Y,,Don Aase (minors),RHP,15.0,81.0,5.0,0.0,0.0,0.0,448.0,66.0,60.0,3.8,1.39,82.0,HS,"Savanna HS (Anaheim, CA)",6
1971,6,,138,16.0,Y,,Terry Stokes (minors),SS,,,,,,,,,,,,,4Yr,"University of Pittsburgh (Pittsburgh, PA)",6
1970,6,,139,17.0,Y,,Tom Jones (minors),RHP,,,,,,,,,,,,,4Yr,"Carson-Newman University (Jefferson City, TN)",6
1970,6,,139,17.0,N,,Tom Jones (minors),RHP,,,,,,,,,,,,,4Yr,"Carson-Newman University (Jefferson City, TN)",6
1969,6,,133,13.0,Y,,Mike Cummings (minors),SS,,,,,,,,,,,,,4Yr,"Grambling State University (Grambling, LA)",6
1968,6,,128,20.0,Y,,Cecil Cooper (minors),1B,36.0,1896.0,7349.0,241.0,0.298,0.803,,,,,,,HS,"Brenham HS (Brenham, TX)",6
1967,6,,103,3.0,Y,,Samuel Phillips (minors),RHP,,,,,,,,,,,,,HS,"Eastern Hills HS (Fort Worth, TX)",6
1966,6,,104,4.0,Y,,Mike Nagy (minors),RHP,2.1,88.0,133.0,0.0,0.135,0.352,87.0,20.0,13.0,4.15,1.53,0.0,HS,"St. Helena HS (Bronx, NY)",6
1965,6,,115,15.0,Y,,James Thomas (minors),LHP,,,,,,,,,,,,,4Yr,"California State University, Sacramento (Sacramento, CA)",6
2023,7,,208,14.0,Y,"$150,000",Caden Rose (minors),OF,,,,,,,,,,,,,4Yr,"University of Alabama (Tuscaloosa, AL)",7
2022,7,,219,23.0,Y,"$7,500",Caleb Bolden (minors),P,,,,,,,,,,,,,4Yr,"Texas Christian University (Fort Worth, TX)",7
2021,7,,196,4.0,Y,"$236,500",Wyatt Olds (minors),P,,,,,,,,,,,,,4Yr,"University of Oklahoma (Norman, OK)",7
2019,7,,227,30.0,Y,"$465,000",Brock Bell (minors),RHP,,,,,,,,,,,,,JC,"State College of Florida, Manatee-Sarasota (Bradenton, FL)",7
2018,7,,220,26.0,Y,"$189,800",Jarren Duran (minors),2B,1.3,193.0,643.0,13.0,0.258,0.729,,,,,,,4Yr,"California State University, Long Beach (Long Beach, CA)",7
2017,7,,221,26.0,Y,"$250,000",Tyler Esplin (minors),OF,,,,,,,,,,,,,HS,"IMG Academy (Bradenton, FL)",7
2016,7,,208,12.0,Y,"$10,000",Ryan Scott (minors),LF,,,,,,,,,,,,,4Yr,"University of Arkansas at Little Rock (Little Rock, AR)",7
2015,7,,201,6.0,Y,"$10,000",Ben Taylor (minors),RHP,-0.1,2.0,0.0,0.0,,,20.0,0.0,1.0,5.4,1.54,1.0,4Yr,"University of South Alabama (Mobile, AL)",7
2014,7,,224,29.0,Y,"$107,500",Reed Reilly (minors),RHP,,,,,,,,,,,,,4Yr,"California Polytechnic State University, San Luis Obispo (San Luis Obispo, CA)",7
2013,7,,203,7.0,Y,"$150,000",Mike Adams (minors),LHP,,,,,,,,,,,,,4Yr,"University of Tampa (Tampa, FL)",7
2012,7,,241,23.0,Y,"$1,000",Kyle Kraus (minors),RHP,,,,,,,,,,,,,4Yr,"University of Portland (Portland, OR)",7
2011,7,,232,21.0,Y,"$800,000",Cody Kukuk (minors),LHP,,,,,,,,,,,,,HS,"Free State HS (Lawrence, KS)",7
2010,7,,233,28.0,Y,"$375,000",Chris Hernandez (minors),LHP,,,,,,,,,,,,,4Yr,"University of Miami (Coral Gables, FL)",7
2009,7,,228,27.0,Y,"$975,000",Madison Younginer (minors),RHP,-0.1,8.0,0.0,0.0,,,8.0,0.0,0.0,6.43,2.29,0.0,HS,"Mauldin HS (Mauldin, SC)",7
2008,7,,232,30.0,Y,"$150,000",Tim Federowicz (minors),C,-1.1,163.0,406.0,12.0,0.192,0.568,1.0,0.0,0.0,9.0,3.0,0.0,4Yr,"University of North Carolina at Chapel Hill (Chapel Hill, NC)",7
2007,7,,234,20.0,Y,"$550,000",David Mailman (minors),1B,,,,,,,,,,,,,HS,"Providence HS (Charlotte, NC)",7
2006,7,,223,27.0,Y,"$105,000",Kristopher Negr�n (minors),SS,1.9,170.0,375.0,9.0,0.221,0.627,,,,,,,JC,"Cosumnes River College (Sacramento, CA)",7
2005,7,,228,28.0,Y,"$90,000",Yahmed Yema (minors),OF,,,,,,,,,,,,,4Yr,"Florida International University (Miami, FL)",7
2004,7,,215,24.0,Y,"$95,000",Patrick Perry (minors),C,,,,,,,,,,,,,4Yr,"University of Northern Colorado (Greeley, CO)",7
2003,7,,204,17.0,Y,"$105,000",Jeremy West (minors),C,,,,,,,,,,,,,4Yr,"Arizona State University (Tempe, AZ)",7
2002,7,,208,16.0,Unk,,Jason Neighborgall (minors),RHP,,,,,,,,,,,,,HS,"Riverside HS (Durham, NC)",7
2001,7,,213,17.0,Y,,Rolando Viera (minors),LHP,,,,,,,,,,,,,,,7
2000,7,,212,22.0,Y,,Tony Fontana (minors),RHP,,,,,,,,,,,,,4Yr,"Bowling Green State University (Bowling Green, OH)",7
1999,7,,229,25.0,N,,Rich Carroll (minors),1B,,,,,,,,,,,,,HS,"Venice HS (Venice, FL)",7
1998,7,,205,12.0,N,,Keto Anderson (minors),2B,,,,,,,,,,,,,HS,"Prattville HS (Prattville, AL)",7
1997,7,,221,17.0,Y,,Jeff Taglienti (minors),RHP,,,,,,,,,,,,,4Yr,"Tufts University (Medford, MA)",7
1996,7,,211,26.0,Y,,Robert Ramsay (minors),LHP,0.8,1.0,0.0,0.0,,,43.0,1.0,3.0,4.19,1.67,0.0,4Yr,"Washington State University (Pullman, WA)",7
1995,7,,186,15.0,Y,,Cole Liniak (minors),SS,-0.7,15.0,32.0,0.0,0.219,0.524,,,,,,,HS,"San Dieguito HS Academy (Encinitas, CA)",7
1994,7,,187,12.0,Y,,Denis McLaughlin (minors),RHP,,,,,,,,,,,,,4Yr,"Old Dominion University (Norfolk, VA)",7
1993,7,,191,7.0,Y,,Dave Gibralter (minors),3B,,,,,,,,,,,,,HS,"Duncanville HS (Duncanville, TX)",7
1992,7,,198,18.0,Y,,Joe DePastino (minors),LHP,-0.1,2.0,2.0,0.0,0.0,0.0,,,,,,,HS,"Riverview HS (Sarasota, FL)",7
1991,7,,200,23.0,Y,,Dan Collier (minors),OF,,,,,,,,,,,,,JC,"Enterprise State Community College (Enterprise, AL)",7
1990,7,,200,19.0,Y,,Todd Miller (minors),RHP,,,,,,,,,,,,,4Yr,"Temple University (Philadelphia, PA)",7
1989,7,,189,23.0,N,,Paul Anacki (minors),RHP,,,,,,,,,,,,,HS,"Sandwich HS (East Sandwich, MA)",7
1988,7,,173,12.0,Y,,Dave Owen (minors),LHP,,,,,,,,,,,,,4Yr,"Carson-Newman University (Jefferson City, TN)",7
1987,7,,188,26.0,N,,Scott Vonderlieth (minors),LHP,,,,,,,,,,,,,HS,"Mission Bay HS (San Diego, CA)",7
1986,7,,173,14.0,N,,Mike Garcia (minors),RHP,-0.6,20.0,3.0,0.0,0.333,0.667,20.0,1.0,2.0,7.36,1.8,0.0,HS,"North Riverside HS (Riverside, CA)",7
1985,7,,179,21.0,Y,,Gary Gouldrup (minors),3B,,,,,,,,,,,,,HS,"Oliver Ames HS (North Easton, MA)",7
1984,7,,172,14.0,Y,,Steve Curry (minors),RHP,-0.3,0.0,0.0,0.0,,,3.0,0.0,1.0,8.18,2.64,0.0,JC,"State College of Florida, Manatee-Sarasota (Bradenton, FL)",7
1983,7,,177,19.0,Y,,John Mitchell (minors),RHP,-0.5,27.0,38.0,0.0,0.105,0.237,51.0,9.0,14.0,4.35,1.52,0.0,HS,"Overton HS (Nashville, TN)",7
1982,7,,176,18.0,N,,Jay Grate (minors),RHP,,,,,,,,,,,,,HS,"East Noble HS (Kendaliville, IN)",7
1981,7,,174,19.0,N,,Kevin Fowler (minors),SS,,,,,,,,,,,,,HS,"Donar HS (Stillwater, OK)",7
1980,7,,179,24.0,N,,Mark Margis (minors),LHP,,,,,,,,,,,,,HS,"Culver City HS (Culver City, CA)",7
1979,7,,182,26.0,Y,,Tom McCarthy (minors),RHP,0.7,0.0,0.0,0.0,,,40.0,3.0,2.0,3.61,1.35,1.0,HS,"Plymouth Carver HS (Plymouth, MA)",7
1978,7,,180,24.0,Y,,Kenneth Hagemann (minors),1B,,,,,,,,,,,,,HS,"Tottenville HS (Staten Island, NY)",7
1977,7,,169,13.0,Y,,Richard Parr (minors),OF,,,,,,,,,,,,,4Yr,"Greenville University (Greenville, IL)",7
