Year,Rnd,DT,OvPck,RdPck,Signed,Bonus,Name,Pos,WAR,G,AB,HR,BA,OPS,G.1,W,L,ERA,WHIP,SV,Type,Drafted Out of,Round
2023,1,,14,14.0,Y,"$4,000,000",Kyle Teel (minors),C,,,,,,,,,,,,,4Yr,"University of Virginia (Charlottesville, VA)",1
2022,1,,24,24.0,Y,"$2,300,000",Mikey Romero (minors),SS,,,,,,,,,,,,,HS,"Orange Lutheran HS (Orange, CA)",1
2021,1,,4,4.0,Y,"$6,664,000",Marcelo Mayer (minors),SS,,,,,,,,,,,,,HS,"Eastlake HS (Chula Vista, CA)",1
2020,1,,17,17.0,Y,"$2,700,000",Nick Yorke (minors),2B,,,,,,,,,,,,,HS,"Archbishop Mitty HS (San Jose, CA)",1
2018,1,,26,26.0,Y,"$2,552,800",Triston Casas (minors),3B,2.3,159.0,505.0,29.0,0.254,0.842,,,,,,,HS,"American Heritage HS (Plantation, FL)",1
2017,1,,24,24.0,Y,"$2,614,500",Tanner Houck (minors),RHP,5.8,1.0,1.0,0.0,0.0,0.0,74.0,15.0,19.0,3.86,1.23,9.0,4Yr,"University of Missouri (Columbia, MO)",1
2016,1,,12,12.0,Y,"$3,650,000",Jay Groome (minors),LHP,,,,,,,,,,,,,HS,"Barnegat HS (Barnegat, NJ)",1
2015,1,,7,7.0,Y,"$3,590,400",Andrew Benintendi (minors),OF,16.1,896.0,3353.0,78.0,0.276,0.765,,,,,,,4Yr,"University of Arkansas (Fayetteville, AR)",1
2014,1,,26,26.0,Y,"$1,870,500",Michael Chavis (minors),SS,0.1,357.0,1106.0,42.0,0.238,0.685,,,,,,,HS,"Sprayberry HS (Marietta, GA)",1
2014,1,,33,33.0,Y,"$1,500,000",Michael Kopech (minors),RHP,4.5,4.0,1.0,0.0,0.0,0.0,103.0,15.0,25.0,4.33,1.35,0.0,HS,"Mount Pleasant HS (Mount Pleasant, TX)",1
2013,1,,7,7.0,Y,"$2,750,000",Trey Ball (minors),LHP,,,,,,,,,,,,,HS,"New Castle Chrysler HS (New Castle, IN)",1
2012,1,,24,24.0,Y,"$2,050,000",Deven Marrero (minors),SS,-0.3,178.0,341.0,6.0,0.191,0.525,,,,,,,4Yr,"Arizona State University (Tempe, AZ)",1
2012,1s,,31,31.0,Y,"$1,575,000",*Brian Johnson (minors),LHP,0.9,6.0,7.0,0.0,0.143,0.286,65.0,7.0,9.0,4.74,1.55,0.0,4Yr,"University of Florida (Gainesville, FL)",1
2012,1s,,37,37.0,Y,"$1,000,000",*Pat Light (minors),RHP,-0.7,2.0,0.0,0.0,,,17.0,0.0,1.0,11.34,2.28,0.0,4Yr,"Monmouth University (West Long Branch, NJ)",1
2011,1,,19,19.0,Y,"$1,500,000",*Matt Barnes (minors),RHP,4.3,25.0,1.0,0.0,0.0,0.0,453.0,33.0,30.0,4.13,1.36,47.0,4Yr,"University of Connecticut (Storrs, CT)",1
2011,1,,26,26.0,Y,"$2,500,000",*Blake Swihart (minors),C,-0.3,234.0,639.0,12.0,0.243,0.656,,,,,,,HS,"V. Sue Cleveland HS (Rio Rancho, NM)",1
2011,1s,,36,36.0,Y,"$1,550,000",*Henry Owens (minors),LHP,0.1,1.0,2.0,0.0,0.0,0.0,16.0,4.0,6.0,5.19,1.52,0.0,HS,"Edison HS (Huntington Beach, CA)",1
2011,1s,,40,40.0,Y,"$1,100,000",*Jackie Bradley Jr. (minors),OF,16.9,1181.0,3735.0,109.0,0.225,0.684,1.0,0.0,0.0,9.0,4.0,0.0,4Yr,"University of South Carolina (Columbia, SC)",1
2010,1,,20,20.0,Y,"$1,359,000",*Kolbrin Vitek (minors),2B,,,,,,,,,,,,,4Yr,"Ball State University (Muncie, IN)",1
2010,1s,,36,36.0,Y,"$889,200",*Bryce Brentz (minors),LF,0.0,34.0,87.0,1.0,0.287,0.69,,,,,,,4Yr,"Middle Tennessee State University (Murfreesboro, TN)",1
2010,1s,,39,39.0,Y,"$2,550,000",*Anthony Ranaudo (minors),RHP,-1.6,5.0,10.0,1.0,0.1,0.5,20.0,5.0,5.0,7.01,1.59,0.0,4Yr,"Louisiana State University (Baton Rouge, LA)",1
2009,1,,28,28.0,Y,"$1,134,000",Rey Fuentes (minors),CF,-0.6,100.0,210.0,3.0,0.238,0.595,,,,,,,HS,"Fernando Callejo HS (Manati, Puerto Rico)",1
2008,1,,30,30.0,Y,"$3,000,000",Casey Kelly (minors),SS,-1.4,27.0,18.0,0.0,0.111,0.222,26.0,2.0,11.0,5.46,1.65,0.0,HS,"Sarasota HS (Sarasota, FL)",1
2008,1s,,45,45.0,Y,"$849,000",*Bryan Price (minors),RHP,-0.2,0.0,0.0,0.0,,,3.0,0.0,0.0,20.25,3.38,0.0,4Yr,"Rice University (Houston, TX)",1
2007,1s,,55,55.0,Y,"$571,500",*Nick Hagadone (minors),LHP,-0.2,7.0,0.0,0.0,,,143.0,3.0,2.0,4.72,1.37,1.0,4Yr,"University of Washington (Seattle, WA)",1
2007,1s,,62,62.0,Y,"$571,000",*Ryan Dent (minors),SS,,,,,,,,,,,,,HS,"Woodrow Wilson HS (Long Beach, CA)",1
2006,1,,27,27.0,Y,"$1,300,000",Jason Place (minors),OF,,,,,,,,,,,,,HS,"Wren HS (Piedmont, SC)",1
2006,1,,28,28.0,Y,"$1,550,000",*Daniel Bard (minors),RHP,8.5,82.0,3.0,0.0,0.333,0.667,408.0,31.0,35.0,3.74,1.3,66.0,4Yr,"University of North Carolina at Chapel Hill (Chapel Hill, NC)",1
2006,1s,,40,40.0,Y,"$850,000",*Kris Johnson (minors),LHP,0.0,5.0,3.0,0.0,0.0,0.0,7.0,0.0,3.0,5.32,1.77,0.0,4Yr,"Wichita State University (Wichita, KS)",1
2006,1s,,44,44.0,Y,"$775,000",*Caleb Clay (minors),RHP,,,,,,,,,,,,,HS,"Cullman HS (Cullman, AL)",1
2005,1,,23,23.0,Y,"$1,400,000",*Jacoby Ellsbury (minors),OF,31.2,1235.0,4846.0,104.0,0.284,0.76,,,,,,,4Yr,"Oregon State University (Corvallis, OR)",1
2005,1,,26,26.0,Y,"$1,325,000",*Craig Hansen (minors),RHP,-1.9,27.0,0.0,0.0,,,95.0,4.0,9.0,6.34,1.72,3.0,4Yr,"St. John's University (Queens, NY)",1
2005,1s,,42,42.0,Y,"$800,000",*Clay Buchholz (minors),RHP,16.8,29.0,46.0,0.0,0.087,0.234,236.0,90.0,69.0,3.98,1.3,0.0,JC,"Angelina College (Lufkin, TX)",1
2005,1s,,45,45.0,Y,"$762,000",*Jed Lowrie (minors),2B,15.8,1307.0,4615.0,121.0,0.257,0.736,,,,,,,4Yr,"Stanford University (Palo Alto, CA)",1
2005,1s,,47,47.0,Y,"$730,000",*Michael Bowden (minors),RHP,0.8,64.0,2.0,0.0,0.0,0.0,103.0,3.0,5.0,4.51,1.4,0.0,HS,"Waubonsie Valley HS (Aurora, IL)",1
2003,1,,17,17.0,Y,"$1,525,000",David Murphy (minors),OF,9.9,1110.0,3467.0,104.0,0.274,0.765,2.0,0.0,0.0,0.0,3.0,0.0,4Yr,"Baylor University (Waco, TX)",1
2003,1s,,32,32.0,Y,"$1,010,000",*Matt Murton (minors),OF,3.3,346.0,952.0,29.0,0.286,0.788,,,,,,,4Yr,"Georgia Institute of Technology (Atlanta, GA)",1
2000,1,,22,22.0,Y,"$1,275,000",Phil Dumatrait (minors),LHP,-1.8,44.0,27.0,0.0,0.037,0.074,87.0,4.0,13.0,6.2,1.78,1.0,JC,"Bakersfield College (Bakersfield, CA)",1
1999,1,,17,17.0,Y,"$1,725,000",*Rick Asadoorian (minors),OF,,,,,,,,,,,,,HS,"Northbridge HS (Whitinsville, MA)",1
1999,1s,,40,40.0,Y,"$832,500",*Brad Baker (minors),RHP,,,,,,,,,,,,,HS,"Pioneer Valley Regional School (Northfield, MA)",1
1999,1s,,48,48.0,Y,"$660,000",*Casey Fossum (minors),LHP,-1.0,46.0,46.0,0.0,0.087,0.193,237.0,40.0,53.0,5.45,1.52,2.0,4Yr,"Texas A&M University (College Station, TX)",1
1998,1,,12,12.0,Y,"$1,250,000",Adam Everett (minors),SS,12.6,880.0,2758.0,40.0,0.242,0.64,,,,,,,4Yr,"University of South Carolina (Columbia, SC)",1
1997,1,,17,17.0,Y,"$975,000",John Curtice (minors),LHP,,,,,,,,,,,,,HS,"Great Bridge HS (Chesapeake, VA)",1
1997,1s,,35,35.0,Y,,*Mark Fischer (minors),OF,,,,,,,,,,,,,4Yr,"Georgia Institute of Technology (Atlanta, GA)",1
1996,1,,26,26.0,Y,"$665,000",Josh Garrett (minors),RHP,,,,,,,,,,,,,HS,"South Spencer HS (Rockport, IN)",1
1996,1s,,34,34.0,Y,,*Chris Reitsma (minors),RHP,0.6,303.0,87.0,0.0,0.103,0.258,338.0,32.0,46.0,4.7,1.41,37.0,HS,"Calgary Christian HS (Calgary, AB)",1
1995,1,,15,15.0,Y,"$986,000",Andy Yount (minors),RHP,,,,,,,,,,,,,HS,"Kingwood HS (Kingwood, TX)",1
1995,1,,24,24.0,Y,"$575,000",*Corey Jenkins (minors),OF,,,,,,,,,,,,,HS,"Dreher HS (Columbia, SC)",1
1994,1,,12,12.0,Y,"$895,000",Nomar Garciaparra (minors),SS,44.3,1434.0,5586.0,229.0,0.313,0.882,,,,,,,4Yr,"Georgia Institute of Technology (Atlanta, GA)",1
1993,1,,7,7.0,Y,"$890,000",Trot Nixon (minors),OF,21.2,1092.0,3627.0,137.0,0.274,0.828,,,,,,,HS,"New Hanover HS (Wilmington, NC)",1
1991,1,,23,23.0,Y,"$210,000",Aaron Sele (minors),RHP,20.1,72.0,58.0,0.0,0.155,0.386,404.0,148.0,112.0,4.61,1.49,0.0,4Yr,"Washington State University (Pullman, WA)",1
1991,1s,,37,37.0,Y,,*J.J. Johnson (minors),OF,,,,,,,,,,,,,HS,"Pine Plains HS (Pine Plains, NY)",1
1991,1s,,43,43.0,Y,,*Scott Hatteberg (minors),C,10.0,1314.0,4226.0,106.0,0.273,0.772,,,,,,,4Yr,"Washington State University (Pullman, WA)",1
1989,1,,16,16.0,Y,"$180,000",*Greg Blosser (minors),OF,-0.4,22.0,39.0,0.0,0.077,0.303,,,,,,,HS,"Sarasota HS (Sarasota, FL)",1
1989,1,,23,23.0,Y,"$126,000",Mo Vaughn (minors),1B,27.1,1512.0,5532.0,328.0,0.293,0.906,,,,,,,4Yr,"Seton Hall University (South Orange, NJ)",1
1989,1s,,29,29.0,Y,,*Kevin Morton (minors),LHP,0.4,0.0,0.0,0.0,,,16.0,6.0,5.0,4.59,1.54,0.0,4Yr,"Seton Hall University (South Orange, NJ)",1
1988,1,,12,12.0,Y,"$110,000",Tom Fischer (minors),LHP,,,,,,,,,,,,,4Yr,"University of Wisconsin at Madison (Madison, WI)",1
1987,1,,26,26.0,Y,"$92,500",Reggie Harris (minors),RHP,-0.1,61.0,1.0,0.0,0.0,0.0,86.0,2.0,3.0,4.91,1.55,0.0,HS,"Waynesboro HS (Waynesboro, VA)",1
1987,1s,,32,32.0,Y,,*Bob Zupcic (minors),OF,-0.7,319.0,795.0,7.0,0.25,0.648,,,,,,,4Yr,"Oral Roberts University (Tulsa, OK)",1
1986,1,,14,14.0,N,,Greg McMurtry (minors),OF,,,,,,,,,,,,,HS,"Brockton HS (Brockton, MA)",1
1985,1,,21,21.0,Y,"$100,000",Dan Gabriele (minors),RHP,,,,,,,,,,,,,HS,"Western HS (Walled Lake, MI)",1
1984,1,,14,14.0,Y,"$100,000",John Marzano (minors),C,0.3,301.0,794.0,11.0,0.241,0.633,,,,,,,4Yr,"Temple University (Philadelphia, PA)",1
1983,1,,19,19.0,Y,"$121,000",Roger Clemens (minors),RHP,139.2,95.0,179.0,0.0,0.173,0.443,709.0,354.0,184.0,3.12,1.17,0.0,4Yr,"University of Texas at Austin (Austin, TX)",1
1982,1,,16,16.0,Y,"$82,500",*Sam Horn (minors),1B,2.3,389.0,1040.0,62.0,0.24,0.797,,,,,,,HS,"Samuel F. B. Morse HS (San Diego, CA)",1
1982,1,,18,18.0,Y,"$65,000",Bob Parkins (minors),RHP,,,,,,,,,,,,,HS,"Cerritos HS (Cerritos, CA)",1
1982,1,,26,26.0,Y,"$55,000",*Jeff Ledbetter (minors),1B,,,,,,,,,,,,,4Yr,"Florida State University (Tallahassee, FL)",1
1981,1,,19,19.0,Y,"$55,000",Steve Lyons (minors),SS,1.8,852.0,2162.0,19.0,0.252,0.642,2.0,0.0,0.0,3.0,2.67,0.0,4Yr,"Oregon State University (Corvallis, OR)",1
1981,1,,25,25.0,Y,"$60,000",*Kevin Burrell (minors),C,,,,,,,,,,,,,HS,"Poway HS (Poway, CA)",1
1977,1,,13,13.0,Y,"$42,500",Andrew Madden (minors),RHP,,,,,,,,,,,,,HS,"New Hartford HS (New Hartford, NY)",1
1976,1,,22,22.0,Y,"$42,500",Bruce Hurst (minors),LHP,34.1,135.0,274.0,0.0,0.113,0.305,379.0,145.0,113.0,3.92,1.33,0.0,HS,"Dixie HS (St. George, UT)",1
1975,1,,15,15.0,Y,"$50,000",Otis Foster (minors),1B,,,,,,,,,,,,,4Yr,"High Point University (High Point, NC)",1
1974,1,,20,20.0,Y,"$50,000",Eddie Ford (minors),SS,,,,,,,,,,,,,4Yr,"University of South Carolina (Columbia, SC)",1
1973,1,,17,17.0,Y,"$35,000",Ted Cox (minors),SS,-1.6,272.0,771.0,10.0,0.245,0.623,,,,,,,HS,"Midwest City HS (Midwest City, OK)",1
1972,1,,16,16.0,Y,"$45,000",Joel Bishop (minors),SS,,,,,,,,,,,,,HS,"McClatchy HS (Sacramento, CA)",1
1971,1,,15,15.0,Y,"$30,000",Jim Rice (minors),OF,47.7,2089.0,8225.0,382.0,0.298,0.854,,,,,,,HS,"T. L. Hanna HS (Anderson, SC)",1
1970,1,,16,16.0,N,,Jimmie Hacker (minors),3B,,,,,,,,,,,,,HS,"Temple HS (Temple, TX)",1
1969,1,,13,13.0,Y,"$85,000",Noel Jenke (minors),OF,,,,,,,,,,,,,4Yr,"University of Minnesota (Minneapolis, MN)",1
1968,1,,20,20.0,Y,"$40,000",Tom Maggard (minors),OF,,,,,,,,,,,,,HS,"John H. Glenn HS (Norwalk, CA)",1
1967,1,,3,3.0,Y,"$54,000",Mike Garman (minors),RHP,2.2,291.0,42.0,0.0,0.119,0.238,303.0,22.0,27.0,3.63,1.41,42.0,HS,"Caldwell HS (Caldwell, ID)",1
1966,1,,4,4.0,Y,"$56,000",Ken Brett (minors),LHP,16.3,255.0,347.0,10.0,0.262,0.698,349.0,83.0,85.0,3.93,1.34,11.0,HS,"El Segundo HS (El Segundo, CA)",1
1965,1,,5,5.0,Y,"$62,500",Billy Conigliaro (minors),OF,4.6,347.0,1130.0,40.0,0.256,0.74,,,,,,,HS,"Swampscott HS (Swampscott, MA)",1
2023,2,,50,11.0,Y,"$3,000,000",Nazzan Zanetello (minors),SS,,,,,,,,,,,,,HS,"Christian Brothers College HS (St. Louis, MO)",2
2022,2,,41,2.0,Y,"$1,847,500",Cutter Coffey (minors),SS,,,,,,,,,,,,,HS,"Liberty HS (Bakersfield, CA)",2
2022,2,,79,40.0,Y,"$2,500,000",Roman Anthony (minors),OF,,,,,,,,,,,,,HS,"Marjory Stoneman Douglas HS (Parkland, FL)",2
2021,2,,40,4.0,Unk,,Jud Fabian (minors),OF,,,,,,,,,,,,,4Yr,"University of Florida (Gainesville, FL)",2
2019,2,,43,2.0,Y,"$1,300,000",Cam Cannon (minors),SS,,,,,,,,,,,,,4Yr,"University of Arizona (Tucson, AZ)",2
2019,2,,69,28.0,Y,"$1,100,000",Matthew Lugo (minors),SS,,,,,,,,,,,,,HS,"Carlos Beltran Baseball Academy (Florida, Puerto Rico)",2
2018,2,,64,21.0,Y,"$1,250,000",Nick Decker (minors),OF,,,,,,,,,,,,,HS,"Seneca HS (Tabernacle, NJ)",2
2017,2,,63,27.0,Y,"$1,300,000",Cole Brannen (minors),OF,,,,,,,,,,,,,HS,"The Westfield School (Perry, GA)",2
2016,2,,51,10.0,Y,"$1,100,000",C.J. Chatham (minors),SS,,,,,,,,,,,,,4Yr,"Florida Atlantic University (Boca Raton, FL)",2
2014,2,,67,26.0,Y,"$846,800",Sam Travis (minors),1B,-1.1,111.0,256.0,7.0,0.231,0.659,,,,,,,4Yr,"Indiana University Bloomington (Bloomington, IN)",2
2013,2,,45,6.0,Y,"$915,000",Teddy Stankiewicz (minors),RHP,,,,,,,,,,,,,JC,"Seminole State College (Seminole, OK)",2
2012,2,,87,27.0,Y,"$600,000",Jamie Callahan (minors),RHP,0.0,8.0,0.0,0.0,,,9.0,0.0,0.0,4.05,1.2,0.0,HS,"Dillon HS (Dillon, SC)",2
2011,2,,81,21.0,Y,"$443,700",Williams Jerez (minors),CF,-0.4,14.0,0.0,0.0,,,29.0,1.0,0.0,5.33,1.82,0.0,HS,"Grand Street Campus (Brooklyn, NY)",2
2010,2,,57,7.0,Y,"$800,000",*Brandon Workman (minors),RHP,2.6,27.0,3.0,0.0,0.0,0.0,238.0,26.0,22.0,4.02,1.39,25.0,4Yr,"University of Texas at Austin (Austin, TX)",2
2009,2,,77,28.0,Y,"$470,700",Alex Wilson (minors),RHP,5.4,31.0,0.0,0.0,,,303.0,14.0,14.0,3.44,1.22,5.0,4Yr,"Texas A&M University (College Station, TX)",2
2008,2,,77,31.0,Y,"$600,000",Derrik Gibson (minors),SS,,,,,,,,,,,,,HS,"Seaford HS (Seaford, DE)",2
2007,2,,84,20.0,N,,Hunter Morris (minors),1B,,,,,,,,,,,,,HS,"Grissom HS (Huntsville, AL)",2
2006,2,,71,27.0,Y,"$510,000",Justin Masterson (minors),RHP,10.1,23.0,33.0,0.0,0.212,0.424,258.0,64.0,74.0,4.31,1.4,0.0,4Yr,"San Diego State University (San Diego, CA)",2
2005,2,,57,9.0,Y,"$625,000",*Jonathan Egan (minors),C,,,,,,,,,,,,,HS,"Cross Creek HS (Cross Creek, GA)",2
2004,2,,65,24.0,Y,"$575,000",Dustin Pedroia (minors),SS,51.9,1512.0,6031.0,140.0,0.299,0.805,,,,,,,4Yr,"Arizona State University (Tempe, AZ)",2
2003,2,,49,12.0,Y,"$700,000",*Abe Alvarez (minors),LHP,-0.4,1.0,1.0,0.0,0.0,0.0,4.0,0.0,1.0,11.32,2.52,0.0,4Yr,"California State University, San Bernardino (San Bernardino, CA)",2
2003,2,,54,17.0,Y,"$800,000",Mickey Hall (minors),OF,,,,,,,,,,,,,HS,"Walton HS (Marietta, GA)",2
2002,2,,57,16.0,Y,"$1,000,000",Jon Lester (minors),LHP,43.5,192.0,366.0,4.0,0.115,0.337,452.0,200.0,117.0,3.66,1.28,0.0,HS,"Bellarmine Preparatory School (Tacoma, WA)",2
2001,2,,48,4.0,Y,"$737,500",*Kelly Shoppach (minors),C,8.3,572.0,1616.0,70.0,0.223,0.725,,,,,,,4Yr,"Baylor University (Waco, TX)",2
2001,2,,61,17.0,N,,Matt Chico (minors),LHP,0.6,41.0,63.0,0.0,0.159,0.317,43.0,7.0,15.0,4.95,1.56,0.0,HS,"Fallbrook Union HS (Fallbrook, CA)",2
2000,2,,62,22.0,Y,"$700,000",Manny Delcarmen (minors),RHP,3.8,27.0,1.0,0.0,0.0,0.0,298.0,11.0,8.0,3.97,1.38,3.0,HS,"West Roxbury HS (West Roxbury, MA)",2
1999,2,,76,25.0,Y,"$485,000",Mat Thompson (minors),RHP,,,,,,,,,,,,,HS,"Timberline HS (Boise, ID)",2
1997,2,,57,5.0,Y,,*Aaron Capista (minors),SS,,,,,,,,,,,,,HS,"Joliet Catholic Academy (Joliet, IL)",2
1997,2,,69,17.0,Y,,Eric Glaser (minors),RHP,,,,,,,,,,,,,HS,"Highlands HS (Fort Thomas, KY)",2
1996,2,,39,4.0,Y,,*Gary Locurto (minors),1B,,,,,,,,,,,,,HS,"University HS (San Diego, CA)",2
1996,2,,61,26.0,Y,,Jason Sekany (minors),RHP,,,,,,,,,,,,,4Yr,"University of Virginia (Charlottesville, VA)",2
1995,2,,45,15.0,Y,,Jose Olmeda (minors),SS,,,,,,,,,,,,,HS,"Santiago Veve Carzada F School (Fajardo, Puerto Rico)",2
1993,2,,49,7.0,Y,,Jeff Suppan (minors),RHP,17.1,262.0,440.0,1.0,0.173,0.416,448.0,140.0,146.0,4.7,1.46,0.0,HS,"Crespi Carmelite HS (Encino, CA)",2
1992,2,,56,18.0,Y,,Tony Sheffield (minors),OF,,,,,,,,,,,,,HS,"Tullahoma HS (Tullahoma, TN)",2
1991,2,,51,7.0,Y,,*Terry Horn (minors),RHP,,,,,,,,,,,,,HS,"Yukon HS (Yukon, OK)",2
1991,2,,67,23.0,Y,,Chad Schoenvogel (minors),RHP,,,,,,,,,,,,,JC,"Blinn College (Brenham, TX)",2
1990,2,,41,1.0,Y,"$400,000",*Frankie Rodriguez (minors),RHP,1.2,14.0,6.0,0.0,0.167,0.333,184.0,29.0,39.0,5.53,1.56,5.0,HS,"Eastern District HS (Brooklyn, NY)",2
1989,2,,53,23.0,Y,,Jeff McNeely (minors),OF,0.2,21.0,37.0,0.0,0.297,0.788,,,,,,,JC,"Spartanburg Methodist College (Spartanburg, SC)",2
1988,2,,42,12.0,Y,,Andy Rush (minors),RHP,,,,,,,,,,,,,HS,"Somerset HS (Somerset, PA)",2
1987,2,,58,26.0,Y,,Paul Brown (minors),LHP,,,,,,,,,,,,,4Yr,"University of Hawaii at Manoa (Honolulu, HI)",2
1986,2,,42,14.0,Y,,Paul Williams (minors),C,,,,,,,,,,,,,HS,"M. B. Smiley HS (Houston, TX)",2
1985,2,,49,21.0,N,,Lance Blankenship (minors),3B,6.7,461.0,1050.0,9.0,0.222,0.649,,,,,,,4Yr,"University of California, Berkeley (Berkeley, CA)",2
1984,2,,42,14.0,Y,,Scott Wade (minors),OF,,,,,,,,,,,,,4Yr,"Oklahoma State University (Stillwater, OK)",2
1983,2,,33,5.0,Y,,*Mike Brumley (minors),SS,-2.3,295.0,635.0,3.0,0.206,0.534,,,,,,,4Yr,"University of Texas at Austin (Austin, TX)",2
1983,2,,47,19.0,Y,,John Toale (minors),3B,,,,,,,,,,,,,HS,"Taravella HS (Coral Springs, FL)",2
1982,2s,,29,1.0,Y,,*Kevin Romine (minors),OF,-1.4,331.0,630.0,5.0,0.251,0.631,,,,,,,4Yr,"Arizona State University (Tempe, AZ)",2
1982,2,,46,18.0,Y,,Steve Jongewaard (minors),SS,,,,,,,,,,,,,HS,"Fountain Valley HS (Fountain Valley, CA)",2
1981,2,,45,19.0,Y,,Chris Howard (minors),2B,,,,,,,,,,,,,HS,"William R. Boone HS (Orlando, FL)",2
1980,2,,48,22.0,Y,,*Mike Brown (minors),RHP,-1.7,0.0,0.0,0.0,,,61.0,12.0,20.0,5.75,1.68,0.0,4Yr,"Clemson University (Clemson, SC)",2
1979,2,,52,26.0,Y,,Marc Sullivan (minors),C,-1.5,137.0,360.0,5.0,0.186,0.494,,,,,,,4Yr,"University of Florida (Gainesville, FL)",2
1977,2,,39,13.0,Y,,Bobby Sprowl (minors),LHP,-1.0,19.0,6.0,0.0,0.167,0.333,22.0,0.0,3.0,5.44,1.75,0.0,4Yr,"University of Alabama (Tuscaloosa, AL)",2
1976,2,,46,22.0,Y,,Glenn Hoffman (minors),SS,0.3,766.0,2163.0,23.0,0.242,0.623,,,,,,,HS,"Savanna HS (Anaheim, CA)",2
1975,2,,39,15.0,Y,,Dave Schmidt (minors),C,0.3,15.0,42.0,2.0,0.238,0.752,,,,,,,HS,"Mission Viejo HS (Mission Viejo, CA)",2
1974,2,,44,20.0,Y,,Jimmy Schankle (minors),C,,,,,,,,,,,,,HS,"Lubbock HS (Lubbock, TX)",2
1973,2,,41,17.0,Y,,Fred Lynn (minors),OF,50.2,1969.0,6925.0,306.0,0.283,0.845,,,,,,,4Yr,"University of Southern California (Los Angeles, CA)",2
1972,2,,40,16.0,Y,,Steve Dillard (minors),SS,-1.4,438.0,1013.0,13.0,0.243,0.637,,,,,,,4Yr,"University of Mississippi (Oxford, MS)",2
1971,2,,39,15.0,Y,,Milt Jefferson (minors),3B,,,,,,,,,,,,,HS,"Manual Arts HS (Los Angeles, CA)",2
1970,2,,40,16.0,Y,,Fred Wegner (minors),OF,,,,,,,,,,,,,HS,"Fresno HS (Fresno, CA)",2
1969,2,,37,13.0,Y,,Rick Miller (minors),OF,15.5,1482.0,3887.0,28.0,0.269,0.696,,,,,,,4Yr,"Michigan State University (East Lansing, MI)",2
1968,2,,40,20.0,Y,,Curtis Suchan (minors),INF,,,,,,,,,,,,,HS,"Jesuit HS (Tampa, FL)",2
1967,2,,23,3.0,N,,Danny Graham (minors),SS,,,,,,,,,,,,,HS,"Bishop Montgomery HS (Torrance, CA)",2
1966,2,,24,4.0,Y,,Joseph McCullough (minors),INF,,,,,,,,,,,,,HS,"William L. Dickinson HS (Jersey City, NJ)",2
1965,2,,25,5.0,N,,John Hetrick (minors),OF,,,,,,,,,,,,,HS,"Hershey HS (Hershey, PA)",2
2023,3,,83,13.0,Y,"$1,500,000",Antonio Anderson (minors),SS,,,,,,,,,,,,,HS,"North Atlanta HS (Atlanta, GA)",3
2022,3,,99,19.0,Y,"$447,500",Dalton Rogers (minors),P,,,,,,,,,,,,,4Yr,"University of Southern Mississippi (Hattiesburg, MS)",3
2021,3,,75,4.0,Y,"$828,600",Tyler McDonough (minors),2B,,,,,,,,,,,,,4Yr,"North Carolina State University (Raleigh, NC)",3
2020,3,,89,17.0,Y,"$1,750,000",Blaze Jordan (minors),3B,,,,,,,,,,,,,HS,"DeSoto Central HS (Southaven, MS)",3
2019,3,,107,29.0,Y,"$500,000",Ryan Zeferjahn (minors),P,,,,,,,,,,,,,4Yr,"University of Kansas (Lawrence, KS)",3
2018,3,,100,22.0,Y,"$559,600",Durbin Feltman (minors),RHP,,,,,,,,,,,,,4Yr,"Texas Christian University (Fort Worth, TX)",3
2017,3,,101,26.0,Y,"$475,000",Brett Netzer (minors),2B,,,,,,,,,,,,,4Yr,"University of North Carolina at Charlotte (Charlotte, NC)",3
2016,3,,88,11.0,Y,"$700,000",Shaun Anderson (minors),RHP,-1.1,29.0,25.0,0.0,0.08,0.235,63.0,3.0,5.0,5.84,1.64,2.0,4Yr,"University of Florida (Gainesville, FL)",3
2015,3,,81,6.0,Y,"$742,400",Austin Rei (minors),C,,,,,,,,,,,,,4Yr,"University of Washington (Seattle, WA)",3
2014,3,,103,29.0,Y,"$450,000",Jake Cosart (minors),RHP,,,,,,,,,,,,,JC,"Seminole State College of Florida (Sanford, FL)",3
2013,3,,81,8.0,Y,"$875,000",Jon Denney (minors),C,,,,,,,,,,,,,HS,"Yukon HS (Yukon, OK)",3
2012,3,,118,23.0,Y,"$350,000",Austin Maddox (minors),RHP,0.7,0.0,0.0,0.0,,,13.0,0.0,0.0,0.52,0.87,0.0,4Yr,"University of Florida (Gainesville, FL)",3
2011,3,,111,21.0,Y,"$500,000",Jordan Weems (minors),C,0.4,3.0,0.0,0.0,,,99.0,5.0,3.0,4.74,1.25,0.0,HS,"Columbus HS (Columbus, GA)",3
2010,3,,110,28.0,Y,"$1,300,000",Sean Coyle (minors),SS,,,,,,,,,,,,,HS,"Germantown Academy (Fort Washington, PA)",3
2009,3,,107,27.0,Y,"$1,400,000",David Renfroe (minors),SS,,,,,,,,,,,,,HS,"South Panola HS (Batesville, MS)",3
2008,3s,,85,8.0,Y,"$464,000",*Stephen Fife (minors),RHP,0.8,17.0,27.0,0.0,0.111,0.291,18.0,4.0,6.0,3.66,1.47,0.0,4Yr,"University of Utah (Salt Lake City, UT)",3
2008,3,,108,31.0,Y,"$322,000",Kyle Weiland (minors),RHP,-0.9,4.0,5.0,0.0,0.0,0.0,10.0,0.0,6.0,7.23,1.7,0.0,4Yr,"University of Notre Dame (South Bend, IN)",3
2007,3,,114,20.0,Y,"$225,000",Brock Huntzinger (minors),RHP,,,,,,,,,,,,,HS,"Pendleton Heights HS (Pendleton, IN)",3
2006,3,,83,7.0,Y,"$440,000",*Aaron Bates (minors),1B,0.0,5.0,11.0,0.0,0.364,0.962,,,,,,,4Yr,"North Carolina State University (Raleigh, NC)",3
2006,3,,103,27.0,Y,"$250,000",Bryce Cox (minors),RHP,,,,,,,,,,,,,4Yr,"Rice University (Houston, TX)",3
2004,3,,95,24.0,Y,"$400,000",Andrew Dobies (minors),LHP,,,,,,,,,,,,,4Yr,"University of Virginia (Charlottesville, VA)",3
2003,3,,84,17.0,Y,"$250,000",Beau Vaughan (minors),RHP,,,,,,,,,,,,,4Yr,"Arizona State University (Tempe, AZ)",3
2002,3,,88,16.0,Y,"$825,000",Scott White (minors),3B,,,,,,,,,,,,,HS,"Walton HS (Marietta, GA)",3
2001,3,,93,17.0,Y,"$450,000",Jon Devries (minors),C,,,,,,,,,,,,,HS,"Irvine HS (Irvine, CA)",3
2000,3,,92,22.0,Y,"$400,000",Matt Cooper (minors),1B,,,,,,,,,,,,,HS,"Ripley HS (Stillwater, OK)",3
1999,3,,88,4.0,Y,"$425,000",*Rich Rundles (minors),LHP,0.2,0.0,0.0,0.0,,,9.0,0.0,0.0,1.5,1.67,0.0,HS,"Jefferson County HS (Dandridge, TN)",3
1999,3,,109,25.0,Y,,Antron Seiber (minors),OF,,,,,,,,,,,,,HS,"Independence HS (Independence, LA)",3
1998,3,,85,12.0,Y,"$225,000",Mike Maroth (minors),LHP,4.0,26.0,30.0,0.0,0.233,0.548,161.0,50.0,67.0,5.05,1.46,0.0,4Yr,"University of Central Florida (Orlando, FL)",3
1997,3,,101,17.0,Y,,Travis Harper (minors),RHP,0.2,16.0,1.0,0.0,0.0,0.0,240.0,22.0,29.0,4.94,1.43,2.0,4Yr,"James Madison University (Harrisonburg, VA)",3
1996,3,,91,26.0,Y,,Dernell Stenson (minors),OF,0.1,37.0,81.0,3.0,0.247,0.753,,,,,,,HS,"LaGrange HS (LaGrange, GA)",3
1995,3,,74,15.0,Y,,Jay Yennaco (minors),RHP,,,,,,,,,,,,,HS,"Pinkerton Academy (Derry, NH)",3
1994,3,,75,12.0,Y,,Brian Rose (minors),RHP,-0.1,18.0,27.0,0.0,0.037,0.108,68.0,15.0,23.0,5.86,1.55,0.0,HS,"Dartmouth HS (Dartmouth, MA)",3
1993,3,,79,7.0,Y,,Ryan McGuire (minors),1B,-2.3,368.0,631.0,7.0,0.211,0.616,,,,,,,4Yr,"University of California, Los Angeles (Los Angeles, CA)",3
1992,3,,86,18.0,Y,,Doug Hecker (minors),1B,,,,,,,,,,,,,4Yr,"University of Tennessee (Knoxville, TN)",3
1991,3,,96,23.0,Y,,Joe Caruso (minors),RHP,,,,,,,,,,,,,4Yr,"Loyola Marymount University (Los Angeles, CA)",3
1990,3,,91,18.0,Y,,Walt McKeel (minors),C,-0.3,11.0,16.0,0.0,0.25,0.5,,,,,,,HS,"Greene Central HS (Snow Hill, NC)",3
1989,3,,83,23.0,Y,,Eric Wedge (minors),C,0.2,39.0,86.0,5.0,0.233,0.77,,,,,,,4Yr,"Wichita State University (Wichita, KS)",3
1988,3,,69,12.0,Y,,Mickey Rivers (minors),OF,,,,,,,,,,,,,JC,"Bacone College (Muskogee, OK)",3
1987,3,,84,26.0,Y,,Craig Wilson (minors),C,,,,,,,,,,,,,JC,"Cerritos College (Norwalk, CA)",3
1986,3,,69,14.0,Y,,Scott Cooper (minors),3B,6.2,592.0,1801.0,33.0,0.265,0.723,,,,,,,HS,"Pattonville HS (Maryland Heights, MO)",3
1985,3,,75,21.0,N,,Tino Martinez (minors),1B,29.0,2023.0,7111.0,339.0,0.271,0.815,,,,,,,HS,"Thomas Jefferson HS (Tampa, FL)",3
1984,3,,68,14.0,Y,,Brock Knight (minors),RHP,,,,,,,,,,,,,HS,"American Fork HS (American Fork, UT)",3
1983,3,,73,19.0,Y,,Paul Thoutsis (minors),OF,,,,,,,,,,,,,HS,"Holy Name Central Catholic HS (Worcester, MA)",3
1982,3,,72,18.0,Y,,Mike Greenwell (minors),3B,25.8,1269.0,4623.0,130.0,0.303,0.831,,,,,,,HS,"North Fort Myers HS (North Fort Myers, FL)",3
1981,3,,70,18.0,Y,,Rob Woodward (minors),RHP,-0.2,0.0,0.0,0.0,,,24.0,4.0,4.0,5.04,1.54,0.0,HS,"Lebanon HS (Lebanon, NH)",3
1980,3,,75,23.0,Y,,Mitch Johnson (minors),RHP,,,,,,,,,,,,,HS,"Donegal HS (Mount Joy, PA)",3
1979,3,,78,26.0,Y,,John Ackley (minors),C,,,,,,,,,,,,,HS,"Mahopac HS (Mahopac, NY)",3
1977,3,,65,13.0,N,,Scott Sullivan (minors),OF,,,,,,,,,,,,,HS,"Cupertino HS (Cupertino, CA)",3
1976,3,,70,22.0,Y,,Mark Twogood (minors),OF,,,,,,,,,,,,,HS,"Loara HS (Anaheim, CA)",3
1975,3,,63,15.0,Y,,Ed Jurak (minors),SS,0.6,193.0,302.0,1.0,0.265,0.69,,,,,,,HS,"San Pedro HS (San Pedro, CA)",3
1974,3,,68,20.0,Y,,Ronny Patrick (minors),LHP,,,,,,,,,,,,,HS,"Castlewood HS (Castlewood, VA)",3
1973,3,,65,17.0,Y,,Charles Meyers (minors),2B,,,,,,,,,,,,,4Yr,"Oklahoma State University (Stillwater, OK)",3
1972,3,,64,16.0,Y,,Randy Markley (minors),OF,,,,,,,,,,,,,HS,"Lynwood HS (Lynwood, CA)",3
1971,3,,63,15.0,Y,,Jim Vosk (minors),RHP,,,,,,,,,,,,,HS,"Middletown HS (Red Bank, NJ)",3
1970,3,,64,16.0,N,,John Schmidt (minors),3B,,,,,,,,,,,,,HS,"Lutheran HS (Parker, CO)",3
1969,3,,61,13.0,Y,,Buddy Hunter (minors),INF,0.1,22.0,17.0,0.0,0.294,0.89,,,,,,,4Yr,"John J Pershing College (Beatrice, NE)",3
1968,3,,60,20.0,Y,,Lynn McGlothen (minors),RHP,14.4,299.0,456.0,0.0,0.173,0.402,318.0,86.0,93.0,3.98,1.42,2.0,HS,"Grambling HS (Grambling, LA)",3
1967,3,,43,3.0,Y,,Chris Cross (minors),C,,,,,,,,,,,,,HS,"Englewood HS (Jacksonville, FL)",3
1966,3,,44,4.0,Y,,Rick Hoban (minors),LHP,,,,,,,,,,,,,HS,"West HS (Cleveland, OH)",3
1965,3,,45,5.0,Y,,Ken Poulsen (minors),3B,-0.1,5.0,5.0,0.0,0.2,0.6,,,,,,,HS,"Birmingham HS (Los Angeles, CA)",3
2023,4,,115,14.0,Y,"$350,000",Matt Duffy (minors),P,,,,,,,,,,,,,4Yr,"Canisius College (Buffalo, NY)",4
2023,4,,132,31.0,Y,"$492,700",Kristian Campbell (minors),SS,,,,,,,,,,,,,4Yr,"Georgia Institute of Technology (Atlanta, GA)",4
2023,4,,133,32.0,Y,"$500,000",Justin Riemer (minors),SS,,,,,,,,,,,,,4Yr,"Wright State University (Dayton, OH)",4
