Year,Rnd,DT,OvPck,RdPck,Signed,Bonus,Name,Pos,WAR,G,AB,HR,BA,OPS,G.1,W,L,ERA,WHIP,SV,Type,Drafted Out of,Round
1976,7,,166,22.0,Y,,Wade Boggs (minors),SS,91.4,2439.0,9180.0,118.0,0.328,0.858,2.0,0.0,0.0,3.86,1.71,0.0,HS,"H. B. Plant HS (Tampa, FL)",7
1975,7,,159,15.0,N,,Larry Littleton (minors),OF,-0.7,26.0,23.0,0.0,0.0,0.111,,,,,,,4Yr,"University of Georgia (Athens, GA)",7
1974,7,,164,20.0,Y,,Sam Bowen (minors),2B,0.0,16.0,22.0,1.0,0.136,0.513,,,,,,,4Yr,"Valdosta State University (Valdosta, GA)",7
1973,7,,161,17.0,N,,William St. Claire (minors),LHP,,,,,,,,,,,,,HS,"Springfield HS of Science and Technology (Springfield, MA)",7
1972,7,,160,16.0,Y,,Steven Samuelson (minors),RHP,,,,,,,,,,,,,4Yr,"University of St. Thomas (St. Paul, MN)",7
1971,7,,163,16.0,Y,,Paul Flanagan (minors),OF,,,,,,,,,,,,,HS,"Columbus HS (Dorchester, MA)",7
1970,7,,164,17.0,Y,,Jerry Spencer (minors),RHP,,,,,,,,,,,,,HS,"East Central HS (San Antonio, TX)",7
1969,7,,157,13.0,Y,,Steve Barr (minors),LHP,-1.5,0.0,0.0,0.0,,,24.0,3.0,7.0,5.16,1.73,0.0,HS,"Carson HS (Carson, CA)",7
1968,7,,152,20.0,Y,,Hal Kurtzman (minors),INF,,,,,,,,,,,,,HS,"University HS (Los Angeles, CA)",7
1967,7,,123,3.0,Y,,Alan Wolfenbarger (minors),SS,,,,,,,,,,,,,HS,"Rutledge HS (Rutledge, TN)",7
1966,7,,124,4.0,Y,,Danny Smith (minors),SS,,,,,,,,,,,,,HS,"Red Lion HS (Red Lion, PA)",7
1965,7,,135,15.0,Y,,Jim Hutto (minors),3B,-0.5,61.0,97.0,3.0,0.175,0.5,,,,,,,HS,"Pensacola HS (Pensacola, FL)",7
2023,8,,238,14.0,Y,"$50,000",Trennor O'Donnell (minors),P,,,,,,,,,,,,,4Yr,"Ball State University (Muncie, IN)",8
2022,8,,249,23.0,Y,"$7,500",Jonathan Brand (minors),P,,,,,,,,,,,,,4Yr,"Miami University of Ohio (Oxford, OH)",8
2021,8,,226,4.0,Y,"$197,500",Hunter Dobbins (minors),P,,,,,,,,,,,,,4Yr,"Texas Tech University (Lubbock, TX)",8
2019,8,,257,30.0,Y,"$135,000",Wil Dalton (minors),CF,,,,,,,,,,,,,4Yr,"University of Florida (Gainesville, FL)",8
2018,8,,250,26.0,Y,"$157,700",Elih Marrero (minors),C,,,,,,,,,,,,,4Yr,"St. Thomas University (Miami Gardens, FL)",8
2017,8,,251,26.0,Y,"$5,000",Zach Sterry (minors),1B,,,,,,,,,,,,,4Yr,"Oakland University (Rochester, MI)",8
2016,8,,238,12.0,Y,"$160,000",Alan Marrero (minors),C,,,,,,,,,,,,,,,8
2015,8,,231,6.0,Y,"$725,000",Logan Allen (minors),LHP,-1.1,8.0,5.0,0.0,0.2,0.533,33.0,5.0,10.0,5.89,1.66,0.0,HS,"IMG Academy (Bradenton, FL)",8
2014,8,,254,29.0,Y,"$152,700",Ben Moore (minors),C,,,,,,,,,,,,,4Yr,"University of Alabama (Tuscaloosa, AL)",8
2013,8,,233,7.0,Y,"$10,000",Forrestt Allday (minors),CF,,,,,,,,,,,,,4Yr,"University of Central Arkansas (Conway, AR)",8
2012,8,,271,23.0,Y,"$10,000",Nathan Minnich (minors),1B,,,,,,,,,,,,,4Yr,"Shepherd University (Shepherdstown, WV)",8
2011,8,,262,21.0,N,,Senquez Golson (minors),CF,,,,,,,,,,,,,HS,"Pascagoula HS (Pascagoula, MS)",8
2010,8,,263,28.0,Y,"$415,000",Matthew Price (minors),RHP,,,,,,,,,,,,,4Yr,"Virginia Polytechnic Institute and State University (Blacksburg, VA)",8
2009,8,,258,27.0,Y,"$100,000",Shannon Wilkerson (minors),RF,,,,,,,,,,,,,4Yr,"Augusta University (Augusta, GA)",8
2008,8,,262,30.0,Y,"$100,000",Mike Lee (minors),RHP,,,,,,,,,,,,,4Yr,"Oklahoma City University (Oklahoma City, OK)",8
2007,8,,264,20.0,Y,"$25,000",Adam Mills (minors),RHP,,,,,,,,,,,,,4Yr,"University of North Carolina at Charlotte (Charlotte, NC)",8
2006,8,,253,27.0,Y,"$65,000",Rafael Cabreja (minors),OF,,,,,,,,,,,,,HS,"James Monroe HS (New York, NY)",8
2005,8,,258,28.0,Y,"$75,000",J.T. Zink (minors),RHP,,,,,,,,,,,,,JC,"Everett Community College (Everett, WA)",8
2004,8,,245,24.0,Y,"$432,000",Kyle Bono (minors),RHP,,,,,,,,,,,,,4Yr,"University of Central Florida (Orlando, FL)",8
2003,8,,234,17.0,Y,"$25,000",Lee Curtis (minors),2B,,,,,,,,,,,,,4Yr,"College of Charleston (Charleston, SC)",8
2002,8,,238,16.0,Y,,Brandon Moss (minors),SS,5.0,1016.0,3133.0,160.0,0.237,0.766,,,,,,,HS,"Loganville HS (Loganville, GA)",8
2001,8,,243,17.0,Y,,Kevin Youkilis (minors),3B,32.4,1061.0,3749.0,150.0,0.281,0.861,,,,,,,4Yr,"University of Cincinnati (Cincinnati, OH)",8
2000,8,,242,22.0,Y,,Brian Adams (minors),LHP,,,,,,,,,,,,,4Yr,"Liberty University (Lynchburg, VA)",8
1999,8,,259,25.0,N,,Andy Heimbach (minors),RHP,,,,,,,,,,,,,4Yr,"Mount Vernon Nazarene University (Mount Vernon, OH)",8
1998,8,,235,12.0,Y,,Will Silverthorn (minors),LHP,,,,,,,,,,,,,HS,"J. J. Pearce HS (Richardson, TX)",8
1997,8,,251,17.0,Y,,Andy Hazlett (minors),LHP,,,,,,,,,,,,,4Yr,"University of Portland (Portland, OR)",8
1996,8,,241,26.0,Y,,Justin Duchscherer (minors),RHP,9.9,10.0,6.0,0.0,0.0,0.0,224.0,33.0,25.0,3.13,1.14,14.0,HS,"Coronado HS (Lubbock, TX)",8
1995,8,,214,15.0,Y,,Luis Cardona (minors),C,,,,,,,,,,,,,HS,"Manuel Mendez Liciaga HS (San Sebastian, Puerto Rico)",8
1994,8,,215,12.0,Y,,Steve Barnhardt (minors),C,,,,,,,,,,,,,HS,"Lake Wales HS (Lake Wales, FL)",8
1993,8,,219,7.0,N,,Sean DePaula (minors),RHP,-0.4,0.0,0.0,0.0,,,29.0,1.0,1.0,6.75,1.7,0.0,HS,"Cardinal Cushing Central HS (Boston, MA)",8
1992,8,,226,18.0,Y,,John Bowles (minors),3B,,,,,,,,,,,,,HS,"Richard Montgomery HS (Rockville, MD)",8
1991,8,,226,23.0,Y,,Luis Ortiz (minors),3B,-1.2,60.0,145.0,2.0,0.228,0.615,,,,,,,4Yr,"Union University (Jackson, TN)",8
1990,8,,227,19.0,N,,Aaron Knieper (minors),RHP,,,,,,,,,,,,,HS,"Nouvel Catholic HS (Saginaw, MI)",8
1989,8,,215,23.0,N,,Stoney Burke (minors),C,,,,,,,,,,,,,HS,"Avon HS (Avon, IN)",8
1988,8,,199,12.0,Y,,Tim Naehring (minors),SS,12.7,547.0,1872.0,49.0,0.282,0.785,,,,,,,4Yr,"Miami University of Ohio (Oxford, OH)",8
1987,8,,214,26.0,Y,,Jim Byrd (minors),SS,0.0,2.0,0.0,0.0,,,,,,,,,JC,"Seminole State College (Seminole, OK)",8
1986,8,,199,14.0,Y,,Dave Milstien (minors),SS,,,,,,,,,,,,,HS,"Simi Valley HS (Simi Valley, CA)",8
1985,8,,205,21.0,N,,Scott Middaugh (minors),RHP,,,,,,,,,,,,,HS,"Patrick Henry HS (San Diego, CA)",8
1984,8,,198,14.0,Y,,Jody Reed (minors),SS,15.9,1284.0,4554.0,27.0,0.27,0.7,,,,,,,4Yr,"Florida State University (Tallahassee, FL)",8
1983,8,,203,19.0,Y,,Dana Kiecker (minors),RHP,1.5,0.0,0.0,0.0,,,50.0,10.0,12.0,4.68,1.45,0.0,4Yr,"St. Cloud State University (St. Cloud, MN)",8
1982,8,,202,18.0,Y,,Jeff Sellers (minors),RHP,1.0,0.0,0.0,0.0,,,61.0,13.0,22.0,4.97,1.6,0.0,HS,"Paramount HS (Paramount, CA)",8
1981,8,,200,19.0,Y,,John Key (minors),RHP,,,,,,,,,,,,,HS,"Central HS (Muskogee, OK)",8
1980,8,,205,24.0,Y,,Al Nipper (minors),RHP,5.4,22.0,23.0,0.0,0.087,0.217,144.0,46.0,50.0,4.52,1.44,1.0,4Yr,"Truman State University (Kirksville, MO)",8
1979,8,,208,26.0,N,,Steve True (minors),LHP,,,,,,,,,,,,,HS,"Marlow HS (Marlow, OK)",8
1978,8,,206,24.0,Y,,Kenny Young (minors),OF,,,,,,,,,,,,,4Yr,"University of New Haven (West Haven, CT)",8
1977,8,,195,13.0,Y,,Roger LaFrancois (minors),C,0.1,8.0,10.0,0.0,0.4,0.9,,,,,,,4Yr,"University of Oklahoma (Norman, OK)",8
1976,8,,190,22.0,Y,,Ronnie Harrington (minors),C,,,,,,,,,,,,,4Yr,"William Carey University (Hattiesburg, MS)",8
1975,8,,183,15.0,Y,,Bob Hampton (minors),OF,,,,,,,,,,,,,4Yr,"Stanford University (Palo Alto, CA)",8
1974,8,,188,20.0,Y,,Paul McClure (minors),INF,,,,,,,,,,,,,4Yr,"University of Wyoming (Laramie, WY)",8
1973,8,,185,17.0,Y,,Butch Hobson (minors),3B,-0.1,738.0,2556.0,98.0,0.248,0.719,,,,,,,4Yr,"University of Alabama (Tuscaloosa, AL)",8
1972,8,,184,16.0,Y,,Mark Jones (minors),INF,,,,,,,,,,,,,HS,"Arlington Heights HS (Fort Worth, TX)",8
1971,8,,188,16.0,Y,,James Snypes (minors),INF,,,,,,,,,,,,,4Yr,"University of South Alabama (Mobile, AL)",8
1970,8,,189,17.0,Y,,Keith Durant (minors),OF,,,,,,,,,,,,,HS,"Rippowam HS (Stamford, CT)",8
1969,8,,181,13.0,N,,Eric Brown (minors),C,,,,,,,,,,,,,HS,"Morristown East HS (Morristown, TN)",8
1968,8,,176,20.0,Y,,Roy Handel (minors),C,,,,,,,,,,,,,HS,"Columbus HS (Columbus, GA)",8
1967,8,,143,3.0,N,,Steve Salata (minors),C,,,,,,,,,,,,,HS,"Trinity-Pawling School (Pawling, NY)",8
1966,8,,144,4.0,Y,,Roger McComas (minors),P,,,,,,,,,,,,,,,8
1965,8,,171,,Y,,Douglas Shores (minors),C,,,,,,,,,,,,,HS,"Northeast HS (Greensboro, NC)",8
2023,9,,268,14.0,Y,"$100,000",Blake Wehunt (minors),P,,,,,,,,,,,,,4Yr,"Kennesaw State University (Kennesaw, GA)",9
2022,9,,279,23.0,Y,"$712,500",Brooks Brannon (minors),C,,,,,,,,,,,,,HS,"Randleman HS (Randleman, NC)",9
2021,9,,256,4.0,Y,"$157,800",Tyler Miller (minors),1B,,,,,,,,,,,,,4Yr,"Auburn University (Auburn, AL)",9
2019,9,,287,30.0,Y,"$100,000",Cody Scroggins (minors),P,,,,,,,,,,,,,4Yr,"University of Arkansas (Fayetteville, AR)",9
2018,9,,280,26.0,Y,"$2,500",Brian Brown (minors),P,,,,,,,,,,,,,4Yr,"North Carolina State University (Raleigh, NC)",9
2017,9,,281,26.0,Y,"$5,000",Tanner Nishioka (minors),2B,,,,,,,,,,,,,4Yr,"Pomona College/Pitzer College (Claremont, CA)",9
2016,9,,268,12.0,Y,"$10,000",Matt McLean (minors),CF,,,,,,,,,,,,,4Yr,"University of Texas at Arlington (Arlington, TX)",9
2015,9,,261,6.0,Y,"$5,000",Tucker Tubbs (minors),1B,,,,,,,,,,,,,4Yr,"University of Memphis (Memphis, TN)",9
2014,9,,284,29.0,Y,"$255,000",Kevin Steen (minors),RHP,,,,,,,,,,,,,HS,"Oak Ridge HS (Oak Ridge, TN)",9
2013,9,,263,7.0,Y,"$10,000",Kyle Martin (minors),RHP,0.0,0.0,0.0,0.0,,,2.0,0.0,0.0,3.86,1.71,0.0,4Yr,"Texas A&M University (College Station, TX)",9
2012,9,,301,23.0,Y,"$5,000",Mike Miller (minors),SS,0.0,1.0,1.0,0.0,0.0,0.0,,,,,,,4Yr,"California Polytechnic State University, San Luis Obispo (San Luis Obispo, CA)",9
2011,9,,292,21.0,Y,"$110,000",Travis Shaw (minors),3B,8.4,733.0,2374.0,114.0,0.237,0.757,,,,,,,4Yr,"Kent State University (Kent, OH)",9
2010,9,,293,28.0,N,,Tyler Barnette (minors),RHP,,,,,,,,,,,,,HS,"Hickory HS (Hickory, NC)",9
2009,9,,288,27.0,Y,"$550,000",Kendal Volz (minors),RHP,,,,,,,,,,,,,4Yr,"Baylor University (Waco, TX)",9
2008,9,,292,30.0,Y,"$80,000",Christian V�zquez (minors),C,6.8,835.0,2760.0,61.0,0.257,0.684,,,,,,,HS,"Puerto Rico Baseball Academy (Gurabo, Puerto Rico)",9
2007,9,,294,20.0,Y,"$123,000",Kade Keowen (minors),OF,,,,,,,,,,,,,JC,"Louisiana State University, Eunice (Eunice, LA)",9
2006,9,,283,27.0,Y,"$600,000",Ryan Kalish (minors),OF,-0.6,153.0,387.0,4.0,0.246,0.646,,,,,,,HS,"Red Bank Catholic HS (Red Bank, NJ)",9
2005,9,,288,28.0,Y,"$90,000",Mark Wagner (minors),C,,,,,,,,,,,,,4Yr,"University of California, Irvine (Irvine, CA)",9
2004,9,,275,24.0,Y,"$10,000",Matt Van Der Bosch (minors),OF,,,,,,,,,,,,,4Yr,"Oral Roberts University (Tulsa, OK)",9
2003,9,,264,17.0,Y,"$65,000",Jonathan Wilson (minors),RHP,,,,,,,,,,,,,JC,"Northeastern Junior College (Sterling, CO)",9
2002,9,,268,16.0,Y,,Tyler Pelland (minors),LHP,,,,,,,,,,,,,HS,"Mount Abraham HS (Bristol, VT)",9
2001,9,,273,17.0,Y,,Billy Simon (minors),RHP,,,,,,,,,,,,,HS,"Wellington HS (Wellington, FL)",9
2000,9,,272,22.0,Y,,Patrick Johnson (minors),OF,,,,,,,,,,,,,4Yr,"William Carey University (Hattiesburg, MS)",9
1999,9,,289,25.0,N,,Hank Thoms (minors),RHP,,,,,,,,,,,,,4Yr,"Mississippi State University (Mississippi State, MS)",9
1998,9,,265,12.0,N,,Mark Teixeira (minors),3B,50.6,1862.0,6936.0,409.0,0.269,0.87,,,,,,,HS,"Mount St. Joseph HS (Baltimore, MD)",9
1997,9,,281,17.0,N,,Justin Wayne (minors),RHP,-1.5,26.0,12.0,0.0,0.0,0.0,26.0,5.0,8.0,6.13,1.65,0.0,HS,"Punahou HS (Honolulu, HI)",9
1996,9,,271,26.0,Y,,Marcus Martinez (minors),LHP,,,,,,,,,,,,,HS,"Monterey HS (Lubbock, TX)",9
1995,9,,242,15.0,Y,,Paxton Crawford (minors),RHP,1.1,0.0,0.0,0.0,,,15.0,5.0,1.0,4.15,1.4,0.0,HS,"Carlsbad HS (Carlsbad, NM)",9
1994,9,,243,12.0,Y,,Chris Allison (minors),2B,,,,,,,,,,,,,4Yr,"Bradley University (Peoria, IL)",9
1993,9,,247,7.0,Y,,Dean Peterson (minors),RHP,,,,,,,,,,,,,4Yr,"Allegheny College (Meadville, PA)",9
1992,9,,254,18.0,Y,,Todd Carey (minors),SS,,,,,,,,,,,,,4Yr,"Brown University (Providence, RI)",9
1991,9,,252,23.0,N,,Dan McDonald (minors),3B,,,,,,,,,,,,,HS,"Maynard Evans HS (Orlando, FL)",9
1990,9,,254,19.0,N,,Mike Collett (minors),RHP,,,,,,,,,,,,,JC,"Citrus College (Glendora, CA)",9
1989,9,,241,23.0,Y,,Cedric Santiago (minors),LHP,,,,,,,,,,,,,HS,"Central Juvenil HS (Yauco, Puerto Rico)",9
1988,9,,225,12.0,Y,,Willie Tatum (minors),3B,,,,,,,,,,,,,4Yr,"University of the Pacific (Stockton, CA)",9
1987,9,,240,26.0,Y,,Mike Kelly (minors),OF,,,,,,,,,,,,,4Yr,"University of South Florida (Tampa, FL)",9
1986,9,,225,14.0,N,,Joe Kelly (minors),LHP,,,,,,,,,,,,,HS,"Notre Dame HS (Utica, NY)",9
1985,9,,231,21.0,Y,,Jim Orsag (minors),1B,,,,,,,,,,,,,4Yr,"University of Illinois at Urbana-Champaign (Champaign, IL)",9
1984,9,,224,14.0,Y,,Tony DeFrancesco (minors),C,,,,,,,,,,,,,4Yr,"Seton Hall University (South Orange, NJ)",9
1983,9,,229,19.0,Y,,Chris Cannizzaro (minors),2B,,,,,,,,,,,,,4Yr,"San Diego State University (San Diego, CA)",9
1982,9,,228,18.0,N,,Fred Carter (minors),OF,,,,,,,,,,,,,HS,"Millwood HS (Oklahoma City, OK)",9
1981,9,,226,19.0,Y,,Charles Fisher (minors),OF,,,,,,,,,,,,,4Yr,"Jacksonville State University (Jacksonville, AL)",9
1980,9,,231,24.0,Y,,Mike Bryant (minors),OF,,,,,,,,,,,,,4Yr,"University of Massachusetts Lowell (Lowell, MA)",9
1979,9,,234,26.0,Y,,Chuck Sandberg (minors),1B,,,,,,,,,,,,,4Yr,"University of Florida (Gainesville, FL)",9
1978,9,,232,24.0,Y,,Russ Quetti (minors),SS,,,,,,,,,,,,,4Yr,"University of Maine (Orono, ME)",9
1977,9,,221,13.0,Y,,Leonard Thompson (minors),C,,,,,,,,,,,,,JC,"Georgia Perimeter College (Covington, GA)",9
1976,9,,214,22.0,Y,,Gary Allenson (minors),C,1.3,416.0,1061.0,19.0,0.222,0.632,,,,,,,4Yr,"Arizona State University (Tempe, AZ)",9
1975,9,,207,15.0,N,,Dave Stegman (minors),OF,-0.2,172.0,320.0,8.0,0.206,0.602,,,,,,,4Yr,"University of Arizona (Tucson, AZ)",9
1974,9,,212,20.0,Y,,Joel Finch (minors),RHP,0.3,1.0,1.0,0.0,0.0,0.0,15.0,0.0,3.0,4.87,1.57,0.0,HS,"George Washington HS (South Bend, IN)",9
1973,9,,209,17.0,Y,,Richard Berg (minors),OF,,,,,,,,,,,,,HS,"Apple Valley HS (Apple Valley, CA)",9
1972,9,,208,16.0,Y,,Ludwig Benedetti (minors),SS,,,,,,,,,,,,,4Yr,"Long Island University, Brooklyn Campus (Brooklyn, NY)",9
1971,9,,213,16.0,Y,,Bill Moran (minors),RHP,0.0,0.0,0.0,0.0,,,15.0,1.0,3.0,4.66,1.73,0.0,JC,"Louisburg College (Louisburg, NC)",9
1970,9,,214,17.0,Y,,Kenneth Watkins (minors),RHP,,,,,,,,,,,,,4Yr,"Missouri State University (Springfield, MO)",9
1969,9,,205,13.0,Y,,Robert Kerr (minors),RHP,,,,,,,,,,,,,HS,"Arvada HS (Arvada, CO)",9
1968,9,,200,20.0,Y,,Edward Baird (minors),RHP,,,,,,,,,,,,,4Yr,"University of Connecticut (Storrs, CT)",9
1967,9,,163,3.0,N,,Calvin Meier (minors),SS,,,,,,,,,,,,,JC,"Grossmont College (El Cajon, CA)",9
1966,9,,164,4.0,N,,Ernie Aguirre (minors),C,,,,,,,,,,,,,HS,"Bakersfield HS (Bakersfield, CA)",9
1965,9,,190,,N,,Ronnie Shotts (minors),3B,,,,,,,,,,,,,HS,"Chaffey HS (Ontario, CA)",9
2023,10,,298,14.0,Y,"$50,000",Ryan Ammons (minors),P,,,,,,,,,,,,,4Yr,"Clemson University (Clemson, SC)",10
2022,10,,309,23.0,Y,"$7,500",Isaac Coffey (minors),P,,,,,,,,,,,,,4Yr,"Oral Roberts University (Tulsa, OK)",10
2021,10,,286,4.0,Y,"$47,500",Matt Litwicki (minors),P,,,,,,,,,,,,,4Yr,"Indiana University Bloomington (Bloomington, IN)",10
2019,10,,317,30.0,Y,"$50,000",Stephen Scott (minors),OF,,,,,,,,,,,,,4Yr,"Vanderbilt University (Nashville, TN)",10
2018,10,,310,26.0,Y,"$2,500",Grant Williams (minors),2B,,,,,,,,,,,,,4Yr,"Kennesaw State University (Kennesaw, GA)",10
2017,10,,311,26.0,Y,"$5,000",Jordan Wren (minors),OF,,,,,,,,,,,,,4Yr,"Georgia Southern University (Statesboro, GA)",10
2016,10,,298,12.0,Y,"$50,000",Santiago Espinal (minors),SS,5.3,346.0,961.0,11.0,0.273,0.698,2.0,0.0,0.0,9.0,2.0,0.0,4Yr,"Miami Dade College, Wolfson Campus (Miami, FL)",10
2015,10,,291,6.0,Y,"$10,000",Mitch Gunsolus (minors),3B,,,,,,,,,,,,,4Yr,"Gonzaga University (Spokane, WA)",10
2014,10,,314,29.0,Y,"$10,000",Cole Sturgeon (minors),OF,,,,,,,,,,,,,4Yr,"University of Louisville (Louisville, KY)",10
2013,10,,293,7.0,Y,"$10,000",Taylor Grover (minors),RHP,,,,,,,,,,,,,4Yr,"University of South Carolina Aiken (Aiken, SC)",10
2012,10,,331,23.0,Y,"$1,000",J.T. Watkins (minors),C,,,,,,,,,,,,,4Yr,"United States Military Academy (West Point, NY)",10
2011,10,,322,21.0,Y,"$85,000",Cody Koback (minors),CF,,,,,,,,,,,,,4Yr,"University of Wisconsin-Stevens Point (Stevens Point, WI)",10
2010,10,,323,27.0,Y,"$150,000",Jacob Dahlstrand (minors),RHP,,,,,,,,,,,,,HS,"Memorial HS (Houston, TX)",10
2009,10,,318,27.0,Y,"$750,000",Brandon Jacobs (minors),LF,,,,,,,,,,,,,HS,"Parkview HS (Lilburn, GA)",10
2008,10,,322,30.0,Y,"$100,000",Pete Ruiz (minors),RHP,,,,,,,,,,,,,JC,"Santa Barbara City College (Santa Barbara, CA)",10
2007,10,,324,20.0,Y,"$70,000",Kenneth Roque (minors),SS,,,,,,,,,,,,,HS,"Puerto Rico Baseball Academy (Gurabo, Puerto Rico)",10
2006,10,,313,27.0,N,,Kyle Snyder (minors),RHP,,,,,,,,,,,,,HS,"Wellington HS (Wellington, FL)",10
2005,10,,318,28.0,Y,"$50,000",Kevin Guyette (minors),RHP,,,,,,,,,,,,,4Yr,"University of Arizona (Tucson, AZ)",10
2004,10,,305,24.0,N,,Steve Pearce (minors),1B,9.9,766.0,2256.0,91.0,0.254,0.772,,,,,,,4Yr,"University of South Carolina (Columbia, SC)",10
2003,10,,294,17.0,Y,"$31,000",Chris Durbin (minors),OF,,,,,,,,,,,,,4Yr,"Baylor University (Waco, TX)",10
2002,10,,298,16.0,Y,,Greg Stone (minors),SS,,,,,,,,,,,,,JC,"Bacone College (Muskogee, OK)",10
2001,10,,303,17.0,N,,Ben Crockett (minors),RHP,,,,,,,,,,,,,4Yr,"Harvard University (Cambridge, MA)",10
2000,10,,302,22.0,N,,Eric Doble (minors),RHP,,,,,,,,,,,,,4Yr,"Arizona State University (Tempe, AZ)",10
1999,10,,319,25.0,Y,,Brian Wiese (minors),OF,,,,,,,,,,,,,4Yr,"Mississippi State University (Mississippi State, MS)",10
1998,10,,295,12.0,N,,Lenny DiNardo (minors),LHP,-1.3,6.0,5.0,0.0,0.2,0.4,94.0,10.0,18.0,5.36,1.68,0.0,HS,"Santa Fe HS (Alachua, FL)",10
1997,10,,311,17.0,Y,,Marty McLeary (minors),RHP,0.1,12.0,7.0,0.0,0.0,0.0,12.0,2.0,0.0,5.28,1.48,0.0,4Yr,"Mount Vernon Nazarene University (Mount Vernon, OH)",10
1996,10,,301,26.0,Y,,Shea Hillenbrand (minors),SS,6.3,943.0,3570.0,108.0,0.284,0.76,,,,,,,JC,"Mesa Community College (Mesa, AZ)",10
1995,10,,270,15.0,Y,,Kevie Austin (minors),RHP,,,,,,,,,,,,,4Yr,"Emmanuel College (Franklin Springs, GA)",10
1994,10,,271,12.0,Y,,Damian Sapp (minors),C,,,,,,,,,,,,,HS,"Pleasant Grove HS (Pleasant Grove, UT)",10
1993,10,,275,7.0,Y,,Lou Merloni (minors),SS,3.0,423.0,1085.0,14.0,0.271,0.716,,,,,,,4Yr,"Providence College (Providence, RI)",10
1992,10,,282,18.0,Y,,Mark Senkowitz (minors),C,,,,,,,,,,,,,4Yr,"Ohio Wesleyan University (Delaware, OH)",10
1991,10,,278,23.0,Y,,Tony Rodriguez (minors),SS,0.3,27.0,67.0,1.0,0.239,0.59,,,,,,,4Yr,"College of Charleston (Charleston, SC)",10
1990,10,,281,19.0,Y,,Richie Borrero (minors),C,,,,,,,,,,,,,HS,"Segundo Ruiz Belvis HS (Hormigueros, Puerto Rico)",10
1989,10,,267,23.0,Y,,Greg Hansell (minors),RHP,-0.4,52.0,2.0,0.0,0.0,0.0,106.0,4.0,4.0,5.56,1.51,3.0,HS,"John F. Kennedy HS (La Palma, CA)",10
1988,10,,251,12.0,Y,,Sean Moore (minors),OF,,,,,,,,,,,,,HS,"Nogales HS (La Puente, CA)",10
1987,10,,266,26.0,Y,,Jeff Plympton (minors),RHP,0.2,0.0,0.0,0.0,,,4.0,0.0,0.0,0.0,1.69,0.0,4Yr,"University of Maine (Orono, ME)",10
1986,10,,251,14.0,Y,,Jimmy Morrison (minors),RHP,,,,,,,,,,,,,HS,"Anna-Jonesboro HS (Anna, IL)",10
1985,10,,257,21.0,Y,,Brady Anderson (minors),OF,35.0,1834.0,6499.0,210.0,0.256,0.787,,,,,,,4Yr,"University of California, Irvine (Irvine, CA)",10
1984,10,,250,14.0,Y,,Odie Abril (minors),RHP,,,,,,,,,,,,,HS,"Colton HS (Colton, CA)",10
1983,10,,255,19.0,Y,,Al Hamilton (minors),2B,,,,,,,,,,,,,4Yr,"Missouri State University (Springfield, MO)",10
1982,10,,254,18.0,Y,,Dave Oliva (minors),OF,,,,,,,,,,,,,4Yr,"Santa Clara University (Santa Clara, CA)",10
1981,10,,252,19.0,Y,,Craig Walck (minors),3B,,,,,,,,,,,,,4Yr,"Ursinus College (Collegeville, PA)",10
1980,10,,257,24.0,Y,,Brian Zell (minors),OF,,,,,,,,,,,,,4Yr,"California State Polytechnic University, Pomona (Pomona, CA)",10
1979,10,,260,26.0,Y,,Jerry Miklosi (minors),SS,,,,,,,,,,,,,4Yr,"Western Michigan University (Kalamazoo, MI)",10
1978,10,,258,24.0,Y,,Donald Hayford (minors),RHP,,,,,,,,,,,,,HS,"Lakeland HS (Lakeland, FL)",10
1977,10,,247,13.0,Y,,Steve Shields (minors),RHP,-2.2,29.0,19.0,0.0,0.105,0.255,102.0,8.0,8.0,5.26,1.64,3.0,HS,"Hokes Bluff HS (Hokes Bluff, AL)",10
1976,10,,238,22.0,Y,,Danny Parks (minors),RHP,,,,,,,,,,,,,4Yr,"University of Memphis (Memphis, TN)",10
1975,10,,231,15.0,Y,,Dave Stapleton (minors),2B,2.0,582.0,2028.0,41.0,0.271,0.707,,,,,,,4Yr,"University of South Alabama (Mobile, AL)",10
1974,10,,236,20.0,N,,Lee Roy Russell (minors),RHP,,,,,,,,,,,,,HS,"Bibb County HS (Centreville, AL)",10
1973,10,,233,17.0,Y,,Roswell Brayton (minors),RHP,,,,,,,,,,,,,4Yr,"Harvard University (Cambridge, MA)",10
1972,10,,232,16.0,Y,,Andy Merchant (minors),C,0.1,3.0,6.0,0.0,0.333,0.762,,,,,,,4Yr,"Auburn University (Auburn, AL)",10
1971,10,,238,16.0,Y,,Michael Sherwood (minors),SS,,,,,,,,,,,,,HS,"Bella Vista HS (Fair Oaks, CA)",10
1970,10,,239,17.0,Y,,Michael Mooney (minors),C,,,,,,,,,,,,,HS,"Cardinal Dougherty HS (Buffalo, NY)",10
1969,10,,229,13.0,N,,Billy Hernandez (minors),OF,,,,,,,,,,,,,HS,"George Washington HS (New York, NY)",10
1968,10,,224,20.0,N,,Michael O'Banion (minors),C,,,,,,,,,,,,,HS,"Dos Palos HS (Dos Palos, CA)",10
1967,10,,183,3.0,Y,,Mark Kleibl (minors),3B,,,,,,,,,,,,,HS,"Miami Norland HS (Miami, FL)",10
1966,10,,184,4.0,N,,Nick DeFlorio (minors),SS,,,,,,,,,,,,,HS,"H. Frank Carey HS (Franklin Square, NY)",10
1965,10,,198,,Y,,Anthony Ciarpelli (minors),LHP,,,,,,,,,,,,,HS,"West Genesee HS (Camillus, NY)",10
