Year,Rnd,DT,OvPck,RdPck,Signed,Bonus,Name,Pos,WAR,G,AB,HR,BA,OPS,G.1,W,L,ERA,WHIP,SV,Type,Drafted Out of,Round
2023,1,,3,3.0,Y,"$7,697,500",Max Clark (minors),OF,,,,,,,,,,,,,HS,"Franklin Community HS (Franklin, IN)",1
2023,1,,37,37.0,Y,"$2,847,500",Kevin McGonigle (minors),SS,,,,,,,,,,,,,HS,"Monsignor Bonner HS (Drexel Hill, PA)",1
2022,1,,12,12.0,Y,"$4,590,300",Jace Jung (minors),2B,,,,,,,,,,,,,4Yr,"Texas Tech University (Lubbock, TX)",1
2021,1,,3,3.0,Y,"$6,900,000",Jackson Jobe (minors),P,,,,,,,,,,,,,HS,"Heritage Hall School (Oklahoma City, OK)",1
2021,1,,32,32.0,Y,"$2,500,000",Ty Madden (minors),P,,,,,,,,,,,,,4Yr,"University of Texas at Austin (Austin, TX)",1
2020,1,,1,1.0,Y,"$8,416,300",Spencer Torkelson (minors),3B,-0.4,269.0,966.0,39.0,0.222,0.701,,,,,,,4Yr,"Arizona State University (Tempe, AZ)",1
2019,1,,5,5.0,Y,"$6,180,700",Riley Greene (minors),OF,3.3,192.0,754.0,16.0,0.271,0.739,,,,,,,HS,"Paul J. Hagerty HS (Oviedo, FL)",1
2018,1,,1,1.0,Y,"$7,500,000",Casey Mize (minors),RHP,2.8,2.0,2.0,0.0,0.0,0.333,39.0,7.0,13.0,4.29,1.21,0.0,4Yr,"Auburn University (Auburn, AL)",1
2017,1,,18,18.0,Y,"$3,500,000",Alex Faedo (minors),RHP,0.1,0.0,0.0,0.0,,,27.0,3.0,10.0,4.94,1.32,0.0,4Yr,"University of Florida (Gainesville, FL)",1
2016,1,,9,9.0,Y,"$3,963,045",Matt Manning (minors),RHP,1.6,1.0,1.0,0.0,0.0,0.0,45.0,11.0,14.0,4.37,1.25,0.0,HS,"Sheldon HS (Sacramento, CA)",1
2015,1,,22,22.0,Y,"$2,154,200",Beau Burrows (minors),RHP,-0.7,2.0,0.0,0.0,,,11.0,0.0,1.0,10.7,1.98,0.0,HS,"Weatherford HS (Weatherford, TX)",1
2015,1,,34,34.0,Y,"$1,795,100",Christin Stewart (minors),OF,-1.2,157.0,519.0,15.0,0.225,0.676,,,,,,,4Yr,"University of Tennessee (Knoxville, TN)",1
2014,1,,23,23.0,Y,"$2,000,000",Derek Hill (minors),OF,-0.3,108.0,280.0,4.0,0.229,0.593,,,,,,,HS,"Elk Grove HS (Elk Grove, CA)",1
2013,1,,20,20.0,Y,"$2,001,700",Jonathon Crawford (minors),RHP,,,,,,,,,,,,,4Yr,"University of Florida (Gainesville, FL)",1
2013,1,,39,39.0,Y,"$1,433,400",Corey Knebel (minors),RHP,5.6,231.0,2.0,0.0,0.0,0.0,312.0,13.0,16.0,3.26,1.24,72.0,4Yr,"University of Texas at Austin (Austin, TX)",1
2010,1s,,44,44.0,Y,"$3,450,000",*Nick Castellanos (minors),3B,14.0,1379.0,5259.0,210.0,0.276,0.799,,,,,,,HS,"Archbishop McCarthy HS (Southwest Ranches, FL)",1
2010,1s,,48,48.0,Y,"$1,150,000",*Chance Ruffin (minors),RHP,-0.5,2.0,0.0,0.0,,,24.0,1.0,2.0,5.6,1.68,0.0,4Yr,"University of Texas at Austin (Austin, TX)",1
2009,1,,9,9.0,Y,"$4,700,000",Jacob Turner (minors),RHP,-2.6,73.0,77.0,0.0,0.091,0.257,102.0,14.0,31.0,5.37,1.54,0.0,HS,"Westminster Christian Academy (Town and Country, MO)",1
2008,1,,21,21.0,Y,"$1,480,000",Ryan Perry (minors),RHP,0.2,11.0,0.0,0.0,,,156.0,6.0,6.0,4.36,1.45,2.0,4Yr,"University of Arizona (Tucson, AZ)",1
2007,1,,27,27.0,Y,"$3,580,000",Rick Porcello (minors),RHP,18.8,24.0,45.0,0.0,0.178,0.4,355.0,150.0,125.0,4.4,1.32,0.0,HS,"Seton Hall Preparatory School (West Orange, NJ)",1
2007,1s,,60,60.0,Y,"$540,000",*Brandon Hamilton (minors),RHP,,,,,,,,,,,,,HS,"Stanhope Elmore HS (Millbrook, AL)",1
2006,1,,6,6.0,Y,"$3,550,000",Andrew Miller (minors),LHP,7.8,185.0,74.0,0.0,0.054,0.108,612.0,55.0,55.0,4.03,1.34,63.0,4Yr,"University of North Carolina at Chapel Hill (Chapel Hill, NC)",1
2005,1,,10,10.0,Y,"$2,650,000",Cameron Maybin (minors),OF,13.5,1162.0,3824.0,72.0,0.254,0.697,,,,,,,HS,"T. C. Roberson HS (Asheville, NC)",1
2004,1,,2,2.0,Y,"$3,120,000",Justin Verlander (minors),RHP,80.9,24.0,50.0,0.0,0.1,0.2,509.0,257.0,141.0,3.24,1.12,0.0,4Yr,"Old Dominion University (Norfolk, VA)",1
2003,1,,3,3.0,Y,"$3,350,000",Kyle Sleeth (minors),RHP,,,,,,,,,,,,,4Yr,"Wake Forest University (Winston-Salem, NC)",1
2002,1,,8,8.0,Y,"$2,300,000",Scott Moore (minors),SS,-0.8,152.0,385.0,16.0,0.242,0.713,,,,,,,HS,"Cypress HS (Cypress, CA)",1
2001,1,,11,11.0,Y,"$1,800,000",Kenny Baugh (minors),RHP,,,,,,,,,,,,,4Yr,"Rice University (Houston, TX)",1
2001,1s,,32,32.0,Y,"$1,100,000",*Michael Woods (minors),2B,,,,,,,,,,,,,4Yr,"Southern University and A&M College (Baton Rouge, LA)",1
2000,1,,8,8.0,Y,"$2,150,000",Matt Wheatland (minors),RHP,,,,,,,,,,,,,HS,"Rancho Bernardo HS (San Diego, CA)",1
1999,1,,3,3.0,Y,"$3,500,000",Eric Munson (minors),C,-1.4,361.0,1056.0,49.0,0.214,0.683,,,,,,,4Yr,"University of Southern California (Los Angeles, CA)",1
1998,1,,14,14.0,Y,"$1,675,000",Jeff Weaver (minors),RHP,15.2,169.0,208.0,0.0,0.207,0.478,355.0,104.0,119.0,4.71,1.37,2.0,4Yr,"California State University, Fresno (Fresno, CA)",1
1998,1s,,34,34.0,Y,"$865,000",*Nate Cornejo (minors),RHP,0.0,2.0,4.0,0.0,0.0,0.0,56.0,12.0,29.0,5.41,1.66,0.0,HS,"Wellington HS (Wellington, KS)",1
1997,1,,1,1.0,Y,"$2,505,000",Matt Anderson (minors),RHP,-0.6,22.0,0.0,0.0,,,257.0,15.0,7.0,5.19,1.58,26.0,4Yr,"Rice University (Houston, TX)",1
1996,1,,6,6.0,Y,"$1,415,000",Seth Greisinger (minors),RHP,0.0,2.0,6.0,0.0,0.167,0.333,42.0,10.0,16.0,5.51,1.52,0.0,4Yr,"University of Virginia (Charlottesville, VA)",1
1995,1,,11,11.0,Y,"$970,000",Mike Drumright (minors),RHP,,,,,,,,,,,,,4Yr,"Wichita State University (Wichita, KS)",1
1994,1,,18,18.0,Y,"$825,000",Cade Gaspar (minors),RHP,,,,,,,,,,,,,4Yr,"Pepperdine University (Malibu, CA)",1
1993,1,,9,9.0,Y,"$800,000",Matt Brunson (minors),SS,,,,,,,,,,,,,HS,"Cherry Creek HS (Greenwood Village, CO)",1
1992,1,,16,16.0,Y,"$470,000",Rick Greene (minors),RHP,-0.1,1.0,2.0,0.0,0.0,0.0,1.0,0.0,0.0,4.76,1.41,0.0,4Yr,"Louisiana State University (Baton Rouge, LA)",1
1991,1s,,32,32.0,Y,,*Justin Thompson (minors),LHP,12.8,5.0,14.0,0.0,0.071,0.143,103.0,36.0,43.0,4.02,1.34,0.0,HS,"Klein Oak HS (Spring, TX)",1
1991,1s,,41,41.0,Y,,*Trever Miller (minors),LHP,4.7,408.0,6.0,0.0,0.167,0.5,694.0,18.0,17.0,4.18,1.45,11.0,HS,"Trinity HS (Louisville, KY)",1
1990,1,,2,2.0,Y,"$500,000",Tony Clark (minors),OF,12.3,1559.0,4532.0,251.0,0.262,0.824,,,,,,,HS,"Christian HS (El Cajon, CA)",1
1989,1,,21,21.0,Y,"$169,000",Greg Gohr (minors),RHP,0.4,0.0,0.0,0.0,,,66.0,8.0,11.0,6.21,1.73,1.0,4Yr,"Santa Clara University (Santa Clara, CA)",1
1988,1,,26,26.0,Y,"$100,000",Rico Brogna (minors),1B,-1.1,848.0,2958.0,106.0,0.269,0.764,,,,,,,HS,"Watertown HS (Watertown, CT)",1
1987,1,,20,20.0,Y,"$125,000",*Bill Henderson (minors),C,,,,,,,,,,,,,HS,"Westminster Christian School (Miami, FL)",1
1987,1,,21,21.0,Y,"$80,000",Steve Pegues (minors),OF,-0.7,100.0,207.0,6.0,0.266,0.687,,,,,,,HS,"Pontotoc HS (Pontotoc, MS)",1
1987,1s,,30,30.0,Y,,*Travis Fryman (minors),SS,34.4,1698.0,6481.0,223.0,0.274,0.779,,,,,,,HS,"Gonzalez Tate HS (Pensacola, FL)",1
1986,1,,18,18.0,Y,"$83,000",Phil Clark (minors),C,0.7,264.0,543.0,17.0,0.276,0.743,,,,,,,HS,"Crockett HS (Crockett, TX)",1
1985,1,,26,26.0,Y,"$100,000",Randy Nosek (minors),RHP,-0.7,0.0,0.0,0.0,,,5.0,1.0,3.0,10.22,2.68,0.0,HS,"Chillicothe HS (Chillicothe, MO)",1
1983,1,,15,15.0,Y,"$69,900",Wayne Dotson (minors),RHP,,,,,,,,,,,,,HS,"Estacado HS (Lubbock, TX)",1
1982,1,,20,20.0,Y,"$73,000",Rich Monteleone (minors),RHP,2.6,39.0,3.0,0.0,0.0,0.0,210.0,24.0,17.0,3.87,1.31,0.0,HS,"Tampa Catholic HS (Tampa, FL)",1
1981,1,,17,17.0,Y,"$67,500",Ricky Barlow (minors),RHP,,,,,,,,,,,,,HS,"Woodville HS (Woodville, TX)",1
1980,1,,18,18.0,Y,"$62,500",Glenn Wilson (minors),3B,13.1,1201.0,4151.0,98.0,0.265,0.704,1.0,0.0,0.0,0.0,0.0,0.0,4Yr,"Sam Houston State University (Huntsville, TX)",1
1979,1,,13,13.0,Y,"$125,000",Rick Leach (minors),OF,3.0,799.0,1719.0,18.0,0.268,0.704,1.0,0.0,0.0,27.0,4.0,0.0,4Yr,"University of Michigan (Ann Arbor, MI)",1
1979,1,,23,23.0,Y,"$54,000",*Chris Baker (minors),OF,,,,,,,,,,,,,HS,"Franklin HS (Livonia, MI)",1
1978,1,,12,12.0,Y,"$150,000",Kirk Gibson (minors),OF,38.4,1635.0,5798.0,255.0,0.268,0.815,,,,,,,4Yr,"Michigan State University (East Lansing, MI)",1
1977,1,,5,5.0,Y,"$43,500",Kevin Richards (minors),RHP,,,,,,,,,,,,,HS,"Roosevelt HS (Wyandotte, MI)",1
1976,1,,2,2.0,Y,"$70,000",Pat Underwood (minors),LHP,1.1,0.0,0.0,0.0,,,113.0,13.0,18.0,4.43,1.33,8.0,HS,"Kokomo HS (Kokomo, IN)",1
1975,1,,3,3.0,Y,"$45,000",Les Filkins (minors),OF,,,,,,,,,,,,,HS,"George Washington HS (Chicago, IL)",1
1974,1,,16,16.0,Y,"$60,000",Lance Parrish (minors),INF,39.5,1988.0,7067.0,324.0,0.252,0.753,,,,,,,HS,"Walnut HS (Walnut, CA)",1
1973,1,,19,19.0,Y,"$25,000",Charles Bates (minors),3B,,,,,,,,,,,,,4Yr,"California State University, Los Angeles (Los Angeles, CA)",1
1972,1,,20,20.0,Y,"$48,000",Jerry Manuel (minors),SS,-0.6,96.0,127.0,3.0,0.15,0.498,,,,,,,HS,"Cordova HS (Rancho Cordova, CA)",1
1971,1,,11,11.0,Y,"$23,000",Tom Veryzer (minors),SS,-3.7,996.0,2848.0,14.0,0.241,0.577,,,,,,,HS,"Islip HS (Islip, NY)",1
1970,1,,20,20.0,Y,"$45,000",Terry Mappin (minors),C,,,,,,,,,,,,,HS,"Durrett HS (Louisville, KY)",1
1969,1,,19,19.0,Unk,,Lenny Baxley (minors),1B,,,,,,,,,,,,,HS,"Enterprise HS (Redding, CA)",1
1968,1,,18,18.0,Y,"$15,000",Murray Robinson (minors),OF,,,,,,,,,,,,,HS,"Thomas Dale HS (Chester, VA)",1
1967,1,,15,15.0,Y,"$35,000",Jim Foor (minors),LHP,-0.6,13.0,0.0,0.0,,,13.0,1.0,0.0,12.0,3.5,0.0,HS,"McCluer HS (Florissant, MO)",1
1966,1,,14,14.0,N,,Rick Konik (minors),1B,,,,,,,,,,,,,HS,"St. Andrews HS (Detroit, MI)",1
1965,1,,13,13.0,Y,"$33,000",Gene Lamont (minors),C,0.2,87.0,159.0,4.0,0.233,0.649,,,,,,,HS,"Hiawatha HS (Kirkland, IL)",1
2023,2,,45,6.0,Y,"$1,429,650",Max Anderson (minors),2B,,,,,,,,,,,,,4Yr,"University of Nebraska-Lincoln (Lincoln, NE)",2
2022,2,,51,12.0,Y,"$1,800,000",Peyton Graham (minors),SS,,,,,,,,,,,,,4Yr,"University of Oklahoma (Norman, OK)",2
2021,2,,39,3.0,Y,"$2,750,000",Izaac Pacheco (minors),SS,,,,,,,,,,,,,HS,"Friendswood HS (Friendswood, TX)",2
2020,2,,38,1.0,Y,"$1,952,300",Dillon Dingler (minors),C,,,,,,,,,,,,,4Yr,"The Ohio State University (Columbus, OH)",2
2020,2,,62,25.0,Y,"$1,210,000",Daniel Cabrera (minors),OF,,,,,,,,,,,,,4Yr,"Louisiana State University (Baton Rouge, LA)",2
2019,2,,47,6.0,Y,"$1,580,200",Nick Quintana (minors),3B,,,,,,,,,,,,,4Yr,"University of Arizona (Tucson, AZ)",2
2018,2,,44,1.0,Y,"$2,500,000",Parker Meadows (minors),OF,0.9,37.0,125.0,3.0,0.24,0.714,,,,,,,HS,"Grayson HS (Loganville, GA)",2
2017,2,,57,21.0,Y,"$850,000",Rey Rivera (minors),OF,,,,,,,,,,,,,JC,"Chipola College (Marianna, FL)",2
2015,2,,65,23.0,Y,"$1,000,000",Tyler Alexander (minors),LHP,3.4,4.0,2.0,0.0,0.0,0.0,120.0,11.0,23.0,4.38,1.29,0.0,4Yr,"Texas Christian University (Fort Worth, TX)",2
2014,2,,63,22.0,Y,"$900,000",Spencer Turnbull (minors),RHP,4.2,4.0,10.0,0.0,0.0,0.0,61.0,12.0,29.0,4.55,1.36,0.0,4Yr,"University of Alabama (Tuscaloosa, AL)",2
2013,2,,58,19.0,Y,"$956,600",Kevin Ziomek (minors),LHP,,,,,,,,,,,,,4Yr,"Vanderbilt University (Nashville, TN)",2
2012,2,,91,31.0,Y,"$531,800",Jake Thompson (minors),RHP,0.2,29.0,28.0,0.0,0.143,0.387,30.0,7.0,8.0,4.87,1.53,2.0,HS,"Rockwall-Heath HS (Heath, TX)",2
2011,2,,76,16.0,Y,"$577,900",James McCann (minors),C,7.4,852.0,2828.0,84.0,0.242,0.674,1.0,0.0,0.0,0.0,2.0,0.0,4Yr,"University of Arkansas (Fayetteville, AR)",2
2010,2,,68,18.0,Y,"$1,100,000",Drew Smyly (minors),LHP,11.9,48.0,64.0,0.0,0.047,0.108,280.0,64.0,58.0,4.22,1.29,3.0,4Yr,"University of Arkansas (Fayetteville, AR)",2
2009,2,,58,9.0,Y,"$1,495,000",Andy Oliver (minors),LHP,-0.8,1.0,2.0,0.0,0.0,0.0,7.0,0.0,5.0,7.11,1.83,0.0,4Yr,"Oklahoma State University (Stillwater, OK)",2
2008,2,,67,21.0,Y,"$606,000",Cody Satterwhite (minors),RHP,,,,,,,,,,,,,4Yr,"University of Mississippi (Oxford, MS)",2
2007,2,,91,27.0,Y,"$378,000",Danny Worth (minors),SS,-0.5,149.0,300.0,2.0,0.223,0.568,2.0,0.0,0.0,4.5,2.0,0.0,4Yr,"Pepperdine University (Malibu, CA)",2
2006,2,,50,6.0,Y,"$690,000",Ron Bourquin (minors),3B,,,,,,,,,,,,,4Yr,"The Ohio State University (Columbus, OH)",2
2004,2,,43,2.0,Y,"$800,000",Eric Beattie (minors),RHP,,,,,,,,,,,,,4Yr,"University of Tampa (Tampa, FL)",2
2003,2,,40,3.0,Y,"$865,000",Jay Sborz (minors),RHP,-0.3,1.0,0.0,0.0,,,1.0,0.0,0.0,67.5,4.5,0.0,HS,"Langley HS (McLean, VA)",2
2002,2,,49,8.0,Y,"$805,000",Brent Clevlen (minors),OF,-0.1,59.0,77.0,3.0,0.234,0.709,,,,,,,HS,"Westwood HS (Austin, TX)",2
2001,2,,55,11.0,Y,"$685,000",Preston Larrison (minors),RHP,,,,,,,,,,,,,4Yr,"University of Evansville (Evansville, IN)",2
2001,2,,65,21.0,Y,"$620,000",*Matt Coenen (minors),LHP,,,,,,,,,,,,,4Yr,"Charleston Southern University (Charleston, SC)",2
2000,2,,48,8.0,Y,"$600,000",Chad Petty (minors),LHP,,,,,,,,,,,,,HS,"Chalker HS (Southington, OH)",2
1998,2,,57,14.0,Y,"$450,000",Brandon Inge (minors),C,19.2,1532.0,5014.0,152.0,0.233,0.685,,,,,,,4Yr,"Virginia Commonwealth University (Richmond, VA)",2
1998,2,,73,30.0,Y,"$392,500",*Adam Pettyjohn (minors),LHP,-0.8,4.0,3.0,0.0,0.0,0.0,19.0,1.0,7.0,6.65,1.67,0.0,4Yr,"California State University, Fresno (Fresno, CA)",2
1997,2,,53,1.0,Y,,Shane Loux (minors),RHP,-1.5,16.0,1.0,0.0,0.0,0.0,58.0,4.0,7.0,5.94,1.62,0.0,HS,"Highland HS (Gilbert, AZ)",2
1996,2,,41,6.0,Y,,Matt Miller (minors),LHP,-0.4,0.0,0.0,0.0,,,15.0,0.0,0.0,7.84,2.42,0.0,4Yr,"Texas Tech University (Lubbock, TX)",2
1995,2,,41,11.0,Y,,Brian Powell (minors),RHP,-1.1,28.0,21.0,0.0,0.143,0.372,59.0,7.0,18.0,5.94,1.55,0.0,4Yr,"University of Georgia (Athens, GA)",2
1994,2,,52,18.0,Y,,Mike Darr (minors),OF,2.5,188.0,542.0,5.0,0.273,0.724,,,,,,,HS,"Corona HS (Corona, CA)",2
1993,2,,51,9.0,Y,,Tony Fuduric (minors),RHP,,,,,,,,,,,,,HS,"Cardinal HS (Middlefield, OH)",2
1992,2,,54,16.0,Y,,Yuri Sanchez (minors),SS,,,,,,,,,,,,,HS,"Lynn Vocational and Technical Institute (Lynn, MA)",2
1991,2,,59,15.0,Y,,Tarrik Brock (minors),OF,-0.1,13.0,12.0,0.0,0.167,0.542,,,,,,,HS,"Hawthorne HS (Hawthorne, CA)",2
1990,2,,59,19.0,N,,*Keith Grunewald (minors),SS,,,,,,,,,,,,,HS,"Walton HS (Marietta, GA)",2
1989,2,,51,21.0,Y,,Brad Wilson (minors),C,,,,,,,,,,,,,HS,"Towns County HS (Hiawassee, GA)",2
1988,2,,56,26.0,Y,,Scott Livingstone (minors),3B,2.3,673.0,1533.0,17.0,0.281,0.686,,,,,,,4Yr,"Texas A&M University (College Station, TX)",2
1987,2,,53,21.0,Y,,Rob Richie (minors),OF,0.0,19.0,49.0,1.0,0.265,0.823,,,,,,,4Yr,"University of Nevada, Reno (Reno, NV)",2
1986,2,,46,18.0,Y,,Milt Cuyler (minors),OF,5.4,490.0,1386.0,10.0,0.237,0.631,,,,,,,HS,"Southwest HS (Macon, GA)",2
1985,2,,54,26.0,Y,,Scott Carter (minors),RHP,,,,,,,,,,,,,HS,"Havelock HS (Havelock, NC)",2
1984,2,,52,24.0,Y,,Rob Souza (minors),RHP,,,,,,,,,,,,,4Yr,"University of Miami (Coral Gables, FL)",2
1983,2,,43,15.0,Y,,Rod Poissant (minors),RHP,,,,,,,,,,,,,HS,"Irvine HS (Irvine, CA)",2
1982,2,,48,20.0,N,,Scott Kamieniecki (minors),RHP,9.0,32.0,2.0,0.0,0.0,0.0,250.0,53.0,59.0,4.52,1.49,5.0,HS,"St. Mary's HS (Detroit, MI)",2
1981,2,,43,17.0,Y,,Nelson Simmons (minors),OF,0.0,100.0,330.0,11.0,0.261,0.728,,,,,,,HS,"Madison HS (San Diego, CA)",2
1980,2,,44,18.0,N,,Charles Reese (minors),SS,,,,,,,,,,,,,HS,"Pequannock Township HS (Pompton Plains, NJ)",2
1979,2,,39,13.0,Y,,Keith Fisher (minors),C,,,,,,,,,,,,,HS,"Apopka HS (Apopka, FL)",2
1978,2,,38,12.0,Y,,Craig Johnson (minors),OF,,,,,,,,,,,,,4Yr,"University of California, Los Angeles (Los Angeles, CA)",2
1977,2,,31,5.0,Y,,Jeffrey Jackowiak (minors),RHP,,,,,,,,,,,,,HS,"St. Joseph's HS (South Bend, IN)",2
1976,2,,26,2.0,Y,,Alan Trammell (minors),SS,70.6,2293.0,8288.0,185.0,0.285,0.767,,,,,,,HS,"Kearny HS (San Diego, CA)",2
1975,2,,27,3.0,Y,,John Murphy (minors),LHP,,,,,,,,,,,,,HS,"St. Francis Preparatory School (Queens, NY)",2
1974,2,,40,16.0,Y,,James Taylor (minors),LHP,,,,,,,,,,,,,HS,"Franklin County HS (Winchester, TN)",2
1973,2,,43,19.0,Y,,Kevin Slattery (minors),SS,,,,,,,,,,,,,HS,"Oceanside HS (Oceanside, NY)",2
1972,2,,44,20.0,Y,,John Valle (minors),3B,,,,,,,,,,,,,HS,"Holy Cross HS (Flushing, NY)",2
1971,2,,35,11.0,Y,,Dennis DeBarr (minors),LHP,-0.1,0.0,0.0,0.0,,,14.0,0.0,1.0,5.91,1.73,0.0,HS,"John F. Kennedy HS (Fremont, CA)",2
1970,2,,44,20.0,N,,Mike Ibarguen (minors),RHP,,,,,,,,,,,,,HS,"Sam Rayburn HS (Pasadena, TX)",2
1969,2,,43,19.0,Y,,Harry Kendrick (minors),C,,,,,,,,,,,,,4Yr,"Michigan State University (East Lansing, MI)",2
1968,2,,38,18.0,Y,,Bob Molinaro (minors),OF,0.9,401.0,803.0,14.0,0.264,0.699,,,,,,,HS,"Essex Catholic HS (Newark, NJ)",2
1967,2,,35,15.0,Y,,Robert Ware (minors),RHP,,,,,,,,,,,,,HS,"Huguenot HS (Richmond, VA)",2
1966,2,,34,14.0,N,,Scott Fields (minors),LHP,,,,,,,,,,,,,HS,"Elgin HS (Marion, OH)",2
1965,2,,33,13.0,N,,Douglas Carson (minors),SS,,,,,,,,,,,,,HS,"Bishop Armstrong HS (Sacramento, CA)",2
2023,3,,76,6.0,Y,"$1,697,500",Paul Wilson (minors),P,,,,,,,,,,,,,HS,"Lakeridge HS (Lake Oswego, OR)",3
2021,3,,74,3.0,Y,"$1,115,000",Dylan Smith (minors),P,,,,,,,,,,,,,4Yr,"University of Alabama (Tuscaloosa, AL)",3
2020,3,,73,1.0,Y,"$900,000",Trei Cruz (minors),SS,,,,,,,,,,,,,4Yr,"Rice University (Houston, TX)",3
2019,3,,83,5.0,Y,"$733,100",Andre Lipcius (minors),3B,-0.3,13.0,35.0,1.0,0.286,0.742,,,,,,,4Yr,"University of Tennessee (Knoxville, TN)",3
2018,3,,79,1.0,Y,"$600,000",Kody Clemens (minors),2B,-0.2,103.0,256.0,9.0,0.191,0.58,11.0,0.0,0.0,3.72,2.07,0.0,4Yr,"University of Texas at Austin (Austin, TX)",3
2017,3,,95,20.0,Y,"$564,000",Joey Morgan (minors),C,,,,,,,,,,,,,4Yr,"University of Washington (Seattle, WA)",3
2015,3,,99,24.0,Y,"$575,800",Drew Smith (minors),RHP,1.8,53.0,1.0,0.0,0.0,0.0,172.0,11.0,12.0,3.53,1.25,3.0,4Yr,"Dallas Baptist University (Dallas, TX)",3
2014,3,,99,25.0,Y,"$529,400",Grayson Greiner (minors),C,-0.9,139.0,433.0,9.0,0.201,0.583,,,,,,,4Yr,"University of South Carolina (Columbia, SC)",3
2013,3,,94,21.0,Y,"$549,400",Jeff Thompson (minors),RHP,,,,,,,,,,,,,4Yr,"University of Louisville (Louisville, KY)",3
2012,3,,121,26.0,Y,"$389,100",Austin Schotts (minors),CF,,,,,,,,,,,,,HS,"Centennial HS (Frisco, TX)",3
2011,3,,106,16.0,Y,"$310,000",Aaron Westlake (minors),1B,,,,,,,,,,,,,4Yr,"Vanderbilt University (Nashville, TN)",3
2010,3,,100,18.0,Y,"$330,300",Rob Brantly (minors),C,-1.5,134.0,414.0,7.0,0.225,0.613,1.0,0.0,0.0,9.0,1.0,0.0,4Yr,"University of California, Riverside (Riverside, CA)",3
2009,3,,89,9.0,Y,"$392,400",Wade Gaynor (minors),3B,,,,,,,,,,,,,4Yr,"Western Kentucky University (Bowling Green, KY)",3
2008,3,,99,22.0,Y,"$373,000",Scott Green (minors),RHP,,,,,,,,,,,,,4Yr,"University of Kentucky (Lexington, KY)",3
2007,3,,121,27.0,Y,"$236,000",Luke Putkonen (minors),RHP,0.5,5.0,0.0,0.0,,,44.0,1.0,5.0,4.66,1.53,1.0,4Yr,"University of North Carolina at Chapel Hill (Chapel Hill, NC)",3
2006,3,,82,6.0,Y,"$445,000",Brennan Boesch (minors),OF,0.7,481.0,1577.0,48.0,0.25,0.703,,,,,,,4Yr,"University of California, Berkeley (Berkeley, CA)",3
2005,3,,90,10.0,Y,"$422,000",Chris Robinson (minors),C,0.0,8.0,12.0,1.0,0.167,0.583,,,,,,,4Yr,"University of Illinois at Urbana-Champaign (Champaign, IL)",3
2004,3,,73,2.0,Y,"$500,000",Jeff Frazier (minors),OF,-0.1,9.0,23.0,0.0,0.217,0.511,,,,,,,4Yr,"Rutgers, the State University of New Jersey (New Brunswick, NJ)",3
2003,3,,70,3.0,Y,"$500,000",Tony Giarratano (minors),SS,-0.3,15.0,42.0,1.0,0.143,0.448,,,,,,,4Yr,"Tulane University (New Orleans, LA)",3
2002,3,,80,8.0,Y,"$469,000",Curtis Granderson (minors),OF,47.2,2057.0,7236.0,344.0,0.249,0.803,,,,,,,4Yr,"University of Illinois at Chicago (Chicago, IL)",3
2002,3,,87,15.0,Y,"$450,000",*Matt Pender (minors),RHP,,,,,,,,,,,,,4Yr,"Kennesaw State University (Kennesaw, GA)",3
2001,3,,87,11.0,Y,"$435,000",Jack Hannahan (minors),3B,6.3,614.0,1650.0,29.0,0.231,0.66,,,,,,,4Yr,"University of Minnesota (Minneapolis, MN)",3
2000,3,,78,8.0,Y,"$450,000",Nook Logan (minors),SS,3.0,321.0,870.0,2.0,0.268,0.66,,,,,,,JC,"Copiah-Lincoln Community College (Wesson, MS)",3
1999,3,,87,3.0,Y,"$900,000",Neil Jenkins (minors),3B,,,,,,,,,,,,,HS,"William T. Dwyer HS (Palm Beach Gardens, FL)",3
1998,3,,87,14.0,Y,"$400,000",Tommy Marx (minors),LHP,,,,,,,,,,,,,HS,"Brother Rice HS (Bloomfield Hills, MI)",3
1997,3,,85,1.0,Y,,Matt Boone (minors),3B,,,,,,,,,,,,,HS,"Villa Park HS (Villa Park, CA)",3
1996,3,,71,6.0,Y,,Antonio McKinney (minors),OF,,,,,,,,,,,,,HS,"Jefferson HS (Portland, OR)",3
1995,3,,70,11.0,N,,Chuck Crowder (minors),LHP,,,,,,,,,,,,,HS,"Crestwood HS (Mantua, OH)",3
1994,3,,81,18.0,Y,,Greg Whiteman (minors),LHP,,,,,,,,,,,,,4Yr,"James Madison University (Harrisonburg, VA)",3
1993,3,,81,9.0,Y,,Cam Smith (minors),RHP,,,,,,,,,,,,,,,3
1992,3,,84,16.0,Y,,Chris Gomez (minors),SS,-1.4,1515.0,4604.0,60.0,0.262,0.685,,,,,,,4Yr,"California State University, Long Beach (Long Beach, CA)",3
1991,3,,78,5.0,Y,,*Brian Edmondson (minors),RHP,-1.2,114.0,23.0,0.0,0.174,0.435,121.0,9.0,12.0,4.98,1.55,1.0,HS,"Norte Vista HS (Riverside, CA)",3
1991,3,,88,15.0,Y,,Justin Mashore (minors),OF,,,,,,,,,,,,,HS,"Clayton Valley Charter HS (Concord, CA)",3
1990,3,,75,2.0,Y,,Vince Bradford (minors),OF,,,,,,,,,,,,,HS,"Malvern HS (Malvern, AR)",3
1989,3,,81,21.0,Y,,Gino Tagliaferri (minors),SS,,,,,,,,,,,,,HS,"John F. Kennedy HS (Granada Hills, CA)",3
1988,3,,83,26.0,Y,,Tookie Spann (minors),OF,,,,,,,,,,,,,4Yr,"Tulane University (New Orleans, LA)",3
1987,3,,79,21.0,Y,,Jim Hayes (minors),RHP,,,,,,,,,,,,,,,3
1986,3,,73,18.0,Y,,Zack Doster (minors),OF,,,,,,,,,,,,,HS,"T. R. Robinson HS (Tampa, FL)",3
1985,3,,80,26.0,Y,,Steve Searcy (minors),LHP,-2.0,28.0,4.0,0.0,0.0,0.0,70.0,6.0,13.0,5.68,1.73,0.0,4Yr,"University of Tennessee (Knoxville, TN)",3
1984,3,,78,24.0,Y,,Marty Freeman (minors),OF,,,,,,,,,,,,,4Yr,"University of Maryland (College Park, MD)",3
1983,3,,69,15.0,Y,,Jeff Robinson (minors),RHP,1.4,10.0,11.0,0.0,0.091,0.182,141.0,47.0,40.0,4.79,1.44,0.0,4Yr,"Azusa Pacific University (Azusa, CA)",3
1982,3,,74,20.0,Y,,Colin Ward (minors),LHP,0.0,6.0,2.0,0.0,0.0,0.0,6.0,0.0,0.0,4.38,1.38,0.0,4Yr,"University of California, Los Angeles (Los Angeles, CA)",3
1981,3,,68,16.0,Y,,Bob Williamson (minors),C,,,,,,,,,,,,,HS,"Detroit Catholic Central HS (Novi, MI)",3
1980,3,,70,18.0,Unk,,Roberto Casasnovas (minors),OF,,,,,,,,,,,,,HS,"Mahwah HS (Mahwah, NJ)",3
1979,3,,65,13.0,Y,,Randy Harvey (minors),OF,,,,,,,,,,,,,HS,"Riverside Polytechnic HS (Riverside, CA)",3
1978,3,,64,12.0,N,,Fran Mullins (minors),SS,0.4,106.0,212.0,2.0,0.203,0.576,,,,,,,4Yr,"Santa Clara University (Santa Clara, CA)",3
1977,3,,57,5.0,Y,,Darrell Brown (minors),OF,0.0,210.0,591.0,1.0,0.274,0.629,,,,,,,4Yr,"California State University, Los Angeles (Los Angeles, CA)",3
1976,3,,50,2.0,Y,,Scott Johnson (minors),C,,,,,,,,,,,,,HS,"Bonita HS (La Verne, CA)",3
1975,3,,51,3.0,N,,Bob Grandas (minors),SS,,,,,,,,,,,,,HS,"Central HS (Flint, MI)",3
1974,3,,64,16.0,Y,,Stephen Viefhaus (minors),INF,,,,,,,,,,,,,JC,"St. Louis Community College, Meramec Campus (Kirkwood, MO)",3
1973,3,,67,19.0,Y,,Bob Adams (minors),3B,0.0,15.0,24.0,2.0,0.25,0.792,,,,,,,4Yr,"University of California, Los Angeles (Los Angeles, CA)",3
1972,3,,68,20.0,N,,Jim Gideon (minors),RHP,-0.2,0.0,0.0,0.0,,,1.0,0.0,0.0,7.94,2.12,0.0,HS,"Bellaire HS (Bellaire, TX)",3
1971,3,,59,11.0,Y,,Ben Hunt (minors),SS,,,,,,,,,,,,,HS,"Bel Air HS (El Paso, TX)",3
1970,3,,68,20.0,N,,James Chamberlain (minors),LHP,,,,,,,,,,,,,HS,"Ben L. Smith HS (Greensboro, NC)",3
1969,3,,67,19.0,Y,,Bill Gilbreth (minors),LHP,-0.9,11.0,12.0,0.0,0.167,0.333,14.0,2.0,1.0,6.69,1.82,0.0,4Yr,"Abilene Christian University (Abilene, TX)",3
1968,3,,58,18.0,Y,,Raymond Blosse (minors),RHP,,,,,,,,,,,,,4Yr,"High Point University (High Point, NC)",3
1967,3,,55,15.0,Y,,James Tanner (minors),OF,,,,,,,,,,,,,HS,"T. R. Robinson HS (Tampa, FL)",3
1966,3,,54,14.0,Y,,Robert Gilhooley (minors),INF,,,,,,,,,,,,,4Yr,"University of Michigan (Ann Arbor, MI)",3
1965,3,,53,13.0,N,,Andy Messersmith (minors),RHP,40.2,347.0,729.0,5.0,0.17,0.451,344.0,130.0,99.0,2.86,1.14,14.0,4Yr,"University of California, Berkeley (Berkeley, CA)",3
2023,4,,107,6.0,Y,"$772,500",Carson Rucker (minors),3B,,,,,,,,,,,,,HS,"Goodpasture Christian School (Madison, TN)",4
2022,4,,117,11.0,Y,"$517,900",Troy Melton (minors),P,,,,,,,,,,,,,4Yr,"San Diego State University (San Diego, CA)",4
2021,4,,104,3.0,Y,"$400,000",Tyler Mattison (minors),P,,,,,,,,,,,,,4Yr,"Bryant University (Smithfield, RI)",4
2020,4,,102,1.0,Y,"$1,000,000",Gage Workman (minors),3B,,,,,,,,,,,,,4Yr,"Arizona State University (Tempe, AZ)",4
2019,4,,112,5.0,Y,"$517,400",Ryan Kreidler (minors),SS,0.1,37.0,91.0,1.0,0.165,0.429,,,,,,,4Yr,"University of California, Los Angeles (Los Angeles, CA)",4
2018,4,,105,1.0,Y,"$900,000",Kingston Liniak (minors),CF,,,,,,,,,,,,,HS,"Mission Hills HS (San Marcos, CA)",4
2017,4,,125,20.0,Y,"$325,000",Gio Arriera (minors),RHP,,,,,,,,,,,,,JC,"Palm Beach State College (Lake Worth, FL)",4
2016,4,,115,9.0,Y,"$750,000",Kyle Funkhouser (minors),RHP,0.7,4.0,0.0,0.0,,,70.0,8.0,5.0,4.2,1.51,1.0,4Yr,"University of Louisville (Louisville, KY)",4
2015,4,,130,25.0,Y,"$200,000",Kade Scivicque (minors),C,,,,,,,,,,,,,4Yr,"Louisiana State University (Baton Rouge, LA)",4
2014,4,,130,25.0,Y,"$412,400",Adam Ravenelle (minors),RHP,,,,,,,,,,,,,4Yr,"Vanderbilt University (Nashville, TN)",4
2013,4,,126,20.0,Y,"$401,200",Austin Kubitza (minors),RHP,,,,,,,,,,,,,4Yr,"Rice University (Houston, TX)",4
2012,4,,154,26.0,Y,"$392,500",Drew VerHagen (minors),RHP,1.0,10.0,1.0,0.0,0.0,0.0,206.0,18.0,12.0,4.98,1.43,0.0,4Yr,"Vanderbilt University (Nashville, TN)",4
2011,4,,137,16.0,Y,"$195,300",Jason King (minors),3B,,,,,,,,,,,,,4Yr,"Kansas State University (Manhattan, KS)",4
2010,4,,133,18.0,N,,Cole Green (minors),RHP,,,,,,,,,,,,,4Yr,"University of Texas at Austin (Austin, TX)",4
2009,4,,120,9.0,Y,"$245,700",Edwin Gomez (minors),SS,,,,,,,,,,,,,HS,"Puerto Rico Baseball Academy (Gurabo, Puerto Rico)",4
2008,4,,133,21.0,Y,"$230,000",Brett Jacobson (minors),RHP,,,,,,,,,,,,,4Yr,"Vanderbilt University (Nashville, TN)",4
2007,4,,151,27.0,Y,"$153,000",Charlie Furbush (minors),LHP,1.3,21.0,0.0,0.0,,,247.0,13.0,24.0,3.97,1.19,1.0,4Yr,"Louisiana State University (Baton Rouge, LA)",4
2006,4,,112,6.0,Y,"$295,000",Ryan Strieby (minors),1B,,,,,,,,,,,,,4Yr,"University of Kentucky (Lexington, KY)",4
2005,4,,120,10.0,Y,"$265,000",Kevin Whelan (minors),RHP,-0.1,1.0,0.0,0.0,,,3.0,0.0,0.0,9.0,3.33,0.0,4Yr,"Texas A&M University (College Station, TX)",4
2004,4,,103,2.0,Y,"$375,000",Collin Mahoney (minors),RHP,,,,,,,,,,,,,4Yr,"Clemson University (Clemson, SC)",4
