Year,Rnd,DT,OvPck,RdPck,Signed,Bonus,Name,Pos,WAR,G,AB,HR,BA,OPS,G.1,W,L,ERA,WHIP,SV,Type,Drafted Out of,Round
2013,8,,246,20.0,Y,"$153,000",Zac Reininger (minors),RHP,-0.9,7.0,0.0,0.0,,,53.0,1.0,3.0,8.08,1.97,0.0,JC,"Hill College (Hillsboro, TX)",8
2012,8,,274,26.0,Y,"$35,000",Jeff McVaney (minors),LF,,,,,,,,,,,,,4Yr,"Texas State University (San Marcos, TX)",8
2011,8,,257,16.0,Y,"$50,000",Jason Krizan (minors),RF,0.0,3.0,8.0,0.0,0.125,0.425,,,,,,,4Yr,"Dallas Baptist University (Dallas, TX)",8
2010,8,,253,18.0,Y,"$125,000",Pat Leyland (minors),C,,,,,,,,,,,,,HS,"Bishop Canevin HS (Pittsburgh, PA)",8
2009,8,,240,9.0,N,,Craig Fritsch (minors),RHP,,,,,,,,,,,,,4Yr,"Baylor University (Waco, TX)",8
2008,8,,253,21.0,Y,"$35,000",Andy Dirks (minors),OF,3.7,297.0,971.0,24.0,0.276,0.745,,,,,,,4Yr,"Wichita State University (Wichita, KS)",8
2007,8,,271,27.0,Y,"$80,000",Emmanuel Miguelez (minors),LHP,,,,,,,,,,,,,4Yr,"University of Miami (Coral Gables, FL)",8
2006,8,,232,6.0,Y,"$25,000",Chris Cody (minors),LHP,,,,,,,,,,,,,4Yr,"Manhattan College (New York, NY)",8
2005,8,,240,10.0,Y,"$77,500",Brendan Wise (minors),RHP,,,,,,,,,,,,,JC,"Pratt Community College (Pratt, KS)",8
2004,8,,223,2.0,Y,"$92,000",Luke French (minors),LHP,0.1,1.0,1.0,0.0,0.0,0.0,31.0,9.0,12.0,4.99,1.5,0.0,HS,"Heritage HS (Littleton, CO)",8
2003,8,,220,3.0,N,,Michael Trent (minors),RHP,,,,,,,,,,,,,HS,"Ooltewah HS (Ooltewah, TN)",8
2002,8,,230,8.0,Y,,Troy Pickford (minors),RHP,,,,,,,,,,,,,4Yr,"Oral Roberts University (Tulsa, OK)",8
2001,8,,237,11.0,Y,,Don Kelly (minors),SS,-0.1,584.0,1098.0,23.0,0.23,0.628,1.0,0.0,0.0,0.0,0.0,0.0,4Yr,"Point Park University (Pittsburgh, PA)",8
2000,8,,228,8.0,Y,,Andy Warren (minors),RHP,,,,,,,,,,,,,4Yr,"Sam Houston State University (Huntsville, TX)",8
1999,8,,237,3.0,Y,,Anthony Ware (minors),3B,,,,,,,,,,,,,HS,"Hamilton HS (Los Angeles, CA)",8
1998,8,,237,14.0,Y,,Barry Tolli (minors),OF,,,,,,,,,,,,,HS,"Newbury Park HS (Thousand Oaks, CA)",8
1997,8,,235,1.0,Y,,Dan Lauterhahn (minors),2B,,,,,,,,,,,,,4Yr,"William Paterson University (Wayne, NJ)",8
1996,8,,221,6.0,Y,,Craig Quintal (minors),RHP,,,,,,,,,,,,,4Yr,"Southern University and A&M College (Baton Rouge, LA)",8
1995,8,,210,11.0,Y,,Scott Weaver (minors),OF,,,,,,,,,,,,,4Yr,"University of Michigan (Ann Arbor, MI)",8
1994,8,,221,18.0,Y,,Ryan Balfe (minors),SS,,,,,,,,,,,,,HS,"Cornwall Central HS (New Windsor, NY)",8
1993,8,,221,9.0,Y,,Drew Christmon (minors),OF,,,,,,,,,,,,,4Yr,"University of Oklahoma (Norman, OK)",8
1992,8,,224,16.0,N,,Dave Reinfelder (minors),LHP,,,,,,,,,,,,,HS,"Vassar HS (Vassar, MI)",8
1991,8,,218,15.0,Y,,Joe Perona (minors),C,,,,,,,,,,,,,4Yr,"Northwestern University (Evanston, IL)",8
1990,8,,211,3.0,Y,,Danny Rogers (minors),1B,,,,,,,,,,,,,4Yr,"Missouri Southern State University (Joplin, MO)",8
1989,8,,213,21.0,Y,,John DeSilva (minors),RHP,-0.2,3.0,0.0,0.0,,,6.0,1.0,0.0,7.2,1.6,0.0,4Yr,"Brigham Young University (Provo, UT)",8
1988,8,,213,26.0,Y,,Tom Aldrich (minors),SS,,,,,,,,,,,,,4Yr,"Bowdoin College (Brunswick, ME)",8
1987,8,,209,21.0,N,,Derek Lee (minors),INF,-0.5,15.0,33.0,0.0,0.152,0.358,,,,,,,4Yr,"University of South Florida (Tampa, FL)",8
1986,8,,203,18.0,Y,,Ron Marigny (minors),SS,,,,,,,,,,,,,4Yr,"Tulane University (New Orleans, LA)",8
1985,8,,210,26.0,Y,,Donny Rowland (minors),2B,,,,,,,,,,,,,4Yr,"University of Miami (Coral Gables, FL)",8
1984,8,,208,24.0,Y,,Gerald Phillion (minors),LHP,,,,,,,,,,,,,4Yr,"Central Michigan University (Mount Pleasant, MI)",8
1983,8,,199,15.0,N,,Rob Mallicoat (minors),LHP,-1.2,53.0,2.0,0.0,0.0,0.0,51.0,0.0,2.0,5.7,1.75,1.0,HS,"Hillsboro HS (Hillsboro, OR)",8
1982,8,,204,20.0,Y,,Jon Furman (minors),RHP,,,,,,,,,,,,,4Yr,"Pepperdine University (Malibu, CA)",8
1981,8,,198,17.0,Y,,Reggie Thomas (minors),OF,,,,,,,,,,,,,4Yr,"University of Arkansas (Fayetteville, AR)",8
1980,8,,199,18.0,Y,,Walter Poole (minors),C,,,,,,,,,,,,,4Yr,"University of the Pacific (Stockton, CA)",8
1979,8,,195,13.0,Y,,Vern Followell (minors),SS,,,,,,,,,,,,,4Yr,"University of California, Los Angeles (Los Angeles, CA)",8
1978,8,,194,12.0,Y,,Ted Hutson (minors),C,,,,,,,,,,,,,HS,"Miami East HS (Casstown, OH)",8
1977,8,,187,5.0,Y,,Kurt Hall (minors),C,,,,,,,,,,,,,HS,"Cape Elizabeth HS (Cape Elizabeth, ME)",8
1976,8,,170,2.0,Y,,Glenn Gulliver (minors),SS,0.6,73.0,192.0,1.0,0.203,0.626,,,,,,,4Yr,"Eastern Michigan University (Ypsilanti, MI)",8
1975,8,,171,3.0,N,,Stephen Powers (minors),RHP,,,,,,,,,,,,,4Yr,"University of Arizona (Tucson, AZ)",8
1974,8,,184,16.0,N,,Dan Morogiello (minors),LHP,1.2,0.0,0.0,0.0,,,22.0,0.0,1.0,2.39,1.3,1.0,HS,"Milford Academy (New Berlin, NY)",8
1973,8,,187,19.0,Y,,Elliott Moore (minors),LHP,,,,,,,,,,,,,4Yr,"Michigan State University (East Lansing, MI)",8
1972,8,,188,20.0,Y,,Nat Calamis (minors),SS,,,,,,,,,,,,,4Yr,"St. John's University (Queens, NY)",8
1971,8,,184,12.0,N,,David Bowden (minors),SS,,,,,,,,,,,,,HS,"Kathleen HS (Lakeland, FL)",8
1970,8,,193,21.0,Y,,John Knox (minors),2B,0.0,124.0,219.0,0.0,0.274,0.636,,,,,,,4Yr,"Bowling Green State University (Bowling Green, OH)",8
1969,8,,187,19.0,Y,,James Smith (minors),RHP,,,,,,,,,,,,,4Yr,"University of Connecticut (Storrs, CT)",8
1968,8,,174,18.0,N,,Ross Grimsley (minors),LHP,5.1,174.0,353.0,0.0,0.128,0.283,345.0,124.0,99.0,3.81,1.31,3.0,HS,"Frayser HS (Memphis, TN)",8
1967,8,,155,15.0,Y,,James Wosman (minors),C,,,,,,,,,,,,,HS,"Augustinian Academy HS (St. Louis, MO)",8
1966,8,,154,14.0,Y,,Michael Irish (minors),C,,,,,,,,,,,,,HS,"Grand Ledge HS (Grand Ledge, MI)",8
1965,8,,158,,Y,,Alex Bike (minors),C,,,,,,,,,,,,,HS,"Notre Dame HS (Bridgeport, CT)",8
2023,9,,260,6.0,Y,"$162,500",Hayden Minton (minors),P,,,,,,,,,,,,,4Yr,"Missouri State University (Springfield, MO)",9
2022,9,,267,11.0,Y,"$162,900",Andrew Jenkins (minors),1B,,,,,,,,,,,,,4Yr,"Georgia Institute of Technology (Atlanta, GA)",9
2021,9,,255,3.0,Y,"$160,800",Garrett Burhenn (minors),P,,,,,,,,,,,,,4Yr,"The Ohio State University (Columbus, OH)",9
2019,9,,262,5.0,Y,"$157,200",Austin Bergner (minors),P,,,,,,,,,,,,,4Yr,"University of North Carolina at Chapel Hill (Chapel Hill, NC)",9
2018,9,,255,1.0,Y,"$350,000",Tarik Skubal (minors),LHP,4.9,2.0,2.0,0.0,0.0,0.0,75.0,23.0,27.0,3.87,1.15,0.0,4Yr,"Seattle University (Seattle, WA)",9
2017,9,,275,20.0,Y,"$15,000",Luke Burch (minors),CF,,,,,,,,,,,,,4Yr,"Kent State University (Kent, OH)",9
2016,9,,265,9.0,Y,"$169,600",Daniel Pinero (minors),SS,,,,,,,,,,,,,4Yr,"University of Virginia (Charlottesville, VA)",9
2015,9,,280,25.0,Y,"$40,000",Trey Teakell (minors),RHP,,,,,,,,,,,,,4Yr,"Texas Christian University (Fort Worth, TX)",9
2014,9,,280,25.0,Y,"$143,000",Josh Laxer (minors),RHP,,,,,,,,,,,,,4Yr,"University of Mississippi (Oxford, MS)",9
2013,9,,276,20.0,Y,"$150,000",Will LaMarche (minors),RHP,,,,,,,,,,,,,4Yr,"Louisiana State University (Baton Rouge, LA)",9
2012,9,,304,26.0,Y,"$125,000",Jake Stewart (minors),CF,,,,,,,,,,,,,4Yr,"Stanford University (Palo Alto, CA)",9
2011,9,,287,16.0,Y,"$95,000",Chad Wright (minors),CF,,,,,,,,,,,,,4Yr,"University of Kentucky (Lexington, KY)",9
2010,9,,283,18.0,Y,"$35,000",Tony Plagman (minors),1B,,,,,,,,,,,,,4Yr,"Georgia Institute of Technology (Atlanta, GA)",9
2009,9,,270,9.0,Y,"$100,000",John Murrian (minors),C,,,,,,,,,,,,,4Yr,"Winthrop University (Rock Hill, SC)",9
2008,9,,283,21.0,Y,"$76,500",Anthony Shawler (minors),RHP,,,,,,,,,,,,,4Yr,"Old Dominion University (Norfolk, VA)",9
2007,9,,301,27.0,Y,,Justin Henry (minors),2B,,,,,,,,,,,,,4Yr,"University of Mississippi (Oxford, MS)",9
2006,9,,262,6.0,Y,"$80,000",Zach Piccola (minors),LHP,,,,,,,,,,,,,4Yr,"University of South Alabama (Mobile, AL)",9
2005,9,,270,10.0,N,,Paul Coleman (minors),LHP,,,,,,,,,,,,,4Yr,"Pepperdine University (Malibu, CA)",9
2004,9,,253,2.0,Y,"$62,500",Brandon Timm (minors),OF,,,,,,,,,,,,,HS,"Broken Arrow HS (Broken Arrow, OK)",9
2003,9,,250,3.0,Y,"$20,000",Eric Rodland (minors),2B,,,,,,,,,,,,,4Yr,"Gonzaga University (Spokane, WA)",9
2002,9,,260,8.0,Y,,Marcos Hernandez (minors),RHP,,,,,,,,,,,,,HS,"Juan Ponce De Leon HS (San Juan, Puerto Rico)",9
2001,9,,267,11.0,Y,,David Mattle (minors),OF,,,,,,,,,,,,,4Yr,"Kent State University (Kent, OH)",9
2000,9,,258,8.0,N,,Mike Hofius (minors),1B,,,,,,,,,,,,,HS,"Lakewood HS (Lakewood, CA)",9
1999,9,,267,3.0,Y,,Casey Rowe (minors),RHP,,,,,,,,,,,,,4Yr,"California State University, Fresno (Fresno, CA)",9
1998,9,,267,14.0,N,,Donny Sevieri (minors),OF,,,,,,,,,,,,,HS,"Eldorado HS (Albuquerque, NM)",9
1997,9,,265,1.0,N,,Bud Smith (minors),OF,-0.3,25.0,39.0,0.0,0.18,0.425,27.0,7.0,8.0,4.95,1.45,0.0,HS,"St. John Bosco HS (Bellflower, CA)",9
1996,9,,251,6.0,Y,,Keith Whitner (minors),OF,,,,,,,,,,,,,4Yr,"Los Angeles City College (Los Angeles, CA)",9
1995,9,,238,11.0,N,,Ron Marietta (minors),LHP,,,,,,,,,,,,,HS,"Bishop Ford Central Catholic HS (Brooklyn, NY)",9
1994,9,,249,18.0,Y,,Darryl Monroe (minors),OF,,,,,,,,,,,,,4Yr,"University of Kansas (Lawrence, KS)",9
1993,9,,249,9.0,Y,,Lonny Landry (minors),OF,,,,,,,,,,,,,4Yr,"Flagler College (St. Augustine, FL)",9
1992,9,,252,16.0,Y,,Mike Lopez (minors),RHP,,,,,,,,,,,,,4Yr,"University of Wyoming (Laramie, WY)",9
1991,9,,244,15.0,Y,,Clint Sodowsky (minors),RHP,-1.6,92.0,13.0,0.0,0.308,0.692,106.0,8.0,14.0,6.17,1.8,0.0,JC,"Connors State College (Warner, OK)",9
1990,9,,238,3.0,Y,,Greg Coppeta (minors),LHP,,,,,,,,,,,,,4Yr,"University of Southern Maine (Gorham, ME)",9
1989,9,,239,21.0,Y,,Kelley O'Neal (minors),2B,,,,,,,,,,,,,HS,"Belleville HS (Belleville, MI)",9
1988,9,,239,26.0,Y,,Kurt Knudsen (minors),RHP,-1.1,0.0,0.0,0.0,,,82.0,6.0,5.0,5.07,1.64,7.0,4Yr,"University of Miami (Coral Gables, FL)",9
1987,9,,235,21.0,Y,,Blaine Rudolph (minors),RHP,,,,,,,,,,,,,JC,"Fresno City College (Fresno, CA)",9
1986,9,,229,18.0,Y,,Wade Phillips (minors),RHP,,,,,,,,,,,,,4Yr,"University of Texas at Austin (Austin, TX)",9
1985,9,,236,26.0,Y,,Derek Bastinck (minors),C,,,,,,,,,,,,,4Yr,"Ramapo College (Mahwah, NJ)",9
1984,9,,234,24.0,Y,,Jeff Hermann (minors),1B,,,,,,,,,,,,,4Yr,"University of St. Francis (Joliet, IL)",9
1983,9,,225,15.0,Y,,Jim Walewander (minors),2B,-0.1,162.0,242.0,1.0,0.215,0.556,,,,,,,4Yr,"Iowa State University (Ames, IA)",9
1982,9,,230,20.0,Y,,Doug Baker (minors),SS,-0.5,136.0,246.0,0.0,0.207,0.537,,,,,,,4Yr,"Arizona State University (Tempe, AZ)",9
1981,9,,224,17.0,Y,,George Miguel (minors),LHP,,,,,,,,,,,,,HS,"William E. Grady Vocational Technical HS (Brooklyn, NY)",9
1980,9,,225,18.0,Y,,Homer Moncrief (minors),RHP,,,,,,,,,,,,,4Yr,"Jackson State University (Jackson, MS)",9
1979,9,,221,13.0,Y,,Michael Schoeller (minors),1B,,,,,,,,,,,,,4Yr,"Florida Southern College (Lakeland, FL)",9
1978,9,,220,12.0,Y,,Mike Wright (minors),OF,,,,,,,,,,,,,4Yr,"Vanderbilt University (Nashville, TN)",9
1977,9,,213,5.0,Y,,John Upshaw (minors),C,,,,,,,,,,,,,4Yr,"Emporia State University (Emporia, KS)",9
1976,9,,194,2.0,N,,Charles Farmer (minors),C,,,,,,,,,,,,,HS,"Hernando HS (Brooksville, FL)",9
1975,9,,195,3.0,N,,Andrew Lopez (minors),SS,,,,,,,,,,,,,4Yr,"University of California, Los Angeles (Los Angeles, CA)",9
1974,9,,208,16.0,N,,Jake Battle (minors),C,,,,,,,,,,,,,HS,"Western HS (Detroit, MI)",9
1973,9,,211,19.0,Y,,Joseph Simbolick (minors),C,,,,,,,,,,,,,HS,"Seymour HS (Seymour, CT)",9
1972,9,,212,20.0,Y,,Gary Stollar (minors),C,,,,,,,,,,,,,HS,"Westmoor HS (Daly City, CA)",9
1971,9,,209,12.0,Y,,Don Leslie (minors),RHP,,,,,,,,,,,,,HS,"Jefferson HS (Lafayette, IN)",9
1970,9,,218,21.0,Y,,Phil Mankowski (minors),3B,0.9,269.0,739.0,8.0,0.264,0.653,,,,,,,HS,"Bishop Turner HS (Buffalo, NY)",9
1969,9,,211,19.0,Y,,Mark Giegler (minors),SS,,,,,,,,,,,,,HS,"Milford HS (Highland, MI)",9
1968,9,,198,18.0,N,,John Hyde (minors),LHP,,,,,,,,,,,,,HS,"Loyola Academy (Wilmette, IL)",9
1967,9,,175,15.0,N,,Larry Fritz (minors),LHP,,1.0,1.0,0.0,0.0,0.0,,,,,,,HS,"Whiting HS (Whiting, IN)",9
1966,9,,174,14.0,Y,,Dan Bootcheck (minors),LHP,,,,,,,,,,,,,HS,"Michigan City HS (Michigan City, IN)",9
1965,9,,162,,N,,James Young (minors),LHP,,,,,,,,,,,,,HS,"Cherry Hill HS (Inkster, MI)",9
2023,10,,290,6.0,Y,"$167,800",Andrew Sears (minors),P,,,,,,,,,,,,,4Yr,"University of Connecticut (Storrs, CT)",10
2022,10,,297,11.0,Y,"$50,000",Trevin Michael (minors),P,,,,,,,,,,,,,4Yr,"University of Oklahoma (Norman, OK)",10
2021,10,,285,3.0,Y,"$148,900",Austin Schultz (minors),SS,,,,,,,,,,,,,4Yr,"University of Kentucky (Lexington, KY)",10
2019,10,,292,5.0,Y,"$147,000",Jake Holton (minors),1B,,,,,,,,,,,,,4Yr,"Creighton University (Omaha, NE)",10
2018,10,,285,1.0,Y,"$10,000",Brock Deatherage (minors),OF,,,,,,,,,,,,,4Yr,"North Carolina State University (Raleigh, NC)",10
2017,10,,305,20.0,Y,"$132,600",Garrett McCain (minors),CF,,,,,,,,,,,,,4Yr,"Oklahoma State University (Stillwater, OK)",10
2016,10,,295,9.0,Y,"$25,000",Sam Machonis (minors),RF,,,,,,,,,,,,,4Yr,"Florida Southern College (Lakeland, FL)",10
2015,10,,310,25.0,Y,"$30,000",Cole Bauml (minors),CF,,,,,,,,,,,,,4Yr,"Northern Kentucky University (Highland Heights, KY)",10
2014,10,,310,25.0,Y,"$137,600",Paul Voelker (minors),RHP,,,,,,,,,,,,,4Yr,"Dallas Baptist University (Dallas, TX)",10
2013,10,,306,20.0,Y,,Kasey Coffman (minors),CF,,,,,,,,,,,,,4Yr,"Arizona State University (Tempe, AZ)",10
2012,10,,334,26.0,Y,"$15,000",Charlie Gillies (minors),RHP,,,,,,,,,,,,,4Yr,"The Master's University (Santa Clarita, CA)",10
2011,10,,317,16.0,Y,"$40,000",Curt Casali (minors),C,6.6,502.0,1259.0,47.0,0.22,0.694,,,,,,,4Yr,"Vanderbilt University (Nashville, TN)",10
2010,10,,313,17.0,Y,"$90,000",Cole Nelson (minors),LHP,,,,,,,,,,,,,4Yr,"Auburn University (Auburn, AL)",10
2009,10,,300,9.0,Y,"$74,000",Christopher Sedon (minors),2B,,,,,,,,,,,,,4Yr,"University of Pittsburgh (Pittsburgh, PA)",10
2008,10,,313,21.0,Y,"$15,000",Robbie Weinhardt (minors),RHP,-1.0,0.0,0.0,0.0,,,30.0,2.0,2.0,6.39,1.68,0.0,4Yr,"Oklahoma State University (Stillwater, OK)",10
2007,10,,331,27.0,N,,Dominic De La Osa (minors),OF,,,,,,,,,,,,,4Yr,"Vanderbilt University (Nashville, TN)",10
2006,10,,292,6.0,Y,"$67,000",L.J. Gagnier (minors),RHP,,,,,,,,,,,,,4Yr,"California State University, Fullerton (Fullerton, CA)",10
2005,10,,300,10.0,Y,"$10,000",Kevin Ardoin (minors),RHP,,,,,,,,,,,,,4Yr,"University of Louisiana at Lafayette (Lafayette, LA)",10
2004,10,,283,2.0,Y,"$55,000",Cory Middleton (minors),SS,,,,,,,,,,,,,HS,"Escambia HS (Pensacola, FL)",10
2003,10,,280,3.0,N,,Sean Henry (minors),OF,,,,,,,,,,,,,HS,"Armijo HS (Fairfield, CA)",10
2002,10,,290,8.0,Y,,Luke Carlin (minors),C,0.5,56.0,140.0,3.0,0.179,0.549,,,,,,,4Yr,"Northeastern University (Boston, MA)",10
2001,10,,297,11.0,Y,,Vince Blue (minors),OF,,,,,,,,,,,,,HS,"Mirabeau B. Lamar HS (Houston, TX)",10
2000,10,,288,8.0,Y,,Lee Rodney (minors),RHP,,,,,,,,,,,,,4Yr,"Kennesaw State University (Kennesaw, GA)",10
1999,10,,297,3.0,Y,,Jerrod Fuell (minors),RHP,,,,,,,,,,,,,HS,"Palo Verde HS (Tucson, AZ)",10
1998,10,,297,14.0,Y,,Billy Rich (minors),OF,,,,,,,,,,,,,4Yr,"University of Connecticut (Storrs, CT)",10
1997,10,,295,1.0,Y,,Rick Roberts (minors),LHP,,,,,,,,,,,,,HS,"Forest Hills HS (Sidman, PA)",10
1996,10,,281,6.0,Y,,Justin Hazelton (minors),OF,,,,,,,,,,,,,HS,"Philipsburg-Osceola HS (Philipsburg, PA)",10
1995,10,,266,11.0,Y,,John Foran (minors),RHP,,,,,,,,,,,,,4Yr,"University of Central Florida (Orlando, FL)",10
1994,10,,277,18.0,N,,Ryan Kjos (minors),RHP,,,,,,,,,,,,,4Yr,"University of Texas at Austin (Austin, TX)",10
1993,10,,277,9.0,N,,R.A. Dickey (minors),RHP,23.7,137.0,267.0,0.0,0.169,0.364,400.0,120.0,118.0,4.04,1.3,2.0,HS,"Montgomery Bell Academy (Nashville, TN)",10
1992,10,,280,16.0,Y,,Frank Catalanotto (minors),2B,14.5,1265.0,3824.0,84.0,0.291,0.802,,,,,,,HS,"Smithtown East HS (St. James, NY)",10
1991,10,,270,15.0,Y,,Tom Gibson (minors),OF,,,,,,,,,,,,,JC,"Mission College (Santa Clara, CA)",10
1990,10,,265,3.0,N,,Roger Luce (minors),C,,,,,,,,,,,,,4Yr,"University of Texas at Austin (Austin, TX)",10
1989,10,,265,21.0,Y,,Jody Hurst (minors),OF,,,,,,,,,,,,,4Yr,"Mississippi State University (Mississippi State, MS)",10
1988,10,,265,26.0,Y,,Chris Gollehon (minors),RHP,,,,,,,,,,,,,HS,"Medical Lake HS (Medical Lake, WA)",10
1987,10,,261,21.0,Y,,Robert Shipman (minors),OF,,,,,,,,,,,,,HS,"Winter Haven HS (Winter Haven, FL)",10
1986,10,,255,18.0,Y,,Rusty Elsberry (minors),RHP,,,,,,,,,,,,,4Yr,"San Diego State University (San Diego, CA)",10
1985,10,,262,26.0,N,,Lou Frazier (minors),OF,0.4,309.0,548.0,1.0,0.252,0.628,,,,,,,JC,"Scottsdale Community College (Scottsdale, AZ)",10
1984,10,,260,24.0,Y,,John Roddy (minors),RHP,,,,,,,,,,,,,4Yr,"University of Southern California (Los Angeles, CA)",10
1983,10,,251,15.0,Y,,Dave McClure (minors),C,,,,,,,,,,,,,4Yr,"Wichita State University (Wichita, KS)",10
1982,10,,256,20.0,Y,,Walt Faber (minors),LHP,,,,,,,,,,,,,4Yr,"Western Michigan University (Kalamazoo, MI)",10
1981,10,,250,17.0,N,,David Flattery (minors),RHP,,,,,,,,,,,,,4Yr,"Iowa State University (Ames, IA)",10
1980,10,,251,18.0,Y,,Chuck Hensley (minors),LHP,0.2,11.0,0.0,0.0,,,11.0,0.0,0.0,2.45,0.95,1.0,4Yr,"University of California, Berkeley (Berkeley, CA)",10
1979,10,,247,13.0,N,,Winston Ficklin (minors),INF,,,,,,,,,,,,,HS,"El Cerrito HS (El Cerrito, CA)",10
1978,10,,246,12.0,Y,,James Simerly (minors),RHP,,,,,,,,,,,,,4Yr,"Chapman University (Orange, CA)",10
1977,10,,239,5.0,Y,,Michael Beecroft (minors),RHP,,,,,,,,,,,,,HS,"John F. Kennedy HS (Sacramento, CA)",10
1976,10,,218,2.0,Y,,Mike Burns (minors),RHP,,,,,,,,,,,,,4Yr,"Alma College (Alma, MI)",10
1975,10,,219,3.0,Y,,Vince Diaz (minors),C,,,,,,,,,,,,,HS,"Miami Jackson HS (Miami, FL)",10
1974,10,,232,16.0,Y,,Mark Fidrych (minors),RHP,11.3,1.0,0.0,0.0,,,58.0,29.0,19.0,3.1,1.2,0.0,HS,"Worcester Academy (Worcester, MA)",10
1973,10,,235,19.0,N,,Joe Carroll (minors),RHP,,,,,,,,,,,,,HS,"Will Rogers HS (Tulsa, OK)",10
1972,10,,236,20.0,Y,,Leon Roberts (minors),OF,12.1,900.0,2737.0,78.0,0.267,0.751,1.0,0.0,0.0,27.0,5.0,0.0,4Yr,"University of Michigan (Ann Arbor, MI)",10
1971,10,,234,12.0,N,,Frank Catalano (minors),OF,,,,,,,,,,,,,HS,"East Meadow HS (East Meadow, NY)",10
1970,10,,243,21.0,Y,,Fernando Arroyo (minors),RHP,5.0,0.0,0.0,0.0,,,121.0,24.0,37.0,4.44,1.4,0.0,HS,"Luther Burbank HS (Sacramento, CA)",10
1969,10,,235,19.0,Y,,Robert Service (minors),SS,,,,,,,,,,,,,HS,"Central HS (Ilion, NY)",10
1968,10,,222,18.0,Y,,Marv Lane (minors),OF,-0.1,90.0,179.0,3.0,0.207,0.609,,,,,,,HS,"Pershing HS (Detroit, MI)",10
1967,10,,195,15.0,N,,Mike Deniro (minors),3B,,,,,,,,,,,,,HS,"Chaney HS (Youngstown, OH)",10
1966,10,,194,14.0,Y,,Brian Cusino (minors),RHP,,,,,,,,,,,,,HS,"Monroe Catholic Central HS (Erie, MI)",10
1965,10,,163,,Y,,Gary Taylor (minors),RHP,-0.1,7.0,1.0,0.0,0.0,0.0,7.0,0.0,1.0,5.23,1.55,0.0,4Yr,"Central Michigan University (Mount Pleasant, MI)",10
