Year,Rnd,DT,OvPck,RdPck,Signed,Bonus,Name,Pos,WAR,G,AB,HR,BA,OPS,G.1,W,L,ERA,WHIP,SV,Type,Drafted Out of,Round
2003,4,,100,3.0,Y,"$300,000",Josh Rainwater (minors),RHP,,,,,,,,,,,,,HS,"DeRidder HS (DeRidder, LA)",4
2002,4,,110,8.0,Y,,Robbie Sovie (minors),OF,,,,,,,,,,,,,HS,"Stratford Academy (Macon, GA)",4
2001,4,,117,11.0,Y,,Mike Rabelo (minors),C,-0.4,86.0,278.0,4.0,0.234,0.612,,,,,,,4Yr,"University of Tampa (Tampa, FL)",4
2000,4,,108,8.0,Y,,Mark Woodyard (minors),RHP,0.2,0.0,0.0,0.0,,,3.0,0.0,0.0,1.5,0.67,0.0,4Yr,"Bethune-Cookman University (Daytona Beach, FL)",4
1999,4,,117,3.0,Y,,Cody Ross (minors),OF,13.5,1073.0,3453.0,132.0,0.262,0.768,1.0,0.0,0.0,0.0,1.0,0.0,HS,"Carlsbad HS (Carlsbad, NM)",4
1998,4,,117,14.0,Y,,Andres Torres (minors),OF,7.8,650.0,1910.0,32.0,0.242,0.699,,,,,,,JC,"Miami Dade College (Miami, FL)",4
1997,4,,115,1.0,Y,,Alan Webb (minors),LHP,,,,,,,,,,,,,HS,"Durango HS (Las Vegas, NV)",4
1996,4,,101,6.0,Y,,Kris Keller (minors),RHP,-0.1,0.0,0.0,0.0,,,1.0,0.0,0.0,27.0,5.0,0.0,HS,"Duncan U. Fletcher HS (Neptune Beach, FL)",4
1995,4,,98,11.0,Y,,Clay Bruner (minors),RHP,,,,,,,,,,,,,HS,"Weatherford HS (Weatherford, OK)",4
1994,4,,109,18.0,Y,,Trad Sobik (minors),RHP,,,,,,,,,,,,,HS,"Clearwater Central Catholic HS (Clearwater, FL)",4
1993,4,,109,9.0,Y,,Mike Wilson (minors),RHP,,,,,,,,,,,,,JC,"Blinn College (Brenham, TX)",4
1992,4,,112,16.0,Y,,Ken Carlyle (minors),RHP,,,,,,,,,,,,,4Yr,"University of Mississippi (Oxford, MS)",4
1991,4,,114,15.0,Y,,Sean Bergman (minors),RHP,0.6,139.0,133.0,3.0,0.113,0.323,196.0,39.0,47.0,5.28,1.58,0.0,4Yr,"Southern Illinois University Carbondale (Carbondale, IL)",4
1990,4,,103,4.0,Y,,Jimmy Alder (minors),3B,,,,,,,,,,,,,HS,"Dobyns-Bennett HS (Kingsport, TN)",4
1989,4,,108,22.0,N,,Paul Carey (minors),OF,-0.7,18.0,47.0,0.0,0.213,0.523,,,,,,,4Yr,"Stanford University (Palo Alto, CA)",4
1988,4,,109,26.0,Y,,Lance Shebelut (minors),1B,,,,,,,,,,,,,4Yr,"California State University, Fresno (Fresno, CA)",4
1987,4,,105,21.0,Y,,Riccardo Ingram (minors),OF,-0.6,16.0,31.0,0.0,0.194,0.451,,,,,,,4Yr,"Georgia Institute of Technology (Atlanta, GA)",4
1986,4,,99,18.0,Y,,Bill Bean (minors),OF,-2.0,272.0,478.0,5.0,0.226,0.574,,,,,,,4Yr,"Loyola Marymount University (Los Angeles, CA)",4
1985,4,,106,26.0,Y,,Rob Friesen (minors),RHP,,,,,,,,,,,,,HS,"Meridian HS (Meridian, ID)",4
1984,4,,104,24.0,Y,,Mike Henneman (minors),RHP,12.9,39.0,1.0,0.0,0.0,0.0,561.0,57.0,42.0,3.21,1.31,193.0,4Yr,"Oklahoma State University (Stillwater, OK)",4
1983,4,,95,15.0,Y,,Alan Dunn (minors),RHP,,,,,,,,,,,,,4Yr,"University of Alabama (Tuscaloosa, AL)",4
1982,4,,100,20.0,Y,,Marc Washington (minors),OF,,,,,,,,,,,,,HS,"Northwestern HS (Detroit, MI)",4
1981,4,,94,17.0,Y,,Bubby Brister (minors),SS,,,,,,,,,,,,,HS,"Neville HS (Monroe, LA)",4
1980,4,,95,18.0,N,,Bob Sebra (minors),RHP,1.0,78.0,96.0,0.0,0.146,0.355,94.0,15.0,29.0,4.71,1.48,1.0,HS,"Gloucester Catholic HS (Gloucester City, NJ)",4
1979,4,,91,13.0,Y,,Luis Sanchez (minors),RHP,,,,,,,,,,,,,HS,"Monsignor Edward Pace HS (Miami Gardens, FL)",4
1978,4,,90,12.0,Y,,Jerry Ujdur (minors),RHP,-0.6,0.0,0.0,0.0,,,53.0,12.0,16.0,4.78,1.44,0.0,4Yr,"University of Minnesota (Minneapolis, MN)",4
1977,4,,83,5.0,N,,Mark McKinney (minors),OF,,,,,,,,,,,,,HS,"Tennessee HS (Bristol, TN)",4
1976,4,,74,2.0,Y,,Dan Petry (minors),RHP,17.1,13.0,5.0,0.0,0.2,0.4,370.0,125.0,104.0,3.95,1.36,1.0,HS,"El Dorado HS (Placentia, CA)",4
1975,4,,75,3.0,Y,,Jason Thompson (minors),LHP,25.0,1418.0,4802.0,208.0,0.261,0.804,,,,,,,4Yr,"California State University, Northridge (Los Angeles, CA)",4
1974,4,,88,16.0,Y,,Mel Jackson (minors),SS,,,,,,,,,,,,,4Yr,"LeMoyne-Owen College (Memphis, TN)",4
1973,4,,91,19.0,Y,,Robert Trudo (minors),OF,,,,,,,,,,,,,HS,"Brookfield HS (Masury, OH)",4
1972,4,,92,20.0,Y,,Dan Meyer (minors),2B,-6.4,1118.0,3734.0,86.0,0.253,0.673,,,,,,,JC,"Santa Ana College (Santa Ana, CA)",4
1971,4,,84,12.0,Y,,Ramon Gimenez (minors),C,,,,,,,,,,,,,JC,"New York City College of Technology (Brooklyn, NY)",4
1970,4,,93,21.0,Y,,Daniel Grant (minors),C,,,,,,,,,,,,,HS,"Westchester HS (Los Angeles, CA)",4
1969,4,,91,19.0,Y,,James Newhook (minors),OF,,,,,,,,,,,,,HS,"St. Helena HS (Bronx, NY)",4
1968,4,,78,18.0,Y,,Thomas Castellar (minors),RHP,,,,,,,,,,,,,HS,"John F. Kennedy HS (Taylor, MI)",4
1967,4,,75,15.0,Y,,Leslie Tanona (minors),OF,,,,,,,,,,,,,4Yr,"University of Michigan (Ann Arbor, MI)",4
1966,4,,74,14.0,Y,,Les Cain (minors),LHP,2.0,69.0,137.0,2.0,0.153,0.385,68.0,23.0,19.0,3.98,1.49,0.0,HS,"El Cerrito HS (El Cerrito, CA)",4
1965,4,,71,11.0,N,,Bob Reed (minors),RHP,0.7,25.0,14.0,0.0,0.143,0.343,24.0,2.0,4.0,4.13,1.39,2.0,4Yr,"University of Michigan (Ann Arbor, MI)",4
2023,5,,143,6.0,Y,"$397,500",Jaden Hamm (minors),P,,,,,,,,,,,,,4Yr,"Middle Tennessee State University (Murfreesboro, TN)",5
2022,5,,147,11.0,Y,"$386,900",Luke Gold (minors),3B,,,,,,,,,,,,,4Yr,"Boston College (Chestnut Hill, MA)",5
2021,5,,135,3.0,Y,"$400,000",Tanner Kohlhepp (minors),P,,,,,,,,,,,,,4Yr,"University of Notre Dame (South Bend, IN)",5
2020,5,,132,1.0,Y,"$500,000",Colt Keith (minors),3B,,,,,,,,,,,,,HS,"Biloxi HS (Biloxi, MS)",5
2019,5,,142,5.0,Y,"$386,600",Bryant Packard (minors),LF,,,,,,,,,,,,,4Yr,"East Carolina University (Greenville, NC)",5
2018,5,,135,1.0,Y,"$398,300",Adam Wolf (minors),LHP,,,,,,,,,,,,,4Yr,"University of Louisville (Louisville, KY)",5
2017,5,,155,20.0,Y,"$1,000,000",Sam McMillan (minors),C,,,,,,,,,,,,,HS,"Suwannee HS (Live Oak, FL)",5
2016,5,,145,9.0,Y,"$386,500",Mark Ecker (minors),RHP,,,,,,,,,,,,,4Yr,"Texas A&M University (College Station, TX)",5
2015,5,,160,25.0,Y,"$319,700",Cam Gibson (minors),CF,,,,,,,,,,,,,4Yr,"Michigan State University (East Lansing, MI)",5
2014,5,,160,25.0,Y,"$393,900",Shane Zeile (minors),C,,,,,,,,,,,,,4Yr,"University of California, Los Angeles (Los Angeles, CA)",5
2013,5,,156,20.0,Y,"$225,000",Buck Farmer (minors),RHP,2.7,12.0,4.0,0.0,0.25,0.5,356.0,21.0,28.0,4.98,1.43,5.0,4Yr,"Georgia Institute of Technology (Atlanta, GA)",5
2012,5,,184,26.0,Y,"$211,900",Joe Rogers (minors),LHP,,,,,,,,,,,,,4Yr,"University of Central Florida (Orlando, FL)",5
2011,5,,167,16.0,Y,"$212,000",Brandon Loy (minors),SS,,,,,,,,,,,,,4Yr,"University of Texas at Austin (Austin, TX)",5
2010,5,,163,18.0,Y,"$152,100",Alex Burgos (minors),LHP,,,,,,,,,,,,,JC,"State College of Florida, Manatee-Sarasota (Bradenton, FL)",5
2009,5,,150,9.0,Y,"$100,000",Austin Wood (minors),LHP,,,,,,,,,,,,,4Yr,"University of Texas at Austin (Austin, TX)",5
2008,5,,163,21.0,Y,"$169,000",Alex Avila (minors),C,17.1,1052.0,3060.0,105.0,0.233,0.741,3.0,0.0,0.0,2.25,1.0,0.0,4Yr,"University of Alabama (Tuscaloosa, AL)",5
2007,5,,181,27.0,Y,"$748,500",Casey Crosby (minors),LHP,-0.4,0.0,0.0,0.0,,,3.0,1.0,1.0,9.49,2.11,0.0,HS,"Kaneland HS (Maple Park, IL)",5
2006,5,,142,6.0,Y,"$197,500",Scott Sizemore (minors),2B,0.7,166.0,533.0,14.0,0.24,0.71,,,,,,,4Yr,"Virginia Commonwealth University (Richmond, VA)",5
2005,5,,150,10.0,Y,"$220,000",Jeff Larish (minors),1B,-0.6,101.0,245.0,8.0,0.225,0.688,,,,,,,4Yr,"Arizona State University (Tempe, AZ)",5
2004,5,,133,2.0,Y,"$224,500",Andrew Kown (minors),RHP,,,,,,,,,,,,,4Yr,"Georgia Institute of Technology (Atlanta, GA)",5
2003,5,,130,3.0,Y,"$210,000",Danny Zell (minors),LHP,,,,,,,,,,,,,4Yr,"University of Houston (Houston, TX)",5
2002,5,,140,8.0,Y,,Bo Flowers (minors),OF,,,,,,,,,,,,,HS,"Walther Lutheran HS (Melrose Park, IL)",5
2001,5,,147,11.0,Y,,Ryan Raburn (minors),3B,3.3,946.0,2472.0,93.0,0.253,0.752,2.0,0.0,0.0,0.0,1.2,0.0,JC,"South Florida State College (Avon Park, FL)",5
2000,5,,138,8.0,Y,,Miles Durham (minors),OF,,,,,,,,,,,,,4Yr,"Texas Tech University (Lubbock, TX)",5
1999,5,,147,3.0,Y,,Dayle Campbell (minors),OF,,,,,,,,,,,,,JC,"Los Angeles Pierce College (Woodland Hills, CA)",5
1998,5,,147,14.0,Y,,Gregory Peterson (minors),RHP,,,,,,,,,,,,,4Yr,"St. John's University (Queens, NY)",5
1997,5,,145,1.0,Y,,Heath Schesser (minors),SS,,,,,,,,,,,,,4Yr,"Kansas State University (Manhattan, KS)",5
1996,5,,131,6.0,Y,,Robert Fick (minors),C,2.2,846.0,2373.0,69.0,0.258,0.732,,,,,,,4Yr,"California State University, Northridge (Los Angeles, CA)",5
1995,5,,126,11.0,Y,,Rosario Ortiz (minors),RHP,,,,,,,,,,,,,JC,"Arizona Western College (Yuma, AZ)",5
1994,5,,137,18.0,Y,,Keith Smith (minors),OF,,,,,,,,,,,,,HS,"Newbury Park HS (Thousand Oaks, CA)",5
1993,5,,137,9.0,Y,,Jayson Bass (minors),OF,,,,,,,,,,,,,HS,"O'Dea HS (Seattle, WA)",5
1992,5,,140,16.0,Y,,David Mysel (minors),RHP,,,,,,,,,,,,,4Yr,"University of Maryland (College Park, MD)",5
1991,5,,140,15.0,Y,,Paul Megrini (minors),RHP,,,,,,,,,,,,,HS,"Wallington HS (Wallington, NJ)",5
1990,5,,130,3.0,Y,,Shannon Withem (minors),RHP,0.0,0.0,0.0,0.0,,,1.0,0.0,0.0,3.0,1.67,0.0,HS,"Willow Run HS (Ypsilanti, MI)",5
1989,5,,135,22.0,Y,,Dave Keating (minors),OF,,,,,,,,,,,,,4Yr,"University of California, Los Angeles (Los Angeles, CA)",5
1988,5,,135,26.0,Y,,Mike Lumley (minors),RHP,,,,,,,,,,,,,4Yr,"Eastern Michigan University (Ypsilanti, MI)",5
1987,5,,131,21.0,Y,,Torey Lovullo (minors),2B,-0.9,303.0,737.0,15.0,0.224,0.636,,,,,,,4Yr,"University of California, Los Angeles (Los Angeles, CA)",5
1986,5,,125,18.0,Y,,Pat Austin (minors),SS,,,,,,,,,,,,,4Yr,"Wilmington College (Wilmington, OH)",5
1985,5,,132,26.0,Y,,Gerry Wetherell (minors),RHP,,,,,,,,,,,,,4Yr,"Mount Vernon Nazarene University (Mount Vernon, OH)",5
1984,5,,130,24.0,Unk,,Al Labozzetta (minors),LHP,,,,,,,,,,,,,4Yr,"New York Institute of Technology (Old Westbury, NY)",5
1983,5,,121,15.0,Y,,Billy Hinz (minors),RHP,,,,,,,,,,,,,4Yr,"University of Oklahoma (Norman, OK)",5
1982,5,,126,20.0,Y,,Benny Ruiz (minors),SS,,,,,,,,,,,,,4Yr,"Midwestern State University (Wichita Falls, TX)",5
1981,5,,120,17.0,Y,,Stan Barker (minors),OF,,,,,,,,,,,,,4Yr,"Alcorn State University (Lorman, MS)",5
1980,5,,121,18.0,Y,,Lawrence Gilmore (minors),1B,,,,,,,,,,,,,HS,"West Covina HS (West Covina, CA)",5
1979,5,,117,13.0,Y,,Jon Driver (minors),C,,,,,,,,,,,,,HS,"Shelby County HS (Shelbyville, KY)",5
1978,5,,116,12.0,Y,,Marty Castillo (minors),3B,-0.9,201.0,352.0,8.0,0.19,0.532,,,,,,,4Yr,"Chapman University (Orange, CA)",5
1977,5,,109,5.0,Y,,Donald Taylor (minors),3B,,,,,,,,,,,,,HS,"Fair Park HS (Shreveport, LA)",5
1976,5,,98,2.0,Y,,Jack Morris (minors),RHP,43.5,23.0,1.0,0.0,0.0,0.0,549.0,254.0,186.0,3.9,1.3,0.0,4Yr,"Brigham Young University (Provo, UT)",5
1975,5,,99,3.0,Y,,Lou Whitaker (minors),3B,75.1,2390.0,8570.0,244.0,0.276,0.789,,,,,,,HS,"Martinsville HS (Martinsville, VA)",5
1974,5,,112,16.0,Y,,Ronald Martinez (minors),OF,,,,,,,,,,,,,HS,"Buena HS (Ventura, CA)",5
1973,5,,115,19.0,Y,,Mike Elders (minors),RHP,,,,,,,,,,,,,HS,"Clay HS (Oregon, OH)",5
1972,5,,116,20.0,Y,,James Murray (minors),LHP,,,,,,,,,,,,,HS,"St. Mary's of Redford HS (Detroit, MI)",5
1971,5,,109,12.0,Y,,Billy Michael (minors),OF,,,,,,,,,,,,,HS,"Jackson HS (Charleston, WV)",5
1970,5,,118,21.0,Y,,Thomas Lantz (minors),RHP,,,,,,,,,,,,,HS,"Akron East HS (Akron, OH)",5
1969,5,,115,19.0,Y,,Donald Hether (minors),SS,,,,,,,,,,,,,,,5
1968,5,,102,18.0,N,,Thomas Miller (minors),OF,,,,,,,,,,,,,HS,"Reading HS (Reading, PA)",5
1967,5,,95,15.0,Y,,Paul Jata (minors),C,-0.2,32.0,74.0,0.0,0.23,0.553,,,,,,,HS,"Long Island City HS (Long Island City, NY)",5
1966,5,,94,14.0,Y,,Eugene Spatz (minors),3B,,,,,,,,,,,,,HS,"Alexander Hamilton HS (Elmsford, NY)",5
1965,5,,91,11.0,Y,,Thomas White (minors),3B,,,,,,,,,,,,,HS,"Paul M. Dorman HS (Roebuck, SC)",5
2023,6,,170,6.0,Y,"$297,500",Bennett Lee (minors),C,,,,,,,,,,,,,4Yr,"Wake Forest University (Winston-Salem, NC)",6
2022,6,,177,11.0,Y,"$293,900",Danny Serretti (minors),SS,,,,,,,,,,,,,4Yr,"University of North Carolina at Chapel Hill (Chapel Hill, NC)",6
2021,6,,165,3.0,Y,"$200,000",Austin Murr (minors),1B,,,,,,,,,,,,,4Yr,"North Carolina State University (Raleigh, NC)",6
2019,6,,172,5.0,Y,"$291,400",Cooper Johnson (minors),C,,,,,,,,,,,,,4Yr,"University of Mississippi (Oxford, MS)",6
2018,6,,165,1.0,Y,"$300,000",Hugh Smith (minors),RHP,,,,,,,,,,,,,4Yr,"Whitworth University (Spokane, WA)",6
2017,6,,185,20.0,Y,"$241,600",Dane Myers (minors),RHP,-0.3,22.0,67.0,1.0,0.269,0.644,,,,,,,4Yr,"Rice University (Houston, TX)",6
2016,6,,175,9.0,Y,"$289,400",Bryan Garcia (minors),RHP,-0.4,0.0,0.0,0.0,,,76.0,7.0,3.0,5.52,1.58,6.0,4Yr,"University of Miami (Coral Gables, FL)",6
2015,6,,190,25.0,Y,"$239,400",Matt Hall (minors),LHP,-1.9,1.0,0.0,0.0,,,25.0,0.0,4.0,11.48,2.3,0.0,4Yr,"Missouri State University (Springfield, MO)",6
2014,6,,190,25.0,Y,"$110,000",Ross Kivett (minors),CF,,,,,,,,,,,,,4Yr,"Kansas State University (Manhattan, KS)",6
2013,6,,186,20.0,Y,"$60,000",Calvin Drummond (minors),RHP,,,,,,,,,,,,,4Yr,"Arizona Christian University (Phoenix, AZ)",6
2012,6,,214,26.0,Y,"$135,000",Jordan John (minors),LHP,,,,,,,,,,,,,4Yr,"University of Oklahoma (Norman, OK)",6
2011,6,,197,16.0,Y,"$210,000",Tyler Collins (minors),OF,-0.5,183.0,502.0,14.0,0.235,0.68,,,,,,,JC,"Howard College (Big Spring, TX)",6
2010,6,,193,18.0,Y,"$115,000",Bryan Holaday (minors),C,0.1,301.0,733.0,10.0,0.236,0.613,6.0,0.0,0.0,7.2,1.6,0.0,4Yr,"Texas Christian University (Fort Worth, TX)",6
2009,6,,180,9.0,Y,"$1,625,000",Daniel Fields (minors),SS,-0.1,1.0,3.0,0.0,0.333,1.0,,,,,,,HS,"University of Detroit Jesuit HS (Detroit, MI)",6
2008,6,,193,21.0,Y,"$150,000",Tyler Stohr (minors),RHP,,,,,,,,,,,,,4Yr,"University of North Florida (Jacksonville, FL)",6
2007,6,,211,27.0,Y,"$1,497,500",Cale Iorg (minors),SS,,,,,,,,,,,,,4Yr,"University of Alabama (Tuscaloosa, AL)",6
2006,6,,172,6.0,Y,"$155,000",Jordan Newton (minors),C,,,,,,,,,,,,,4Yr,"Western Kentucky University (Bowling Green, KY)",6
2005,6,,180,10.0,Y,"$150,000",Clete Thomas (minors),OF,1.4,249.0,709.0,13.0,0.233,0.664,,,,,,,4Yr,"Auburn University (Auburn, AL)",6
2004,6,,163,2.0,Y,"$160,000",Brent Dlugach (minors),SS,0.0,5.0,3.0,0.0,0.0,0.0,,,,,,,4Yr,"University of Memphis (Memphis, TN)",6
2003,6,,160,3.0,Y,"$200,000",Cody Collet (minors),C,,,,,,,,,,,,,HS,"Newbury Park HS (Thousand Oaks, CA)",6
2002,6,,170,8.0,Y,,Chris Maples (minors),RHP,,,,,,,,,,,,,4Yr,"University of North Carolina at Chapel Hill (Chapel Hill, NC)",6
2001,6,,177,11.0,Y,,Jason Knoedler (minors),OF,,,,,,,,,,,,,4Yr,"Miami University of Ohio (Oxford, OH)",6
2000,6,,168,8.0,Y,,Matt Parris (minors),RHP,,,,,,,,,,,,,HS,"Highland HS (Palmdale, CA)",6
1999,6,,177,3.0,Y,,Brant Ust (minors),3B,,,,,,,,,,,,,4Yr,"University of Notre Dame (South Bend, IN)",6
1998,6,,177,14.0,Y,,Bobby Sismondo (minors),LHP,,,,,,,,,,,,,4Yr,"Ohio University (Athens, OH)",6
1997,6,,175,1.0,Y,,Chris Parker (minors),C,,,,,,,,,,,,,HS,"Westlake HS (Westlake Village, CA)",6
1996,6,,161,6.0,Y,,Chris Bauer (minors),RHP,,,,,,,,,,,,,4Yr,"Wichita State University (Wichita, KS)",6
1995,6,,154,11.0,Y,,Jeremiah Lignitz (minors),C,,,,,,,,,,,,,HS,"Davison HS (Davison, MI)",6
1994,6,,165,18.0,Y,,Dave Kauflin (minors),RHP,,,,,,,,,,,,,HS,"Chippewa Valley HS (Mount Clemens, MI)",6
1993,6,,165,9.0,Y,,Brian Moehler (minors),RHP,10.8,201.0,202.0,0.0,0.045,0.153,332.0,84.0,107.0,4.81,1.46,1.0,4Yr,"University of North Carolina at Greensboro (Greensboro, NC)",6
1992,6,,168,16.0,Y,,Malvin DeJesus (minors),SS,,,,,,,,,,,,,4Yr,"William Penn University (Oskaloosa, IA)",6
1991,6,,166,15.0,Y,,Jason Pfaff (minors),RHP,,,,,,,,,,,,,4Yr,"University of Michigan (Ann Arbor, MI)",6
1990,6,,157,3.0,Y,,Steve Wolf (minors),RHP,,,,,,,,,,,,,4Yr,"California State University, Fresno (Fresno, CA)",6
1989,6,,161,21.0,N,,Doug Mirabelli (minors),C,4.8,566.0,1456.0,58.0,0.232,0.724,,,,,,,HS,"Valley HS (Las Vegas, NV)",6
1988,6,,161,26.0,Y,,Eric Stone (minors),RHP,,,,,,,,,,,,,4Yr,"University of Texas at Austin (Austin, TX)",6
1987,6,,157,21.0,Y,,Dean Decillis (minors),INF,,,,,,,,,,,,,4Yr,"Miami Dade College, Kendall Campus (Miami, FL)",6
1986,6,,151,18.0,Y,,Rich Lacko (minors),RHP,,,,,,,,,,,,,4Yr,"Long Island University, Brooklyn Campus (Brooklyn, NY)",6
1985,6,,158,26.0,Y,,Scott Lusader (minors),OF,-0.1,135.0,260.0,5.0,0.246,0.659,,,,,,,4Yr,"University of Florida (Gainesville, FL)",6
1984,6,,156,24.0,Y,,Steve Eagar (minors),C,,,,,,,,,,,,,4Yr,"Brigham Young University (Provo, UT)",6
1983,6,,147,15.0,Y,,Rob Baker (minors),OF,,,,,,,,,,,,,4Yr,"Indiana State University (Terre Haute, IN)",6
1982,6,,152,20.0,Y,,Chris Pittaro (minors),SS,-0.3,53.0,95.0,0.0,0.221,0.541,,,,,,,4Yr,"University of North Carolina at Chapel Hill (Chapel Hill, NC)",6
1981,6,,146,17.0,Y,,Bryan Kelly (minors),RHP,0.0,0.0,0.0,0.0,,,11.0,1.0,3.0,4.7,1.63,0.0,4Yr,"University of Alabama (Tuscaloosa, AL)",6
1980,6,,147,18.0,Y,,Mark Smith (minors),OF,,,,,,,,,,,,,HS,"Fairfield HS (Fairfield, CT)",6
1979,6,,143,13.0,N,,David Arnold (minors),SS,,,,,,,,,,,,,HS,"La Habra HS (La Habra, CA)",6
1978,6,,142,12.0,N,,Kevin Martin (minors),SS,,,,,,,,,,,,,HS,"Falconer Central HS (Falconer, NY)",6
1977,6,,135,5.0,Y,,Dave Steffen (minors),RHP,,,,,,,,,,,,,HS,"Flat Rock HS (Flat Rock, MI)",6
1976,6,,122,2.0,Y,,Lawrence Douglas (minors),SS,,,,,,,,,,,,,HS,"Salem HS (Salem, NH)",6
1975,6,,123,3.0,Y,,Jeff Reinke (minors),LHP,,,,,,,,,,,,,4Yr,"University of Southern California (Los Angeles, CA)",6
1974,6,,136,16.0,N,,William Poland (minors),LHP,,,,,,,,,,,,,HS,"Crescenta Valley HS (La Crescenta, CA)",6
1973,6,,139,19.0,Y,,Greg Shippy (minors),C,,,,,,,,,,,,,HS,"Garrett HS (Garrett, IN)",6
1972,6,,140,20.0,N,,Jeffrey Potter (minors),LHP,,,,,,,,,,,,,HS,"Lincoln HS (Ellwood City, PA)",6
1971,6,,134,12.0,Y,,Jeff Natchez (minors),OF,,,,,,,,,,,,,HS,"Southwestern HS (Flint, MI)",6
1970,6,,143,21.0,Y,,Alan Locasio (minors),C,,,,,,,,,,,,,4Yr,"St. Francis University (Brooklyn, NY)",6
1969,6,,139,19.0,Y,,Lerrin LaGrow (minors),RHP,4.3,91.0,13.0,0.0,0.154,0.308,309.0,34.0,55.0,4.11,1.45,54.0,4Yr,"Arizona State University (Tempe, AZ)",6
1968,6,,126,18.0,Y,,Frank Fisher (minors),RHP,,,,,,,,,,,,,HS,"Wayne Memorial HS (Wayne, MI)",6
1967,6,,115,15.0,Y,,Dennis Saunders (minors),RHP,0.3,8.0,5.0,0.0,0.0,0.0,8.0,1.0,1.0,3.21,1.5,1.0,HS,"Pioneer HS (Whittier, CA)",6
1966,6,,114,14.0,Y,,Robert Welz (minors),1B,,,,,,,,,,,,,4Yr,"Harvard University (Cambridge, MA)",6
1965,6,,111,11.0,Y,,Dennis Grossini (minors),LHP,,,,,,,,,,,,,HS,"Lompoc HS (Lompoc, CA)",6
2023,7,,200,6.0,Y,"$222,500",John Peck (minors),SS,,,,,,,,,,,,,4Yr,"Pepperdine University (Malibu, CA)",7
2022,7,,207,11.0,Y,"$300,000",Seth Stephenson (minors),OF,,,,,,,,,,,,,4Yr,"University of Tennessee (Knoxville, TN)",7
2021,7,,195,3.0,Y,"$241,000",Brant Hurter (minors),P,,,,,,,,,,,,,4Yr,"Georgia Institute of Technology (Atlanta, GA)",7
2019,7,,202,5.0,Y,"$227,700",Zack Hess (minors),P,,,,,,,,,,,,,4Yr,"Louisiana State University (Baton Rouge, LA)",7
2018,7,,195,1.0,Y,"$231,900",Eric De La Rosa (minors),OF,,,,,,,,,,,,,JC,"Grossmont College (El Cajon, CA)",7
2017,7,,215,20.0,Y,"$189,100",Brad Bass (minors),RHP,,,,,,,,,,,,,4Yr,"University of Notre Dame (South Bend, IN)",7
2016,7,,205,9.0,Y,"$216,900",Austin Sodders (minors),LHP,,,,,,,,,,,,,4Yr,"University of California, Riverside (Riverside, CA)",7
2015,7,,220,25.0,N,,Nick Shumpert (minors),SS,,,,,,,,,,,,,HS,"Highlands Ranch HS (Highlands Ranch, CO)",7
2014,7,,220,25.0,Y,"$165,000",Joey Pankake (minors),3B,,,,,,,,,,,,,4Yr,"University of South Carolina (Columbia, SC)",7
2013,7,,216,20.0,Y,"$55,000",Connor Harrell (minors),CF,,,,,,,,,,,,,4Yr,"Vanderbilt University (Nashville, TN)",7
2012,7,,244,26.0,Y,"$142,000",Hudson Randall (minors),RHP,,,,,,,,,,,,,4Yr,"University of Florida (Gainesville, FL)",7
2011,7,,227,16.0,Y,"$125,000",Brian Flynn (minors),LHP,1.1,13.0,8.0,0.0,0.25,0.5,102.0,6.0,12.0,4.41,1.58,1.0,4Yr,"Wichita State University (Wichita, KS)",7
2010,7,,223,18.0,Y,"$115,000",Corey Jones (minors),2B,,,,,,,,,,,,,4Yr,"California State University, Fullerton (Fullerton, CA)",7
2009,7,,210,9.0,Y,"$125,000",Jamie Johnson (minors),CF,,,,,,,,,,,,,4Yr,"University of Oklahoma (Norman, OK)",7
2008,7,,223,21.0,Y,"$150,000",Jade Todd (minors),LHP,,,,,,,,,,,,,HS,"Shades Valley HS (Birmingham, AL)",7
2007,7,,241,27.0,Y,"$25,000",Devin Thomas (minors),C,,,,,,,,,,,,,4Yr,"Brown University (Providence, RI)",7
2006,7,,202,6.0,Y,"$150,000",Jonah Nickerson (minors),RHP,,,,,,,,,,,,,4Yr,"Oregon State University (Corvallis, OR)",7
2005,7,,210,10.0,Y,"$27,500",P.J. Finigan (minors),RHP,,,,,,,,,,,,,4Yr,"Southern Illinois University Carbondale (Carbondale, IL)",7
2004,7,,193,2.0,N,,Chris Carpenter (minors),RHP,0.0,7.0,0.0,0.0,,,18.0,1.0,0.0,5.17,2.3,0.0,HS,"Bryan HS (Bryan, OH)",7
2003,7,,190,3.0,Y,"$132,500",Virgil Vasquez (minors),RHP,-1.1,14.0,10.0,0.0,0.0,0.0,19.0,2.0,6.0,6.6,1.76,0.0,4Yr,"University of California, Santa Barbara (Santa Barbara, CA)",7
2002,7,,200,8.0,Y,,Wilton Reynolds (minors),OF,,,,,,,,,,,,,4Yr,"Oral Roberts University (Tulsa, OK)",7
2001,7,,207,11.0,Y,,Tom Farmer (minors),RHP,,,,,,,,,,,,,4Yr,"University of Miami (Coral Gables, FL)",7
2000,7,,198,8.0,Y,,Ronnie Merrill (minors),SS,,,,,,,,,,,,,4Yr,"University of Tampa (Tampa, FL)",7
1999,7,,207,3.0,Y,,Tim Kalita (minors),LHP,,,,,,,,,,,,,4Yr,"University of Notre Dame (South Bend, IN)",7
1998,7,,207,14.0,Y,,Clint Smith (minors),RHP,,,,,,,,,,,,,4Yr,"University of Oklahoma (Norman, OK)",7
1997,7,,205,1.0,Y,,Michael Diebolt (minors),LHP,,,,,,,,,,,,,4Yr,"University of Minnesota (Minneapolis, MN)",7
1996,7,,191,6.0,Y,,Scott Sollmann (minors),OF,,,,,,,,,,,,,4Yr,"University of Notre Dame (South Bend, IN)",7
1995,7,,182,11.0,Y,,Chris Manser (minors),RHP,,,,,,,,,,,,,HS,"Hillsborough HS (Tampa, FL)",7
1994,7,,193,18.0,Y,,Neil Garcia (minors),C,,,,,,,,,,,,,4Yr,"University of Nevada, Reno (Reno, NV)",7
1993,7,,193,9.0,Y,,Greg Granger (minors),RHP,,,,,,,,,,,,,JC,"Florida Gateway College (Lake City, FL)",7
1992,7,,196,16.0,Y,,Pat Ahearne (minors),RHP,-0.4,0.0,0.0,0.0,,,4.0,0.0,2.0,11.7,2.5,0.0,4Yr,"Pepperdine University (Malibu, CA)",7
1991,7,,192,15.0,Y,,Art Adams (minors),RHP,,,,,,,,,,,,,JC,"Laney College (Oakland, CA)",7
1990,7,,184,3.0,N,,Randy Curtis (minors),OF,,,,,,,,,,,,,JC,"Riverside City College (Riverside, CA)",7
1989,7,,187,21.0,Y,,Eric Albright (minors),C,,,,,,,,,,,,,4Yr,"Texas A&M University (College Station, TX)",7
1988,7,,187,26.0,Y,,Tim Brader (minors),LHP,,,,,,,,,,,,,JC,"Shelton State Community College (Tuscaloosa, AL)",7
1987,7,,183,21.0,Y,,Christian Harley (minors),3B,,,,,,,,,,,,,JC,"Community College of Baltimore County, Catonsville Campus (Catonsville, MD)",7
1986,7,,177,18.0,Y,,Darryl Martin (minors),OF,,,,,,,,,,,,,HS,"Roberto Clemente Community Academy (Chicago, IL)",7
1985,7,,184,26.0,Y,,Doug Strange (minors),2B,0.5,707.0,1859.0,31.0,0.234,0.633,,,,,,,4Yr,"North Carolina State University (Raleigh, NC)",7
1984,7,,182,24.0,Unk,,Damon Allen (minors),RHP,,,,,,,,,,,,,4Yr,"California State University, Fullerton (Fullerton, CA)",7
1983,7,,173,15.0,Y,,Anthony Cunningham (minors),OF,,,,,,,,,,,,,HS,"Denton HS (Denton, TX)",7
1982,7,,178,20.0,Y,,Kerry Cook (minors),RHP,,,,,,,,,,,,,4Yr,"Bradley University (Peoria, IL)",7
1981,7,,172,17.0,Y,,Chuck Cary (minors),LHP,3.1,20.0,1.0,0.0,0.0,0.0,134.0,14.0,26.0,4.17,1.34,3.0,4Yr,"University of California, Berkeley (Berkeley, CA)",7
1980,7,,173,18.0,Y,,Stan Younger (minors),OF,,,,,,,,,,,,,4Yr,"Brigham Young University (Provo, UT)",7
1979,7,,169,13.0,Y,,Charlie Nail (minors),RHP,,,,,,,,,,,,,HS,"McCluer Academy (Jackson, MS)",7
1978,7,,168,12.0,Y,,Bruce Fields (minors),OF,-0.2,58.0,113.0,1.0,0.274,0.681,,,,,,,HS,"Everett HS (Lansing, MI)",7
1977,7,,161,5.0,Y,,Rick Peters (minors),OF,3.2,307.0,919.0,2.0,0.278,0.699,,,,,,,4Yr,"Arizona State University (Tempe, AZ)",7
1976,7,,146,2.0,N,,Ozzie Smith (minors),SS,76.9,2573.0,9396.0,28.0,0.262,0.666,,,,,,,4Yr,"California Polytechnic State University, San Luis Obispo (San Luis Obispo, CA)",7
1975,7,,147,3.0,Y,,Dana McManus (minors),RHP,,,,,,,,,,,,,4Yr,"Chapman University (Orange, CA)",7
1974,7,,160,16.0,Y,,David Balbierz (minors),RHP,,,,,,,,,,,,,JC,"Hilbert College (Hamburg, NY)",7
1973,7,,163,19.0,N,,Robert Stadnika (minors),RHP,,,,,,,,,,,,,HS,"Eisenhower HS (Saginaw, MI)",7
1972,7,,164,20.0,Y,,Roy Haney (minors),C,,,,,,,,,,,,,HS,"Byng HS (Ada, OK)",7
1971,7,,159,12.0,Y,,Gene Pentz (minors),RHP,0.1,91.0,19.0,0.0,0.053,0.153,104.0,8.0,9.0,3.63,1.49,7.0,HS,"Johnstown Liberty HS (Johnstown, PA)",7
1970,7,,168,21.0,N,,Paul Spivey (minors),OF,,,,,,,,,,,,,HS,"Lee HS (Montgomery, AL)",7
1969,7,,163,19.0,N,,Dan Bielski (minors),RHP,,,,,,,,,,,,,4Yr,"Michigan State University (East Lansing, MI)",7
1968,7,,150,18.0,Y,,Daryl Busen (minors),RHP,,,,,,,,,,,,,HS,"Fordson HS (Dearborn, MI)",7
1967,7,,135,15.0,Y,,Mike Adams (minors),SS,,,,,,,,,,,,,HS,"St. Elizabeth HS (Oakland, CA)",7
1966,7,,134,14.0,Y,,Hagan Andersen (minors),INF,,,,,,,,,,,,,4Yr,"University of Massachusetts Amherst (Amherst, MA)",7
1965,7,,131,11.0,N,,William Bradley (minors),SS,,,,,,,,,,,,,HS,"Palestine HS (Palestine, TX)",7
2023,8,,230,6.0,Y,"$247,500",Jatnk Diaz (minors),P,,,,,,,,,,,,,HS,"Hazleton HS (Hazleton, PA)",8
2022,8,,237,11.0,Y,"$150,000",Jake Miller (minors),P,,,,,,,,,,,,,4Yr,"Valparaiso University (Valparaiso, IN)",8
2021,8,,225,3.0,Y,"$150,000",Jordan Marks (minors),P,,,,,,,,,,,,,4Yr,"University of South Carolina Upstate (Spartanburg, SC)",8
2019,8,,232,5.0,Y,"$135,000",Jack Kenley (minors),SS,,,,,,,,,,,,,4Yr,"University of Arkansas (Fayetteville, AR)",8
2018,8,,225,1.0,Y,"$182,900",Jeremiah Burks (minors),SS,,,,,,,,,,,,,4Yr,"California State University, Fresno (Fresno, CA)",8
2017,8,,245,20.0,Y,"$20,000",Max Green (minors),LHP,,,,,,,,,,,,,4Yr,"Pepperdine University (Malibu, CA)",8
2016,8,,235,9.0,Y,"$181,600",Jacob Robson (minors),CF,-0.2,4.0,7.0,0.0,0.0,0.0,,,,,,,4Yr,"Mississippi State University (Mississippi State, MS)",8
2015,8,,250,25.0,Y,"$50,000",Dominic Moreno (minors),RHP,,,,,,,,,,,,,4Yr,"Texas Tech University (Lubbock, TX)",8
2014,8,,250,25.0,Y,"$60,000",Artie Lewicki (minors),RHP,0.0,2.0,0.0,0.0,,,19.0,0.0,3.0,5.16,1.78,0.0,4Yr,"University of Virginia (Charlottesville, VA)",8
